"gmt_time","hk_time","subject"
"2019-09-16 06:34:00","2019-09-16 14:34:00","OPEC Chief Barkindo held talks with the IEA chief on Monday, reiterated that security of oil supply makes a top priority, expressed satisfaction that the situation has been brought under control by the Saudi Authorities"
"2019-09-16 06:26:00","2019-09-16 14:26:00","Indian Oil Ministry state that Saudi Aramco has informed Indian refiners that there will not be a supply shortage"
"2019-09-16 06:25:00","2019-09-16 14:25:00","Iran's Foreign Minister says there will be no meeting between US President Trump and Iran's President Rouhani at the upcoming UN Assembly., Iranian TV"
"2019-09-16 06:15:00","2019-09-16 14:15:00","Iran state that legal proceedings against the UK flagged tanker Stena Impero have nearly completed, the vessel is set to released soon., Iranian TV"
"2019-09-16 05:58:00","2019-09-16 13:58:00","Additional European equity stories post the release of the Daily European equity opening news"
"2019-09-16 05:55:00","2019-09-16 13:55:00","Russian Energy Minister Novak says there is enough commercial stockpile to cover the shortfall from Saudi Arabia, intends to speak with the Saudi Arabia Energy Minister today; no immediate need for a OPEC+ meeting"
"2019-09-16 05:53:00","2019-09-16 13:53:00","Russian Kremlin spokesman says we will have to wait and see what occurs in Saudi Arabia before any decision can be taken regarding Russian oil production; Russian Energy Minister Novak says we are in contact with Saudi Arabia"
"2019-09-16 05:49:00","2019-09-16 13:49:00","DAILY EUROPEAN EQUITY OPENING NEWS"
"2019-09-16 05:33:00","2019-09-16 13:33:00","Major FX option expiries for today's NY cut"
"2019-09-16 05:26:00","2019-09-16 13:26:00","RANsquawk Daily European Opening News - 16th September 2019 "
"2019-09-16 04:45:00","2019-09-16 12:45:00","Unverified twitter reports state senior US administration official said Iran launched nearly a dozen cruise missiles and more than 20 drones from its territory in attack on Saudi oil facilities on Saturday - Unconfirmed"
"2019-09-16 04:38:00","2019-09-16 12:38:00","ASIA-PAC MARKET WRAP: Asia traded cautiously and oil surged after the attack on Saudi facilities, while disappointing Chinese data and this week's heavy central bank slate added to the tentativeness "
"2019-09-16 04:18:00","2019-09-16 12:18:00","Indonesia Trade Balance (Aug) 60M vs. Exp. 190M (Prev. -60M)"
"2019-09-16 04:18:00","2019-09-16 12:18:00","Indonesia Imports (Aug) Y/Y -15.6% vs. Exp. -12.9% (Prev. -15.2%)"
"2019-09-16 04:04:00","2019-09-16 12:04:00","Indonesia Exports (Aug) Y/Y -10.0% vs. Exp. -6.0% (Prev. -5.1%)"
"2019-09-16 03:33:00","2019-09-16 11:33:00","South Korea is reportedly willing to reconsider intelligence agreement if Japan export curbs are lifted"
"2019-09-16 03:30:00","2019-09-16 11:30:00","PRE-MARKET INDIA STOCK NEWS: India’s Finance Minister announced more than INR 700bln worth of measures to boost exports and economy amid economic slowdown "
"2019-09-16 03:12:00","2019-09-16 11:12:00","Lend Lease (LLC AT) expected to launch SGD 750mln Singapore IPO as soon as tomorrow"
"2019-09-16 03:08:00","2019-09-16 11:08:00","ASIA-PAC MID-SESSION UPDATE: Asia begins the week cautious as oil surges and geopolitical concerns heighten following attacks on Saudi oil facilities, while disappointing Chinese data and this week's heavy central bank slate add to the tentativeness"
"2019-09-16 02:44:00","2019-09-16 10:44:00","Ord Minnett is thought to be the leading candidate to acquire CommSec Advisory from CBA (CBA AT)"
"2019-09-16 02:39:00","2019-09-16 10:39:00","US Senators to seek FCC review of licences for China Telecom (728 HK) and China Unicom (762 HK)"
"2019-09-16 02:37:00","2019-09-16 10:37:00","China stats bureau says China is able to reach full-year growth target, adds China will move forward with local government special bond issuance to support infrastructure investment"
"2019-09-16 02:03:00","2019-09-16 10:03:00","China stats bureau says China will increase counter cyclical adjustments, adds sees significantly increasing external uncertainties and that China's economy faces downward pressure"
"2019-09-16 02:03:00","2019-09-16 10:03:00","China stats bureau says China will increase counter cyclical adjustments, adds sees significantly increasing external uncertainties and that China's economy faces downward pressure"
"2019-09-16 02:00:00","2019-09-16 10:00:00","Chinese Unemployment Rate (Aug) 5.2% (Prev. 5.3%)"
"2019-09-16 02:00:00","2019-09-16 10:00:00","Chinese Property Investment YTD (Aug) 10.5% (Prev. 10.6%)"
"2019-09-16 02:00:00","2019-09-16 10:00:00","Chinese Retail Sales YTD (Aug) Y/Y 8.2% vs. Exp. 8.3% (Prev. 8.3%)"
"2019-09-16 02:00:00","2019-09-16 10:00:00","Chinese Industrial Production YTD (Aug) Y/Y 5.6% vs. Exp. 5.8% (Prev. 5.8%)"
"2019-09-16 01:51:00","2019-09-16 09:51:00","Nordea enters short EUR/NOK position with a target of 9.80 and stop loss at 10.02 as it anticipates potential hawkish Norges Bank"
"2019-09-16 01:15:00","2019-09-16 09:15:00","PBoC skips open market operations and states that liquidity in the banking system remains at a relatively high level as RRR cut takes effect"
"2019-09-16 01:15:00","2019-09-16 09:15:00","PBoC sets CNY mid-point at 7.0657 vs. Exp. 7.0713 (Prev. 7.0846)"
"2019-09-16 01:05:00","2019-09-16 09:05:00","Ascendas Hospitality Trust (ASCHT SP) terminates deal to make an acquisition in Melbourne"
"2019-09-16 00:57:00","2019-09-16 08:57:00","PRE-MARKET CHINESE STOCK NEWS: LSE (LSE LN) rejected approach by HKEX (388 HK); China Premier Li said maintaining economic growth at 6% or higher is very difficult, while Industrial Production and Retail Sales data looms"
"2019-09-16 00:31:00","2019-09-16 08:31:00","PRE-MARKET TAIWAN AND SINGAPORE NEWS: Keppel DC REIT (KDCREIT SP) launches equity fund and raised gross proceeds of SGD 473.8mln"
"2019-09-16 00:24:00","2019-09-16 08:24:00","PBoC is expected to set USD/CNY mid-point at 7.0713, according to a major newswire estimate"
"2019-09-16 00:14:00","2019-09-16 08:14:00","Venezuela opposition leader Guaido says talks with the government are over"
"2019-09-16 00:05:00","2019-09-16 08:05:00","Asia equity markets begin cautious as oil prices surge and geopolitical concerns heighten following the attacks on Saudi refineries, while looming Chinese Industrial Production and this week's heavy slate of central bank activity add to the tentative tone"
"2019-09-16 00:04:00","2019-09-16 08:04:00","New Zealand Institute of Economic Research lowers FY19/20 GDP forecast to 2.3% from 2.5%"