"gmt_time","hk_time","subject"
"2019-06-20 02:35:00","2019-06-20 10:35:00","RBA Governor Lowe says possibility of lower rates remain on the table and that it is not unrealistic to expect a further reduction in the Cash Rate"
"2019-06-20 02:34:00","2019-06-20 10:34:00","ASIA-PAC MID-SESSION UPDATE: Asia stocks gain as the region digests the dovish Fed"
"2019-06-20 02:01:00","2019-06-20 10:01:00","US President Trump says it is important to have a good relationship with China and Russia, adds will meet with Russian President Putin at the G20"
"2019-06-20 01:58:00","2019-06-20 09:58:00","US Trade Representative Lighthizer says will meet with China Vice Premier Liu He this week and again before Trump-Xi meeting at the G20"
"2019-06-20 01:33:00","2019-06-20 09:33:00","RBA issues its quarterly bulletin which contains insights on economy and financial system"
"2019-06-20 01:15:00","2019-06-20 09:15:00","PBoC injects CNY 30bln via 14-day reverse repos"
"2019-06-20 01:15:00","2019-06-20 09:15:00","PBoC sets CNY mid-point at 6.8805 (Prev. 6.8893)"
"2019-06-20 01:09:00","2019-06-20 09:09:00","PRE-MARKET CHINA STOCK NEWS: US Trade Representative Robert Lighthizer said he will meet with his Chinese counterpart ahead of Trump-Xi meeting at G20 and that it is in the interest of both the US and China to have successful talks"
"2019-06-20 01:03:00","2019-06-20 09:03:00","Gold prices spike overnight in a continuation of the post-FOMC upside in the precious metal with prices at their highest since 2013"
"2019-06-20 00:58:00","2019-06-20 08:58:00","China's TCL (000100 CH) and Visionox Technology are interested in joining bailout deal for Japan Display (6740 JT)"
"2019-06-20 00:42:00","2019-06-20 08:42:00","National Broadband Network is considering lowering wholesale prices in Australia"
"2019-06-20 00:42:00","2019-06-20 08:42:00","National Broadband Network is considering lowering wholesale prices in Australia"
"2019-06-20 00:33:00","2019-06-20 08:33:00","10yr JGBs are firmly higher as T-notes extend on post-FOMC gains with the US 10yr yield under 2% and at its lowest level since November 2016"
"2019-06-20 00:25:00","2019-06-20 08:25:00","Deutsche Bank (DBK GY) is under criminal investigation in US for allegedly failing to comply with anti-money laundering regulations"
"2019-06-20 00:23:00","2019-06-20 08:23:00","PRE-MARKET TAIWAN AND SINGAPORE NEWS: Yanlord Land Group (YLLG SP) announced CNY 1.34bln of pre-sales from its Shenzhen launch"
"2019-06-20 00:21:00","2019-06-20 08:21:00","Nissan (7201 JP) reportedly resolved corporate governance issues with Renault (RNO FP) in which the CEO of the French automaker will get an audit committee seat on Nissan's board"
"2019-06-20 00:19:00","2019-06-20 08:19:00","Morgan Stanley says it sees the FOMC cutting rates by 50bps in July"