"gmt_time","hk_time","subject"
"2019-03-05 04:15:00","2019-03-05 12:15:00","Indian Trade Ministry Official says US and India were able to work out an extensive and reasonable package which covered almost all US concerns, although the advantages under the US GDP are ""minimal and moderate"""
"2019-03-05 03:39:00","2019-03-05 11:39:00","Ex-Nissan (7201 JT) chairman Ghosn has been granted bail (set at JPY 1bln) by Tokyo court and he could be released as early as today; also of note for Renault (RNO FP)"
"2019-03-05 03:35:00","2019-03-05 11:35:00","Japan sells JPY 2.2tln 0.10% 10yr JGBs, b/c 4.25x (Prev. 4.80x), average yield -0.002% (Prev. -0.013%)"
"2019-03-05 03:33:00","2019-03-05 11:33:00","RBA reiterates that low rates are supporting the economy, progress on unemployment and inflation to pick up gradually alongside underlying inflation"
"2019-03-05 03:26:00","2019-03-05 11:26:00","PRE-MARKET INDIA STOCK NEWS: - US President Trump plans to terminate India and Turkey as Generalised System of Preferences beneficiaries"
"2019-03-05 03:22:00","2019-03-05 11:22:00","China Commerce Ministry says US and China should meet halfway if they want to reach a deal"
"2019-03-05 03:18:00","2019-03-05 11:18:00","China Commerce Minister says US-China trade talks have been ""very short"" even after the extension, although working teams from both sides are working right now"
"2019-03-05 03:17:00","2019-03-05 11:17:00","Indian government source stated that the benefit from the US GSP is only around USD 250mln per annum"
"2019-03-05 03:05:00","2019-03-05 11:05:00","US President Trump's former Lawyer Cohen's attorney reportedly raised the possibility of a pardon with attorneys for the president; according to WSJ"
"2019-03-05 02:58:00","2019-03-05 10:58:00","China Banking and Insurance regulator says US and China can absolutely reach an agreement on the financial sector; and added that China did not engage in competitive devaluation of the Yuan"
"2019-03-05 02:23:00","2019-03-05 10:23:00","China Sovereign Wealth Fund President Tu plans bilateral funds with France and Italy"
"2019-03-05 02:20:00","2019-03-05 10:20:00","RANsquawk Central Banks - PREVIEW: RBA Rate Decision due Tuesday 4th March at 0330GMT/2130CST/1130HKT"
"2019-03-05 02:09:00","2019-03-05 10:09:00","ASIA-PAC MID SESSION UPDATE: Antipodeans dented as China’s services gauge indicate weakest growth in four months"
"2019-03-05 01:56:00","2019-03-05 09:56:00","Rail services between India and Pakistan have now resumed after being halted amid the recent conflict; according to Indian press"
"2019-03-05 01:47:00","2019-03-05 09:47:00","Since Monday, February 25, Morgan Stanley positioning has shifted. Within G10, the largest shorts are now in CAD and CHF; there are no significant longs, but JPY remains closest to long."
"2019-03-05 01:46:00","2019-03-05 09:46:00","Chinese Caixin Composite PMI Feb 50.7 (Prev. 50.9)"
"2019-03-05 01:15:00","2019-03-05 09:15:00","PBoC drains a net CNY 120bln on the day "
"2019-03-05 01:15:00","2019-03-05 09:15:00","PBoC sets CNY mid-point at 6.6998 (Prev. 6.7049)"
"2019-03-05 01:02:00","2019-03-05 09:02:00","PRE-MARKET CHINA STOCK NEWS: - China sets 2019 GDP growth target at 6.0-6.5% (vs. Prev. “around 6.5%) and CPI at 3.0% as expected; fiscal policy to be proactive and monetary policy to be prudent"
"2019-03-05 01:00:00","2019-03-05 09:00:00","US Housing and Urban Development Secretary Carson intends to leave his post at the end of US President Trump's term; according to Washington Post"
"2019-03-05 00:36:00","2019-03-05 08:36:00","China are to increase flexibility of Yuan exchange rate"
"2019-03-05 00:32:00","2019-03-05 08:32:00","China are to implement consensus reached between US and Chinese leaders in Argentina; China State Planner"
"2019-03-05 00:31:00","2019-03-05 08:31:00","Japan Services PMI (Feb) 52.3 (Prev. 51.6)"
"2019-03-05 00:28:00","2019-03-05 08:28:00","China says it needs to brace for a tough economic battle "
"2019-03-05 00:23:00","2019-03-05 08:23:00","China will maintain pace and strength in risk prevention, and higher budget deficit ration will leave more policy room for resolving potential risks"
"2019-03-05 00:22:00","2019-03-05 08:22:00","China will make economic policy for forward-looking, targeted and effective"
"2019-03-05 00:22:00","2019-03-05 08:22:00","China will make economic policy for forward-looking, targeted and effective"
"2019-03-05 00:15:00","2019-03-05 08:15:00","China plans to cut manufacturing VAT to 13% from 16%, as touted earlier in the session, VAT for transport and construction sectors to be reduced to 9% from prior 10%"
"2019-03-05 00:11:00","2019-03-05 08:11:00","China's Premier Li says China will step up targeted RRR cuts for smaller and medium-sized banks to support private and smaller firms "
"2019-03-05 00:08:00","2019-03-05 08:08:00","China targets a steady rise in trade and sets budget deficit at 2.8% of GDP vs. 2.6% in 2018"
"2019-03-05 00:08:00","2019-03-05 08:08:00","China will keep the Yuan basically stable at reasonable equilibrium; China State Planner"
"2019-03-05 00:02:00","2019-03-05 08:02:00","China will expand infrastructure investments in 2019; Xinhua"
"2019-03-05 00:01:00","2019-03-05 08:01:00","China sets 2019 GDP growth target at 6.0-6.5% (vs. Prev. ""around 6.5%"") and CPI at 3.0% as expected; fiscal policy to be proactive and monetary policy to be prudent"