"gmt_time","hk_time","subject"
"2019-04-09 08:30:00","2019-04-09 16:30:00","Daimler (DAI GY) Mercedes-Benz brand deliveries -5.6% in Q1 to 560.87k units, March deliveries -4.1% to 227.6k units"
"2019-04-09 08:29:00","2019-04-09 16:29:00","Telenor (TEL NO) says they had not had any contacts with DNA (DNA FH) prior to their EUR 1.5bln deal, and that their share buyback programme will continue as normal"
"2019-04-09 08:06:00","2019-04-09 16:06:00","Italian economic outlook is set for approval by the Cabinet Tuesday PM, with Italian PM Conte to host government talks on the economic outlook prior to this., according to a Italian Official"
"2019-04-09 08:00:00","2019-04-09 16:00:00","ECB lending survey states that banks expect credit standards to ease for loans to enterprises and for consumer credit in Q2"
"2019-04-09 07:59:00","2019-04-09 15:59:00","Level of action taken against Airbus (AIR FP) subsidies is 'greatly exaggerated', according to the European Commission source"
"2019-04-09 07:56:00","2019-04-09 15:56:00","RANsquawk Bond Auction Previews - 9th April 2019"
"2019-04-09 07:56:00","2019-04-09 15:56:00","RANsquawk Bond Auction Previews - 9th April 2019"
"2019-04-09 07:50:00","2019-04-09 15:50:00","Italian Debt/GDP ratio revised to 132.2% vs. prev. 132.1% as per Bank of Italy"
"2019-04-09 07:38:00","2019-04-09 15:38:00","Japanese government stake in Japan Post (6178 JT) is viewed as slipping towards the legally permitted minimum of 'above 1/3' from the current circa 60%, according to the Nikkei "
"2019-04-09 07:35:00","2019-04-09 15:35:00","China's March retail passenger vehicle sales 1.78mln units, -12% Y/Y; car sales fall for the 10th consecutive month"
"2019-04-09 07:28:00","2019-04-09 15:28:00","Gilts lag pre-DMO auction, Short Sterling futures narrowly mixed"
"2019-04-09 07:26:00","2019-04-09 15:26:00","China and the US have made substantial progress in the latest trade talks according to China's Foreign Ministry Spokesman Lu"
"2019-04-09 07:18:00","2019-04-09 15:18:00","Conservative MP Gauke says that it is too early to say if the Tories & Labour can achieve a deal on Brexit., CityAM's Bennett"
"2019-04-09 07:17:00","2019-04-09 15:17:00","Indian refiners are holding back from purchasing Iranian oil loading in May as they await further clarity on potential further oil waivers "
"2019-04-09 07:08:00","2019-04-09 15:08:00","Chinese State Council reiterates its view that the relevant authorities should enforce proper usage of interest rates and reserve requirements to expand credit and reduce lending costs "
"2019-04-09 07:04:00","2019-04-09 15:04:00","European equity movers this morning: Randstad (RAND NA) +2.0%; Zalando (ZAL GY) +1.1%; WPP Group (WPP LN) +0.6%; Novartis (NOVN SW) -10.8%; SAP (SAP GY) -2.6%; Airbus (AIR FP) -1.7%; Severn Trent (SVT LN) -1.4%"
"2019-04-09 07:04:00","2019-04-09 15:04:00","Shell (RDSA LN) - Co. report that the strike at their Pernis refinery has had a 'significant' impact"
"2019-04-09 07:00:00","2019-04-09 15:00:00","Istat upgraded Italy's 2017 GDP growth to 1.7% (Prev. 1.6%) whilst maintaining 2018 at 0.9%. Istat makes no chances to Italy's deficit/GDP ratios"
"2019-04-09 06:44:00","2019-04-09 14:44:00","Books for Saudi Aramco's USD bond has reportedly risen over USD 85bln, according to sources"
"2019-04-09 06:41:00","2019-04-09 14:41:00","Bunds: paring losses ahead of the EU cash equity opens"
"2019-04-09 06:28:00","2019-04-09 14:28:00","Equatorial Guinea crude oil output currently stands at 120k BPD, according to the country's oil minister"
"2019-04-09 06:19:00","2019-04-09 14:19:00","Iranian President Rouhani says if US pressure continues, Iran will produce IR8 Advanced Centrifuges"
"2019-04-09 06:02:00","2019-04-09 14:02:00","Major FX option expiries for today's NY cut"
"2019-04-09 05:59:00","2019-04-09 13:59:00","Additional European equity stories post the release of the Daily European equity opening news"
"2019-04-09 05:51:00","2019-04-09 13:51:00","DAILY EUROPEAN EQUITY OPENING NEWS"
"2019-04-09 05:19:00","2019-04-09 13:19:00","RANsquawk Daily European Opening News - 9th April 2019 "
"2019-04-09 05:10:00","2019-04-09 13:10:00","Goldman Sachs expects further backwardation and modest upside in the energy complex due to lower projected inventories. Q2 2019 forecast raised to USD 72.50/bbl (Prev. USD 65.00/bbl) and maintains its USD 60.00/bbl 2020 forecast"
"2019-04-09 05:02:00","2019-04-09 13:02:00","FULL PRELIM LIST: USTR Proposes Products for Tariff Countermeasures in Response to Harm Caused by EU Aircraft Subsidies"
"2019-04-09 04:55:00","2019-04-09 12:55:00","ASIA-PAC MARKET WRAP: Asia stocks were somewhat indecisive after a similar Wall St lead with participants tentative ahead of this week's central bank activity and earnings season"
"2019-04-09 04:15:00","2019-04-09 12:15:00","Iran places US central command on its terror list"
"2019-04-09 04:05:00","2019-04-09 12:05:00","State Bank of India (SBIN IS) may announce INR 100bln-150bln share offering this week"
"2019-04-09 03:35:00","2019-04-09 11:35:00","Japan sells JPY 1.54tln in 5yr JGBs b/c 5.31 vs. Prev. 4.71, avg. yield -0.164% vs. Prev. -0.115%"
"2019-04-09 03:29:00","2019-04-09 11:29:00","EU is to set a high price for delaying Brexit including UK to give up rights in future EU budget and trade talks, while it will force UK into a no-deal Brexit if it seeks to cancel election to European Parliament "
"2019-04-09 03:24:00","2019-04-09 11:24:00","PRE-MARKET INDIA STOCK NEWS: Jet Airways (JETIN IS) received no investor response on the first day of call for expressions of interest in the troubled airline"
"2019-04-09 03:01:00","2019-04-09 11:01:00","ASIA-PAC MID-SESSION UPDATE: Asia trades indecisive after similar Wall St lead with participants tentative ahead of this week's central bank activity and earnings season"
"2019-04-09 02:29:00","2019-04-09 10:29:00","China reduces taxes on personal items bought abroad to 13% from 15% in an effort to boost consumption"
"2019-04-09 02:22:00","2019-04-09 10:22:00","China National Audit Office said certain banks in Henan province recorded that 40% of their loan books consisted of bad debts"
"2019-04-09 02:06:00","2019-04-09 10:06:00","China Aircraft Leasing (1848 HK) denies report it is planning to change its order for 100 Boeing (BA) 737 Max jets and says there is no payment suspension"
"2019-04-09 01:39:00","2019-04-09 09:39:00","China Coal Association says 2019 domestic coal output is to increase by 100mln tons"
"2019-04-09 01:30:00","2019-04-09 09:30:00","Australian Investment Lending (Feb) 0.9% vs. Exp. -1.0% (Prev. -4.1%)"
"2019-04-09 01:30:00","2019-04-09 09:30:00","Australian Owner-Occupier Loan Value (Feb) M/M 3.4% vs. Exp. 1.0% (Prev. -1.3%)"
"2019-04-09 01:30:00","2019-04-09 09:30:00","Australian Home Loans (Feb) M/M 2.0% vs. Exp. -2.0%	(Prev. -2.6%)"
"2019-04-09 01:16:00","2019-04-09 09:16:00","Japan extends unilateral sanctions on North Korea by 2 years"
"2019-04-09 01:15:00","2019-04-09 09:15:00","PBoC sets CNY mid-point at 6.7142 (Prev. 6.7201)"
"2019-04-09 01:14:00","2019-04-09 09:14:00","PRE-MARKET CHINESE  STOCK NEWS: Great Wall Motor (2333 HK) March vehicle sales 103.1k units vs. Prev. 88.2k units Y/Y"
"2019-04-09 01:11:00","2019-04-09 09:11:00","PBoC skips open market operations for a net neutral daily position"
"2019-04-09 01:06:00","2019-04-09 09:06:00","Oil Search (OSH AT), Total (FP FP) and ExxonMobil (XOM) sign gas agreement with Papua New Guinea"
"2019-04-09 01:01:00","2019-04-09 09:01:00","Australia sells AUD 150mln 2.50% 2030 indexed bonds, b/c 5.3, avg. yield 0.33%"
"2019-04-09 00:37:00","2019-04-09 08:37:00","PRE-MARKET TAIWAN AND SINGAPORE NEWS: Gigabyte Technology (2376 TT) March sales fell 19.4% Y/Y to TWD 6.9bln"
"2019-04-09 00:25:00","2019-04-09 08:25:00","US State Department bans 16 Saudi nationals from entering the US due to role in Khashoggi murder"
"2019-04-09 00:20:00","2019-04-09 08:20:00","Crown Resorts (CWM AT) says it is in discussions with Wynn Resorts (WYNN) regarding potential change of control transaction following approach by Wynn"
"2019-04-09 00:07:00","2019-04-09 08:07:00","Japanese Economy Minister Motegi says first round of trade discussions with US will begin next week"
"2019-04-09 00:04:00","2019-04-09 08:04:00","Asia equity markets begin cautious following a similar performance from the major indices on Wall St amid tentativeness ahead of upcoming FOMC Minutes and earnings season"