"gmt_time","hk_time","subject"
"2019-12-02 00:34:00","2019-12-02 08:34:00","PRE-MARKET TAIWAN AND SINGAPORE NEWS: Hon Hai (2317 TT) is to assemble Huawei 5G handsets"
"2019-12-02 00:30:00","2019-12-02 08:30:00","Vietnam Manufacturing PMI (Nov) 51.0 (Prev. 50.0)"
"2019-12-02 00:30:00","2019-12-02 08:30:00","Japanese Manufacturing PMI (Nov F) 49.4 vs. Exp. 48.6 (Prev. 48.4)"
"2019-12-02 00:30:00","2019-12-02 08:30:00","Taiwan Manufacturing PMI (Nov) 49.8 (Prev. 49.8)"
"2019-12-02 00:30:00","2019-12-02 08:30:00","Philippines Manufacturing PMI (Nov) 51.4 (Prev. 52.1)"
"2019-12-02 00:30:00","2019-12-02 08:30:00","Thailand Manufacturing PMI (Nov) 49.3 (Prev. 50.0)"
"2019-12-02 00:30:00","2019-12-02 08:30:00","Malaysia Manufacturing PMI (Nov) 49.5 (Prev. 49.3)"
"2019-12-02 00:27:00","2019-12-02 08:27:00","PBoC is expected to set USD/CNY mid-point at 7.0247, according to a major newswire estimate"
"2019-12-02 00:24:00","2019-12-02 08:24:00","White House lawyer responds that President Trump cannot be fairly expected at December 4th impeachment hearing"
"2019-12-02 00:08:00","2019-12-02 08:08:00","Asia equity markets kick start the week on the front-foot with sentiment underpinned by Chinese PMI data over the weekend with headline Manufacturing PMI returning to expansion territory"
"2019-12-02 00:05:00","2019-12-02 08:05:00","UK Election Survation/Good Morning Britain poll: Conservatives 42% (+2), Labour 33% (+3). Lib Dems 11% (-4), Brexit Party 3% (-2), conducted November 26th-30th"
"2019-12-02 00:01:00","2019-12-02 08:01:00","Australia Sells AUD 300mln 3.0% 2047 Bonds  avg. yield 1.6494%, b/c 2.09"
"2019-12-02 00:00:00","2019-12-02 08:00:00","Australian MI Inflation Gauge (Nov) M/M 0.0% (Prev. 0.1%)"
"2019-12-02 00:00:00","2019-12-02 08:00:00","Australian MI Inflation Gauge (Nov) Y/Y 1.5% (Prev. 1.5%)"