"gmt_time","hk_time","subject"
"2019-09-18 07:00:00","2019-09-18 15:00:00","Daimler (DAI GY) - Co. have reached an agreement with CATL on the supply of batteries for electric trucks"
"2019-09-18 06:53:00","2019-09-18 14:53:00","Commerzbank says they ""do not consider the recent price surge to be sustainable and expect the price of brent oil to fall to $60 per barrel next year"""
"2019-09-18 06:50:00","2019-09-18 14:50:00","Airbus (AIR FP) has revised higher its 20-year forecast for new aircraft demand, but trims its forecast for 20-year average annual traffic growth to 4.3% from 4.4%"
"2019-09-18 06:30:00","2019-09-18 14:30:00","Major FX option expiries for today's NY cut"
"2019-09-18 06:30:00","2019-09-18 14:30:00","RANsquawk Bond Auction Previews - 18th September 2019 "
"2019-09-18 06:05:00","2019-09-18 14:05:00","Swedish Finance Minister says the 2020 budget contains tax cuts, new spending of SEK 29.6bln will have a financial effect of SEK 24bln"
"2019-09-18 06:00:00","2019-09-18 14:00:00","Euro Zone new car registrations (Aug): -8.4% (Prev. -7.8%)"
"2019-09-18 05:57:00","2019-09-18 13:57:00","Additional European equity stories post the release of the Daily European equity opening news"
"2019-09-18 05:52:00","2019-09-18 13:52:00","Japan's Foreign Minister seeks confirmation in US-Japan trade talks that no additional tariffs will be placed on Japanese cars"
"2019-09-18 05:50:00","2019-09-18 13:50:00","DAILY EUROPEAN EQUITY OPENING NEWS"
"2019-09-18 05:45:00","2019-09-18 13:45:00","Japan's Defence Minister says they are not aware of Iranian involvement in the attack on Saudi Arabia's refineries "
"2019-09-18 05:28:00","2019-09-18 13:28:00","Nissan (7201 JP) said to be seeking to offload its trading business for USD 1bln"
"2019-09-18 05:28:00","2019-09-18 13:28:00","RANsquawk Daily European Opening News - 18th September 2019 "
"2019-09-18 05:20:00","2019-09-18 13:20:00","Japanese regional bank lobby head says should not link debate on whether to charge fees on account holders to monetary policy"
"2019-09-18 05:15:00","2019-09-18 13:15:00","SoftBank (9984 JT) and Wirecard (WDI GY) sign strategic cooperation agreement"
"2019-09-18 05:00:00","2019-09-18 13:00:00","Venezuela's PDVSA has slowed its output at Western Oilfields due to lack of vessels for export and high inventories, according to sources"
"2019-09-18 04:45:00","2019-09-18 12:45:00","ASIA-PAC MARKET WRAP: Asia traded cautious amid pre-FOMC positioning"
"2019-09-18 04:33:00","2019-09-18 12:33:00","Orient Overseas International (316 HK) CEO Huang Xiaowen resigned and Wang Haimin has been appointed as next CEO"
"2019-09-18 04:08:00","2019-09-18 12:08:00","Saudi Arabia has decided to join the international alliance for safety and protection of maritime navigation"
"2019-09-18 03:35:00","2019-09-18 11:35:00","Japan sells 738.0bln in 20yr JGBs bid/cover 3.48 vs. Prev. 3.81, avg. yield 0.205% vs. Prev. 0.110%"
"2019-09-18 03:28:00","2019-09-18 11:28:00","PRE-MARKET INDIA STOCK NEWS: Steel Authority of India (SAIL IS) received clearance from mines ministry to offload up to 25% of total iron ore produced the prior year through open market"
"2019-09-18 03:18:00","2019-09-18 11:18:00","Line (3968 JT) launches crypto exchange Bitmax for users in Japan"
"2019-09-18 03:07:00","2019-09-18 11:07:00","China is said to be raising fuel prices by CNY 125/ton on Thursday"
"2019-09-18 03:07:00","2019-09-18 11:07:00","China is said to be raising fuel prices by CNY 125/ton on Thursday"
"2019-09-18 02:56:00","2019-09-18 10:56:00","ASIA-PAC MID-SESSION UPDATE: Asia trades with cautious gains amid pre-FOMC positioning"
"2019-09-18 02:20:00","2019-09-18 10:20:00","Japan Trade Minister says South Korea move to drop Japan from fast-track trade without enough explanation is extremely regrettable"
"2019-09-18 02:04:00","2019-09-18 10:04:00","China NDRC says August power consumption increased by 3.6% Y/Y"
"2019-09-18 01:47:00","2019-09-18 09:47:00","French President Macron spoke to Saudi Crown Prince MBS through telephone in which Macron stated the world should show no weakness against Aramco attacks "
"2019-09-18 01:16:00","2019-09-18 09:16:00","PBoC are to inject CNY 30bln via 7-day reverse repos for a net neutral daily position"
"2019-09-18 01:15:00","2019-09-18 09:15:00","PBoC sets CNY mid-point at 7.0728 vs. Exp. 7.0646 (Prev. 7.0730)"
"2019-09-18 01:00:00","2019-09-18 09:00:00","Australia sells AUD 1.2bln 1.5% 2031; b/c 2.0, average yield: 1.1779%"
"2019-09-18 00:57:00","2019-09-18 08:57:00","PRE-MARKET CHINESE STOCK NEWS: China National Chemical Engineering (6011117 CH) wins bid for CNY 5.5bln project."
"2019-09-18 00:56:00","2019-09-18 08:56:00","China and Russia reach an agreement to expand their agricultural trade"
"2019-09-18 00:50:00","2019-09-18 08:50:00","PBoC is expected to set USD/CNY mid-point at 7.0646, according to a major newswire estimate"
"2019-09-18 00:33:00","2019-09-18 08:33:00","PRE-MARKET TAIWAN AND SINGAPORE NEWS: Delta Electronics (2308 TT) announced to cooperate with Microsoft (MSFT) "
"2019-09-18 00:30:00","2019-09-18 08:30:00","Chinese President Xi calls on China to upgrade its manufacturing and real economy"
"2019-09-18 00:30:00","2019-09-18 08:30:00","Australian Westpac Leading Index (Aug) M/M -0.3% (Prev. 0.1%, Rev. 0.2%)"
"2019-09-18 00:02:00","2019-09-18 08:02:00","Asia equity markets begin with a mild positive tone following the marginal gains seen on Wall St amid positioning heading into an anticipated Fed rate cut"