"gmt_time","hk_time","subject"
"2019-03-11 10:50:00","2019-03-11 18:50:00","UK Lawmaker Cooper states that they would seek to force Parliament to hold votes on a no-deal and Brexit delay if Government decides not to hold them"
"2019-03-11 10:46:00","2019-03-11 18:46:00","Fixed Income: Gilts rebound further, while BTPs flounder"
"2019-03-11 10:44:00","2019-03-11 18:44:00","Yvette Copper has stated that UK PM May has promised votes on no-deal and an extension no matter what happens with the Meaningful Vote, believing they will be delivered this week; Sky's Cohen"
"2019-03-11 10:36:00","2019-03-11 18:36:00","UK Brexit Secretary Barclay may make a statement at 15:30 GMT; according to The Sun's Deputy Political Editor Steve Hawks"
"2019-03-11 10:32:00","2019-03-11 18:32:00","Kensington Town Hall as been evacuated as Police investigate 'suspicious package'; reported via Evening Standard"
"2019-03-11 10:27:00","2019-03-11 18:27:00","FX Morning Colour: Pound undermined by Brexit deadlock, Norwegian Crown underpinned by CPI"
"2019-03-11 10:23:00","2019-03-11 18:23:00","UK Labour Lawmaker Cooper says they are prepared with amendments if the PM will not work cross-party to find a path forward on Brexit"
"2019-03-11 10:22:00","2019-03-11 18:22:00","Italian Junior Minister says changes are necessary, including at the Bank of Italy, although 'nothing is moving' at the moment regarding the governing board"
"2019-03-11 10:14:00","2019-03-11 18:14:00","Irish PM Varadkar says an Article 50 extension would have to be with a purpose, it is too late for the UK to tell EU what it wants, adding that no one wants a rolling Brexit cliff edge"
"2019-03-11 09:38:00","2019-03-11 17:38:00","UBS FX spot ideas, 11th March 2019"
"2019-03-11 09:34:00","2019-03-11 17:34:00","Regarding ways PM May can make tomorrows meaningful vote provisional; one would be to press ahead to fufill the promise to commons, but accept a patsy backbench amendment to Cox. Another would be to hold a second vote straight after; Sun's Dunn"
"2019-03-11 09:30:00","2019-03-11 17:30:00","BoJ Board Member Kataoka says he think the possibility of the inflation rate rising toward 2 percent is low at the moment and that the momentum of inflation has not been strengthened. "
"2019-03-11 09:30:00","2019-03-11 17:30:00","Daimler (DAI GY): Mercedes-Benz Feb car deliveries of 160,544 -6.6%, Europe deliveries -0.1%, China deliveries -5.4%, US deliveries -12.5%. "
"2019-03-11 09:30:00","2019-03-11 17:30:00","BoJ Board Member Kataoka says he think the possibility of the inflation rate rising toward 2 percent is low at the moment and that the momentum of inflation has not been strengthened. "
"2019-03-11 09:30:00","2019-03-11 17:30:00","Daimler (DAI GY): Mercedes-Benz Feb car deliveries of 160,544 -6.6%, Europe deliveries -0.1%, China deliveries -5.4%, US deliveries -12.5%. "
"2019-03-11 09:16:00","2019-03-11 17:16:00","Libya's Harouge crude oil pipeline is leaking following a car crash; NOC"
"2019-03-11 09:01:00","2019-03-11 17:01:00","PM May is meeting with senior aides in No10 to plot a way through the week, told that it is most likely PM will change the vote tomorrow from a meaningful vote to a provisional one; Sun's Dunn"
"2019-03-11 09:01:00","2019-03-11 17:01:00","Ryanair (RYA LN) have passed resolutions to protect the Co's EU airline licences post-Brexit"
"2019-03-11 09:00:00","2019-03-11 17:00:00","ASIA-PAC SERVICE HAS NOW FINISHED, PLEASE REVERT BACK TO YOUR ORIGINAL CHANNEL FOR COVERAGE ON THE UK & EUROPEAN SESSION"
"2019-03-11 08:59:00","2019-03-11 16:59:00","UK debt and STIR futures regroup after early Liffe wobble"
"2019-03-11 08:55:00","2019-03-11 16:55:00","Morgan Stanley trade of the week: Long EUR/USD at market (1.1246), target 1.18 and stop 1.10"
"2019-03-11 08:54:00","2019-03-11 16:54:00","RANsquawk Bond Auction Previews - 11th March 2019"
"2019-03-11 08:52:00","2019-03-11 16:52:00","HKMA has intervened to protect the HKD, according to Hedgeye Risk Management CEO McCullough"
"2019-03-11 08:46:00","2019-03-11 16:46:00","ITV's Peston notes that he can find no one in the Cabinet or on the backbenches who any longer believes Theresa May will be PM for longer than a few weeks"
"2019-03-11 08:46:00","2019-03-11 16:46:00","Renault (RNO FP) - Co. have confirmed discussions regarding a new alliance body, but add that they have not yet led to a definitive agreement"
"2019-03-11 08:44:00","2019-03-11 16:44:00","The chances of tomorrows meaningful vote being pulled are 50/50 says Tory Brexiteer Mark Francois; Sun's Dathan"
"2019-03-11 08:30:00","2019-03-11 16:30:00","Natixis FX Trade Recommendations, 11 March 2019"
"2019-03-11 08:16:00","2019-03-11 16:16:00","EU Sources are rubbishing claims of extra payments being attached to a Brexit deal, adding that the EU expects the UK to pay what has been signed up to; Guardian's Rankin"
"2019-03-11 08:14:00","2019-03-11 16:14:00","Global oil demand to grow by an average 1.2mln BPD a year through to 2024; IEA "
"2019-03-11 08:11:00","2019-03-11 16:11:00","Boeing (BA) shares opened lower by 10% pre-market following the Boeing 737 crash on the way to Nairobi, as such Dow Mar'19 futures fell from 25,400 to 25,331"
"2019-03-11 08:11:00","2019-03-11 16:11:00","Major FX option expiries for today's NY cut"
"2019-03-11 08:11:00","2019-03-11 16:11:00","UK Government sources says UK PM May has no plans to head to Brussels following the deadlock in talks with the EU"
"2019-03-11 08:06:00","2019-03-11 16:06:00","Bunds: more consolidation off post-ECB contract highs"
"2019-03-11 08:05:00","2019-03-11 16:05:00","Saudi Official says that they plan to cut April crude exports below 7mln BPD despite strong demand"
"2019-03-11 08:05:00","2019-03-11 16:05:00","European equity movers this morning: Leg Immobilien (LEG GY) +4.0%; Commerzbank (CBK GY) +2.5%; Provident Financial (PFG LN) +2.0%; Airbus (AIR FP) +0.9%; Deutsche Bank (DBK GY) +0.4%; Safran (SAF FP) -1.6%"
"2019-03-11 07:58:00","2019-03-11 15:58:00","Renault (RNO FP) - Co. confirms that it is in discussions with Nissan (7201 JP) and Mitsubishi (7211 JP) regarding establishment of a new alliance body"
"2019-03-11 07:50:00","2019-03-11 15:50:00","There are talks of PM May having a ""conditional"" vote on her dream Brexit deal, rather than one on the table, as a way of showing what could get through HoC; according to FT's Political Editor"
"2019-03-11 07:43:00","2019-03-11 15:43:00","Libya is currently producing 1.17mln BPD, including 200K BPD from restarted Sharara Oil Field (300K BPD) where full production is expected this week"
"2019-03-11 07:29:00","2019-03-11 15:29:00","Bank of France Business Sentiment 101 vs. Exp. 100 (Prev. 99), Q1 GDP growth estimates trimmed to 0.3% (Prev. 0.4%)"
"2019-03-11 06:58:00","2019-03-11 14:58:00","Additional European equity stories post the release of the Daily European equity opening news"
"2019-03-11 06:51:00","2019-03-11 14:51:00","DAILY EUROPEAN EQUITY OPENING NEWS"
"2019-03-11 06:36:00","2019-03-11 14:36:00","China Jan-Feb Vehicle sales -14.9% Y/Y vs. Prev. +1.7%. February vehicle sales -13.8% Y/Y vs. Prev. -15.8%; Industry association"
"2019-03-11 06:34:00","2019-03-11 14:34:00","German government expects GDP growth of 0.8% in 2019; Handelsblatt "
"2019-03-11 06:13:00","2019-03-11 14:13:00","RANsquawk Daily European Opening News - 11th March 2019"
"2019-03-11 06:00:00","2019-03-11 14:00:00","Japanese Machine Tool Orders (Feb P) Y/Y -29.3% (Prev. -18.8%)"
"2019-03-11 05:52:00","2019-03-11 13:52:00","ECB's Coeure (Neutral) says he does not see a need to restart asset purchases, and added that the ECB does not see a recession at the moment"
"2019-03-11 05:50:00","2019-03-11 13:50:00","ASIA-PAC MARKET WRAP: Asia stocks eventually traded mostly positive on what was an indecisive session in the aftermath of mixed US jobs data and weak Chinese lending figures"
"2019-03-11 04:15:00","2019-03-11 12:15:00","Sinopec (386 HK) and PetroChina (857 HK) are to shut down several refineries with tens of millions of tonnes of total capacity for several months due to overhaul work"
"2019-03-11 03:57:00","2019-03-11 11:57:00","China is speculated to mull stepping up disposal of bad assets this year"
"2019-03-11 03:35:00","2019-03-11 11:35:00","Philippines Senate President says that 2019 budget approval could be delayed to August"
"2019-03-11 03:28:00","2019-03-11 11:28:00","Japan cabinet approves changes to transport laws to require cameras, sensors and regulatory equipment for autonomous cars, while it will also require private insurers to cover accidents caused by the self-driving vehicles"
"2019-03-11 03:25:00","2019-03-11 11:25:00","PRE-MARKET INDIA STOCK NEWS: Bank of India (BOI IS) is to lower its MCLR rate by 5bps"
"2019-03-11 03:08:00","2019-03-11 11:08:00","ASIA-PAC MID-SESSION UPDATE: Asia trades somewhat indecisive post-NFPs and China lending data"
"2019-03-11 02:14:00","2019-03-11 10:14:00","RBA paper states that low interest rates, partially reflecting lower global long-term rates, explain much of the rapid growth in housing prices and construction during the previous few years"
"2019-03-11 01:28:00","2019-03-11 09:28:00","PBoC official says February money supply data is normal and inline with historical trends"
"2019-03-11 01:15:00","2019-03-11 09:15:00","PBoC sets CNY mid-point at 6.7202 (Prev. 6.7235)"
"2019-03-11 01:10:00","2019-03-11 09:10:00","PBoC skips open market operations for a net neutral daily position"
"2019-03-11 01:01:00","2019-03-11 09:01:00","Ireland Construction PMI (Feb) 60.5 (Prev. 54.6)"
"2019-03-11 01:00:00","2019-03-11 09:00:00","US President Trump is to ask Congress to reduce non-defense spending by an average of 5% in fiscal 2020 budget"
"2019-03-11 00:56:00","2019-03-11 08:56:00","PRE-MARKET CHINESE  STOCK NEWS: Chinese lending data disappoints"
"2019-03-11 00:31:00","2019-03-11 08:31:00","PRE-MARKET TAIWAN AND SINGAPORE NEWS: February revenue updates including Acer, Foxconn, Hon Hai and TSMC"
"2019-03-11 00:15:00","2019-03-11 08:15:00","Barclays recommends shorting EUR/GBP with a target at 0.8400 and stop at 0.8760"
"2019-03-11 00:01:00","2019-03-11 08:01:00","Asia equity markets begin the week mixed with the tone somewhat cautious following Friday's losses on Wall St and mixed jobs data in which NFPs severely missed expectations, while Unemployment Rate and Average Earnings were more encouraging"
"2019-03-11 00:01:00","2019-03-11 08:01:00","Asia equity markets begin the week mixed with the tone somewhat cautious following Friday's losses on Wall St and mixed jobs data in which NFPs severely missed expectations, while Unemployment Rate and Average Earnings were more encouraging"