"gmt_time","hk_time","subject"
"2019-03-11 23:57:00","2019-03-12 07:57:00","Honda (7267 JP) plans recall of 1mln vehicles in US and Canada due to airbags"
"2019-03-11 23:45:00","2019-03-12 07:45:00","UK MP Collins says will be voting against the government's motion on EU withdrawal"
"2019-03-11 23:43:00","2019-03-12 07:43:00","Brazilian airline GOL suspends flights with Boeing (BA) 737 Max 8 planes"
"2019-03-11 23:39:00","2019-03-12 07:39:00","BBC Newsnight political editor tweets 'Leading Brexiteer tells me: PM’s agreement with EU tonight just about looks OK. All down to Geoffrey Cox. If can provide robust legal advice that the UK can get out of the NI backstop then this should go through'"
"2019-03-11 23:38:00","2019-03-12 07:38:00","PRE-MARKET JAPANESE AND SOUTH KOREAN STOCK NEWS: Posco (005490 KS) receives USD 100mln contract to build power plant in Mexico"
"2019-03-11 23:05:00","2019-03-12 07:05:00","UK opposition Labour Party Leader Corbyn says PM May's negotiations have failed and agreement with EU does not contain changes PM May promised parliament, while he adds parliament must reject the deal"
"2019-03-11 23:02:00","2019-03-12 07:02:00","OPEC Secretary General Barkindo says oil market rebalancing continues to be a work in progress and supply adjustments will continue this year"
"2019-03-11 23:00:00","2019-03-12 07:00:00","EU's Juncker says there will be no new negotiations on Brexit and that this is it"
"2019-03-11 22:55:00","2019-03-12 06:55:00","UK PM May says UK will make a unilateral declaration that there will be nothing to stop UK from leaving backstop if talks break down, adds we have secured what parliament has asked regarding the backstop"
"2019-03-11 22:55:00","2019-03-12 06:55:00","UK PM May says UK will make a unilateral declaration that there will be nothing to stop UK from leaving backstop if talks break down, adds we have secured what parliament has asked regarding the backstop"
"2019-03-11 22:52:00","2019-03-12 06:52:00","UK PM May says she stands by what Brexit deal achieves for Britain and that it sets us on course towards a good future relationship with the EU"
"2019-03-11 22:49:00","2019-03-12 06:49:00","PRE-MARKET AUSTRALIAN STOCK NEWS: Thousands of Telstra workers are to conduct a strike due to pay"
"2019-03-11 22:47:00","2019-03-12 06:47:00","EU's Juncker says it is this deal or Brexit may not happen at all, adds UK must leave by May 23rd or hold elections for EU lawmakers"
"2019-03-11 22:45:00","2019-03-12 06:45:00","EU's Juncker says we want UK to exit an orderly way and we have a deal which does that, while joint statement says EU and UK commit to finding alternative arrangements to backstop by 2020 "
"2019-03-11 22:43:00","2019-03-12 06:43:00","UK Conservative Party Brexiteer MP Penning says can now vote for the deal"
"2019-03-11 22:34:00","2019-03-12 06:34:00","ERG's Rees Mogg says it is too early to say if this is enough but it’s a move in right direction"
"2019-03-11 22:32:00","2019-03-12 06:32:00","DUP says it will study the detail of the latest EU-UK agreement"
"2019-03-11 22:31:00","2019-03-12 06:31:00","ERG's Baker says not for the first time the UK government has had to put a very good gloss on something which falls short of what was expected"
"2019-03-11 22:30:00","2019-03-12 06:30:00","Australian Roy Morgan Consumer Confidence (Mar 10) W/W 109.5 (Prev. 114.8)"
"2019-03-11 22:23:00","2019-03-12 06:23:00","ASIAN DAILY ECONOMIC RELEASES CALENDAR NOW AVAILABLE IN THE RESEARCH SECTION: Highlights include Australian NAB Business Confidence and Home Loans, Japanese BSI Large Manufacturing, Singapore Retail Sales and Fed Chair Powell Comments"
"2019-03-11 22:21:00","2019-03-12 06:21:00","UK Cabinet Minister Lidington says whole UK cabinet approves of Brexit deal improvements"
"2019-03-11 22:15:00","2019-03-12 06:15:00","EU official says May-Juncker news conference is due shortly and had earlier stated that joint presser will only be held if there was progress"
"2019-03-11 22:10:00","2019-03-12 06:10:00","UK Cabinet Office Minister Lidington says EU has been clear this will be only deal on the table and MPs have decision to vote for the this deal or plunge country into a political crisis"
"2019-03-11 22:03:00","2019-03-12 06:03:00","UK PM May has secured legally binding changes that strengthen and improve withdrawal agreement, according to Cabinet Office Minister Lidington"
"2019-03-11 22:01:00","2019-03-12 06:01:00","UK Cabinet Office Minister Lidington says negotiations are still taking place in Strasbourg"
"2019-03-11 22:00:00","2019-03-12 06:00:00","ASIA-PAC SERVICE IS NOW LIVE FOR TODAY'S SESSION"
"2019-03-11 21:55:00","2019-03-12 05:55:00","Reports note Joint EU-UK interpretative statement which is understood to give arbitration key panel role if UK feels EU is trying to keep it in the backstop against its will"
"2019-03-11 21:49:00","2019-03-12 05:49:00","BBC political editor tweets 16 or 17 ministers were pulled together tonight for a meeting in Cobra room in Cabinet Office - more progress been made than expected sources suggest - now down to 'how constructive ERG and DUP are willing to be' says a source"
"2019-03-11 21:47:00","2019-03-12 05:47:00","Sources suggest more progress was made than expected in talks between PM May and EU's Juncker, according to BBC's political editor"
"2019-03-11 21:45:00","2019-03-12 05:45:00","Guardian reports details on UK PM May and EU's Juncker talks including 3 main parts which are joint interpretative instrument, unilateral statement from the UK and additional language in political declaration to emphasize urgency on both sides"
"2019-03-11 21:23:00","2019-03-12 05:23:00","DAILY ASIA-PAC OPENING NEWS"
"2019-03-11 21:20:00","2019-03-12 05:20:00","US Senator Collins plans to introduce legislation to improve competition related to the biosimilars market"
"2019-03-11 21:07:00","2019-03-12 05:07:00","ERG's Baker says doubt UK PM May has achieved aim of replacing backstop with alternative arrangements"
"2019-03-11 21:06:00","2019-03-12 05:06:00","OPEC Secretary General Barkindo says OPEC will meet with shale drillers tonight "
"2019-03-11 21:00:00","2019-03-12 05:00:00","New Zealand Truckometer Heavy Index (Feb) M/M 0.4% (Prev. 4.8%)"
"2019-03-11 20:57:00","2019-03-12 04:57:00","UK Cabinet Ministers are reportedly being briefed by PM May's Deputy on what is in the process of being agreed in Strasbourg, according to BBC political editor"
"2019-03-11 20:47:00","2019-03-12 04:47:00","EU27 source says UK PM May thinks a unilateral statement regarding the backstop will help UK Attorney General Cox change his legal advice"
"2019-03-11 20:38:00","2019-03-12 04:38:00","Alphabet's (GOOG) Waymo is seeking financing from external investors including European automakers"
"2019-03-11 20:02:00","2019-03-12 04:02:00","RANsquawk US Market Wrap - 11 March 2019: Hopes of Brexit progress as May to meet Juncker/Barnier on eve of Meaningful Vote"
"2019-03-11 19:45:00","2019-03-12 03:45:00","SPX MOC 1.1bln to buy (buyside 1.5bln, sellside 370bln) vs USD 200mln to buy at 1544 EDT"
"2019-03-11 19:29:00","2019-03-12 03:29:00","EU diplomats note that tomorrow's vote isn't the end of the road, talks can continue; but if there are to be no changes to the WA, the EU's room for manoeuvre is clearly limited; BBC's Katya Adler reports"
"2019-03-11 19:24:00","2019-03-12 03:24:00","US FAA issues ""continued airworthiness"" notice on Boeing (BA) 737 Max jet"
"2019-03-11 19:15:00","2019-03-12 03:15:00","FX ANALYSIS: Pound up on Brexit optimism; EUR needs higher bund yields; JPY capped by MAs; USD negative"
"2019-03-11 19:13:00","2019-03-12 03:13:00","US T-Notes (M9) settle 4 ticks lower at 122-20+"
"2019-03-11 19:09:00","2019-03-12 03:09:00","Tory Brexiteer source says there is a large whipping operation for Conservative lawmakers to back UK PM May's deal tomorrow, ITV reports"
"2019-03-11 19:02:00","2019-03-12 03:02:00","Cabinet minister tells BBC reporter that UK PM May’s Brexit negotiations in Strasbourg is ""not looking good"""
"2019-03-11 19:00:00","2019-03-12 03:00:00","OPEC official says OPEC to maintain cuts to reduce global inventories; ""they will talk about demand and supply balance and will continue cutting production,"" official said, adding ""we want to see commercial stocks down"""
"2019-03-11 18:36:00","2019-03-12 02:36:00","White House says date for Trump/Xi meeting has not been set, negotiations continue, and all options are available"
"2019-03-11 18:32:00","2019-03-12 02:32:00","WTI (J9) settles USD 0.72 higher at USD 56.79; Brent (K9) settles USD 0.84 higher at USD 66.58"
"2019-03-11 17:53:00","2019-03-12 01:53:00","Southwest Airlines (LUV) says it is receiving customer queries on whether their flight will be on Boeing (BA) 737 Max 8 jets; says it remains confident in the safety and airworthiness of its fleet  "
"2019-03-11 17:49:00","2019-03-12 01:49:00","EU's offer is said to still be based on joint interpretive text"
"2019-03-11 17:43:00","2019-03-12 01:43:00","BREXIT - Situation report ahead of May's trip to Strasbourg"
"2019-03-11 17:22:00","2019-03-12 01:22:00","UK No. 10 source lowers expectations of an imminent deal; EU source says ""We remain firm in rejecting Cox's idea whereby the UK would in effect have a unilateral right of exit from the backstop""; Daily Mirror's Pippa Crerar "
"2019-03-11 17:08:00","2019-03-12 01:08:00","HollyFrontier (HFC) says El Dorado, Kansas refinery (160k BPD) to restart over the next few weeks"
"2019-03-11 17:05:00","2019-03-12 01:05:00","UK PM May is heading to Stasbourg for talks with Juncker Monday evening, expected to arrive at 20:00 GMT / 16:00 EDT; sources say this does not mean there is definitely a deal; BBC "
"2019-03-11 17:02:00","2019-03-12 01:02:00","US sells USD 38bln in 3-year notes, tails by 0.4bps"
"2019-03-11 16:54:00","2019-03-12 00:54:00","UK Brexiteers, the ERG, believes UK Attorney General and Number 10 have some kind of deal to put to Parliament tomorrow, according to the BBC's political editor"
"2019-03-11 16:46:00","2019-03-12 00:46:00","Goldman Sachs cuts its US Q1 GDP tracking estimate to 0.5% (prev. 0.9%)"
"2019-03-11 16:45:00","2019-03-12 00:45:00","If UK PM does go to Strasbourg for further negotiations tonight, Number 10 suggests we should not assume big breakthrough: ""It would only be if we felt that there was something that could be helped by face-to-face conversations"""
"2019-03-11 16:45:00","2019-03-12 00:45:00","If UK PM does go to Strasbourg for further negotiations tonight, Number 10 suggests we should not assume big breakthrough: ""It would only be if we felt that there was something that could be helped by face-to-face conversations"""
"2019-03-11 16:45:00","2019-03-12 00:45:00","US to auction USD 38bln 3-year notes at 1300 EDT/1700 GMT"
"2019-03-11 16:34:00","2019-03-12 00:34:00","Mexico President Lopez Obrador says Mexico will not indebt itself to finance the Mexican budget; adds economy is growing slowly, there are not signs of recession"
"2019-03-11 16:31:00","2019-03-12 00:31:00","Morgan Stanley raises its Q2 2019 Brent forecast to USD 62.50 from USD 60; raises WTI to USD 54.50 from USD 52"
"2019-03-11 16:30:00","2019-03-12 00:30:00","EUROPEAN PRELIMINARY CASH EQUITY CLOSE: EURO STOXX 50 (+0.63%), FTSE 100 (+0.39%), DAX (+0.70%), CAC (+0.66%), IBEX (+0.51%), FTSE MIB (+0.67%), SMI (+0.84%)"
"2019-03-11 16:30:00","2019-03-12 00:30:00","UK House Speaker Bercow says Brexit Secretary Barlay's statement could come as late as 22:00 GMT / 18:00 EDT"
"2019-03-11 16:28:00","2019-03-12 00:28:00","""UK PM May has two scenarios: 1) Fly to Strasbourg tonight in hope of bringing back something new on the backstop to sell to ERG/DUP; or 2) admit that the WA being put before MPs is no different from January""; according to BI's Adam Payne"
"2019-03-11 16:24:00","2019-03-12 00:24:00","British luxury sector warns of an USD 8.9bln export loss due to a no-deal Brexit"
"2019-03-11 16:18:00","2019-03-12 00:18:00","US President Trump's budget proposal seeks to balance the budget by 2024, according to WSJ"
"2019-03-11 16:06:00","2019-03-12 00:06:00","Phillips 66 (PSX) Ponca City, Oklahoma refinery (203k BPD) restarts its crude unit, according to a source"
"2019-03-11 16:03:00","2019-03-12 00:03:00","UK PM May spokesman says Cabinet will meet on Wednesday morning before the spring fiscal statement, talks are ongoing at a technical level; says Brexit deal documents will be voted upon on Tuesday which have to be submitted tonight"
"2019-03-11 16:03:00","2019-03-12 00:03:00","Pilot Union says AAL flight attendants will not be forced to fly 737-MAX 8 jets if they feel it is unsafe"
"2019-03-11 15:55:00","2019-03-11 23:55:00","Brexiteer MP thinks any kind of unilateral statement from the UK on backstop will be ""completely rejected"" by Tory rebels; PM ""could end up losing by a greater margin... she needs more than this""; talkRadio's Ross Kempsell"
"2019-03-11 15:51:00","2019-03-11 23:51:00","UK Brexit Deputy Secretary Walker confirms that there will be a vote on no-deal Brexit and on extending Article 50 regardless of Tuesday's Meaningful Vote"
"2019-03-11 15:46:00","2019-03-11 23:46:00","Atlanta Fed GDPnow (Q1): 0.2% (Prev. 0.5%)"
"2019-03-11 15:45:00","2019-03-11 23:45:00","If the EU improves its offer in next hour or so, then UK PM May will pick it up in Strasbourg; if EU won’t budge enough, she stays home; according to ITV's Peston"
"2019-03-11 15:45:00","2019-03-11 23:45:00","Downing Street is considering making a unilateral statement declaring it believes it is released from their obligation to stay in the backstop for a number of years, although Brexiteer MP's are saying this is 'legally meaningless'; BuzzFeed"
"2019-03-11 15:43:00","2019-03-11 23:43:00","Venezuela's PDVSA production is said to fall due to power cuts"
"2019-03-11 15:41:00","2019-03-11 23:41:00","Junior Brexit Minister Walker says the meaningful vote is to go ahead as planned tomorrow, the government will propose Brexit motion later today"
"2019-03-11 15:38:00","2019-03-11 23:38:00","US Energy Secretary Perry says the US may need more LNG projects than it has currently; sees no slowdown in US LNG exports"
"2019-03-11 15:35:00","2019-03-11 23:35:00","Special Representative for North Korea Biegun says taking seriously the reports of a North Korean missile site, doesn't know what message they are trying to send"
"2019-03-11 15:30:00","2019-03-11 23:30:00","Daily FX Wrap: Sterling storms back amidst speculation about Brexit soiree in Strasbourg"
"2019-03-11 15:26:00","2019-03-11 23:26:00","US President Trump releases USD 4.7trln budget proposal for 2020"
"2019-03-11 15:22:00","2019-03-11 23:22:00","Morgan Stanley says evidence is building for further slowing, says the stock correction likely not over"
"2019-03-11 15:07:00","2019-03-11 23:07:00","US diplomacy is still much still alive with North Korea according to US Special Representative for North Korea"
"2019-03-11 15:00:00","2019-03-11 23:00:00","US median consumer 1yr and 3yr inflation expectations -0.2ppts to 2.8% in Feb, 1yr earnings growth expectations +2.5% in Feb vs. +2.4% in Jan; according to NY Fed"
"2019-03-11 14:54:00","2019-03-11 22:54:00","PBF Chalmette Louisiana refinery is preparing to restart their Fluid Catalytic Cracking Unit"
"2019-03-11 14:53:00","2019-03-11 22:53:00","BAML active managers' holdings update reports active managers' rotation into defensives is picking up again"
"2019-03-11 14:48:00","2019-03-11 22:48:00","Mexican Energy Secretary says the cost of a new refinery will be between USD 6-8bln and will be ready in three years"
"2019-03-11 14:46:00","2019-03-11 22:46:00","US tells Germany to stop allowing Huawei to operate or face intelligence sharing pared back, according to WSJ"
"2019-03-11 14:42:00","2019-03-11 22:42:00","Venezuelan 2019 oil production is to likely decline to 800K BPD according IEA Chief Birol"
"2019-03-11 14:40:00","2019-03-11 22:40:00","Judgement against tobacco companies have reportedly been suspended"
"2019-03-11 14:37:00","2019-03-11 22:37:00","Real money and leveraged investor flows from Citi clients to EM turned negative last week"
"2019-03-11 14:36:00","2019-03-11 22:36:00","Barclays cut Q1 US GDP growth to 2% vs. Prev. 2.5%"
"2019-03-11 14:26:00","2019-03-11 22:26:00","Total's Port Arthur refinery (630K BPD) has restarted its gasoline unit and shut its gasoline hydrotreater; according to sources"
"2019-03-11 14:23:00","2019-03-11 22:23:00","There will be something from Brussels, it won't be much and those who want to climb down will be able to, and there will be a sufficient number of those who do not to reject UK PM May's deal; ITV's Peston"
"2019-03-11 14:23:00","2019-03-11 22:23:00","IEA Senior Analyst Bosoni says US supply couple become less responsive to oil price action as majors take a larger share of shale patch"
"2019-03-11 14:16:00","2019-03-11 22:16:00","US has imposed sanctions on Russian bank Evrofinance Mosnarbank under the Venezuelan sanctions program as it is reportedly linked to Venezuelan state-owned oil company PDVSA; according to US Treasury"
"2019-03-11 14:15:00","2019-03-11 22:15:00","IEA's Chief Birol says 2018 US oil demand growth of 500k BPD, the highest of all countries"
"2019-03-11 14:14:00","2019-03-11 22:14:00","ANALYSIS: US Retail sales show January rebound, Pantheon Macroeconomics says"
"2019-03-11 14:08:00","2019-03-11 22:08:00","EU 27 leaders are to discuss Brexit on March 21st but negotiations should not happen directly with PM May at the Summit; according to EU Ambassadors"
"2019-03-11 14:05:00","2019-03-11 22:05:00","Turkey lowered gold holdings by 4 tonnes to 478.75 tonnes in February 2019; according to IMF data"
"2019-03-11 14:01:00","2019-03-11 22:01:00","US Undersecretary of States for Arms Control says she thinks there will be another summit between US President Trump and North Korean Leader Kim but nothing is on the calendar"
"2019-03-11 13:58:00","2019-03-11 21:58:00","Spruce Point negative on iRobot (IRBT): Shark Ninja is planning a new high end robotic vacuum to challenge iRobot's dominance in the ""high end/premium"" market"
"2019-03-11 13:54:00","2019-03-11 21:54:00","Venezuela's Jose oil port (nation's primary crude export terminal) is not able to resume exports following the power outages; according to sources"
"2019-03-11 13:46:00","2019-03-11 21:46:00","EU Chief Brexit Negotiator Barnier and Commissioner Secretary General Selmayr told EU27 ambassadors mood with UK was 'confrontational', Commons vote was destined to fail; EU ramping up no-deal preparations, eyeing 24 May as Brexit extension date; FT"
"2019-03-11 13:46:00","2019-03-11 21:46:00","US Movers: Weyerhaeuser (WY) +2.5%, Facebook (FB) +2.3%, Apple (AAPL) +2.3%, Boeing (BA) -11.3%, Eli Lilly (LLY) -2.2%, Southwest Airlines (LUV) -1.9%"
"2019-03-11 13:39:00","2019-03-11 21:39:00","UK PM May could possibly be bringing something new from Europe for tomorrow's vote, where apparently there is ""some kind of deal in the offing over alternative arrangements""; Telegraph's Steven Swinford"
"2019-03-11 13:39:00","2019-03-11 21:39:00","Faurecia (EO FP) and Michelin (ML FP) are to reportedly create a global leader in hydrogen mobility"
"2019-03-11 13:38:00","2019-03-11 21:38:00","Fixed and FX latest: bonds firm, but Sterling even firmer"
"2019-03-11 13:38:00","2019-03-11 21:38:00","Fixed and FX latest: bonds firm, but Sterling even firmer"
"2019-03-11 13:37:00","2019-03-11 21:37:00","UK opposition Labour still prefers a general election and will bring a no confidence motion when judged likely to be successful; talkRadio's Ross Kempsel"
"2019-03-11 13:34:00","2019-03-11 21:34:00","EU and UK are reportedly still talking and working. If PM May thinks the results will work for her politically she will meet President Juncker later today in Strasbourg but it’s “not there yet”; BBC's Kate Adler citing EU source"
"2019-03-11 13:33:00","2019-03-11 21:33:00","German Chancellor Merkel welcomes EU Commissions proposals for legal clarity on the Backstop, adding that Britain needs to respond to the EU's proposals"
"2019-03-11 13:30:00","2019-03-11 21:30:00","PRIMER: Trump 2020 Budget to be announced on Monday"
"2019-03-11 13:30:00","2019-03-11 21:30:00","ANALYSIS - BREXIT BREIFING: The state of play ahead of Tuesday's Meaningful vote"
"2019-03-11 13:24:00","2019-03-11 21:24:00","Irish Foreign Minister Coveney says he hopes May and Juncker will reach agreement, though there are obstacles he won’t go into. Text of deal will not be changed but “nobody is looking to trap anybody anywhere”; VirginMedia's Reilly"
"2019-03-11 13:13:00","2019-03-11 21:13:00","Ireland's Finance Minister Donohoe says we are approaching the position of a hard Brexit; VirginMedia's Reilly comments that he hasn't heard it stated so explicitly before now "
"2019-03-11 13:12:00","2019-03-11 21:12:00","There is a feeling that the most likely outcome is a no-deal Brexit at the end of June, ITV's Dinnen tweets after conversations with Conservative Brexiteer MP's"
"2019-03-11 13:10:00","2019-03-11 21:10:00","Irish Foreign Minister Coveney says we need to be consistent and respectful of the UK's decision to leave, but insistent on issues which are of interest to Ireland; VirginMedia's Reilly"
"2019-03-11 13:03:00","2019-03-11 21:03:00","A meeting between UK and EU negotiators for tonight are not in the diary yet; according to BBC's Political Editor citing EU sources"
"2019-03-11 13:00:00","2019-03-11 21:00:00","BoE's Haskel (Neutral) says it is conceivable that, like Article 50, the UK will require more time than the 21 months. Thus, it is possible there might be another round of negotiating and attendant uncertainty. "
"2019-03-11 12:59:00","2019-03-11 20:59:00","RANsquawk Daily US Equity Opening News - 11th March 2019"
"2019-03-11 12:59:00","2019-03-11 20:59:00","Interserve (ISV LN) reportedly in rescue deal talks as according to Sky"
"2019-03-11 12:58:00","2019-03-11 20:58:00","Germany's BDI Industry Association cuts German growth forecast for 2019 to 1.2% from 1.5%"
"2019-03-11 12:58:00","2019-03-11 20:58:00","UK PM May may go to Strasbourg today, as according to BBC's Political Editor"
"2019-03-11 12:38:00","2019-03-11 20:38:00","UK PM May has spoken again to EU's Juncker over the phone recently, as according to PM May's Spokesperson"
"2019-03-11 12:36:00","2019-03-11 20:36:00","Labour Opposition leader Corbyn will ask UK PM May in Parliament about progress made in getting legal changes to the EU Withdrawal Agreement"
"2019-03-11 12:34:00","2019-03-11 20:34:00","Tesla (TLSA) files to sell shares are part of dividend reinvestment plan; according to filing"
"2019-03-11 12:28:00","2019-03-11 20:28:00","UK Unite Union says its members working for Aker, Petrofac on Total's Alwyn, Dunbar and Elgin platforms have started a 24hr stoppage at 7am on Monday"
"2019-03-11 12:25:00","2019-03-11 20:25:00","March 2019 US quarterly equity rebalance will result in a gross notional turnover of approx USD 40bln all effective on the close of 15 March 2019, UBS says"
"2019-03-11 12:14:00","2019-03-11 20:14:00","Nomura quants say systematic stock selling pressure caused by the liquidation of long positions will likely calm down after the middle of next week"
"2019-03-11 11:53:00","2019-03-11 19:53:00","Number of senior Tory MP's have stated if UK PM May fails to honour her pledge to hold a meaningful vote tomorrow and then, if PM May loses, votes on no-deal and Brexit deal, that they would back a motion holding her in contempt; ITV's Peston"
"2019-03-11 11:45:00","2019-03-11 19:45:00","UK PM May had phone calls with 8 EU leaders over the weekend, which included German Chancellor Merkel, French President Macron and EU Commission President Juncker. But still no breakthrough; Mirror's Crerar"
"2019-03-11 11:43:00","2019-03-11 19:43:00","Russia CBR Dep Gov says situation in banking sector is stable, there are no problems"
"2019-03-11 11:41:00","2019-03-11 19:41:00","UK govt spokesperson said the motion that will be voted on Tuesday will be published ‘before close of play’ today"
"2019-03-11 11:32:00","2019-03-11 19:32:00","BAML trade recommendation - short Eur/Nok at 9.7860, target 9.5000 and 10.1000 stop"
"2019-03-11 11:31:00","2019-03-11 19:31:00","Israel Central Bank minutes show MPC was unanimous in voting to leave rates unchanged at 0.25%"
"2019-03-11 11:26:00","2019-03-11 19:26:00","UK PM May Spokesman confirms PM May is committed to hold the three votes this week (Meaningful vote Tuesday, no-deal brexit Wednesday, extending A50 Thursday)"
"2019-03-11 11:22:00","2019-03-11 19:22:00","Standard Life Aberdeen (SLA LN) offer for sale of 70mln shares in HDFC Life Insurance"
"2019-03-11 11:16:00","2019-03-11 19:16:00","EU Commission says UK/EU remain in close contact this week, EU made new assurances that backstop is temporary, is ready to meet UK negotiators at any point; EC is committed to ratifying deal before 29 March"
"2019-03-11 11:09:00","2019-03-11 19:09:00","RANsquawk Daily US Opening News - 11th March 2019"
"2019-03-11 11:08:00","2019-03-11 19:08:00","UK Junior Brexit Minister says, as far as he is aware, the Meaningful Vote will go ahead this week; adds that if the deal is rejected, there is an opportunity to remove no-deal scenario"
"2019-03-11 11:06:00","2019-03-11 19:06:00","Saudi Aramco board to meet this week to approave SABIC M&A bond plan, could issue USD 10bln, sources say"
"2019-03-11 11:00:00","2019-03-11 19:00:00","Nvidia (NVDA) to acquire Mellanox (MLNX) for USD 6.9bln (USD 125/shr in cash)"
"2019-03-11 10:55:00","2019-03-11 18:55:00","Senior Tory MP suggests that UK PM May would lose a no-confidence vote this week if the meaningful vote is pulled tomorrow, as according to Newton-Dunn of the Sun"
"2019-03-11 10:53:00","2019-03-11 18:53:00","RANsquawk EU Mid Session: Sterling slips as sights are set on a series of votes - 11th March 2019"
