"gmt_time","hk_time","subject"
"2019-04-23 01:34:00","2019-04-23 09:34:00","BoJ senior official Maeda says BoJ will ease further if momentum for reaching price target is threatened and that there are various steps possible if it were to ease, but adds must look carefully at impact to the financial system if it were to ease"
"2019-04-23 01:23:00","2019-04-23 09:23:00","Japanese Finance Minister Aso says government and BoJ made a mistake in battling deflation during Heisei period"
"2019-04-23 01:15:00","2019-04-23 09:15:00","PBoC sets CNY mid-point at 6.7082 (Prev. 6.7035)"
"2019-04-23 01:10:00","2019-04-23 09:10:00","PBoC skips open market operations for a daily net drain of CNY 40bln"
"2019-04-23 01:09:00","2019-04-23 09:09:00","PRE-MARKET CHINESE STOCK NEWS: China is said to pick Bank of China Chairman Chen Siqing to head ICBC"
"2019-04-23 00:56:00","2019-04-23 08:56:00","Samsung Electronics (005930 KS) to ship back Galaxy Fold that were sent to Europe and US"
"2019-04-23 00:53:00","2019-04-23 08:53:00","Amazon (AMZN) is to no longer provide services through China website Amazon.cn effective July 18th but will continue with cross-border business to bring foreign brands and goods to China"
"2019-04-23 00:34:00","2019-04-23 08:34:00","Barclays sees upside risks of a minimum USD 5/bbl to its 2019 Brent Crude forecast of USD 70/bbl if Iran oil exports drop to zero"
"2019-04-23 00:23:00","2019-04-23 08:23:00","PRE-MARKET TAIWAN AND SINGAPORE NEWS: Taiwan Export Orders fell 9.0% Y/Y in March"
"2019-04-23 00:20:00","2019-04-23 08:20:00","Fuji Electric (6504 JT) may report FY oper. profit increased 5% Y/Y to JPY 59bln vs. guidance of JPY 58bln"
"2019-04-23 00:02:00","2019-04-23 08:02:00","Asia equity markets begin with marginal gains following a mostly positive lead from Wall St where the energy sector surged as oil rose to around 6-month highs, although gains in the broader market were limited ahead of a busy week of earnings"