"gmt_time","hk_time","subject"
"2019-04-28 23:49:00","2019-04-29 07:49:00","Goldman Sachs sees EUR/USD declining to 1.10 in next 3 months and DXY rising to 99.00, while it suggests global growth is unlikely to be strong enough to weigh on the greenback"
"2019-04-28 23:37:00","2019-04-29 07:37:00","PRE-MARKET AUSTRALIA AND SOUTH KOREAN STOCK NEWS: Japan is closed for Golden Week "
"2019-04-28 23:07:00","2019-04-29 07:07:00","South Korean Finance Minister Hong says will prepare measures to boost exports for key sectors during next 2 months"
"2019-04-28 22:33:00","2019-04-29 06:33:00","Coles (COL AT) reports total Q3 sales AUD 8.88bln and supermarket comparable sales growth of 2.4%"
"2019-04-28 22:11:00","2019-04-29 06:11:00","Spanish incumbent PM and Socialist leader Sanchez says will form a pro-European government"
"2019-04-28 21:50:00","2019-04-29 05:50:00","ASIAN DAILY ECONOMIC RELEASES CALENDAR NOW AVAILABLE IN THE RESEARCH SECTION: Highlights include very light calendar with no tier 1 data scheduled, while Japan and India are closed"
"2019-04-28 21:42:00","2019-04-29 05:42:00","DAILY ASIA-PAC OPENING NEWS"
"2019-04-28 21:00:00","2019-04-29 05:00:00","ASIA-PAC SERVICE IS NOW LIVE FOR TODAY'S SESSION"