"gmt_time","hk_time","subject"
"2020-03-18 23:59:00","2020-03-19 07:59:00","South Korea Vice Finance Minister says meeting held to review markets and will take steps based on contingency plan if needed, adds possible plans include injecting funds to stabilize bond markets"
"2020-03-18 23:57:00","2020-03-19 07:57:00","BoJ January Meeting Minutes note that most members state must be mindful of downside risks to teh economy but momentum for hitting price target is sustained"
"2020-03-18 23:52:00","2020-03-19 07:52:00","PRE-MARKET JAPANESE AND SOUTH KOREAN STOCK NEWS: Nissan (7201 JT) is to suspend North American production from March 20th-April 6th due to coronavirus"
"2020-03-18 23:43:00","2020-03-19 07:43:00","Fed's Kashkari (Voter, Dove) says coronavirus could be devastating like great recession or worse, adds the fast Congress can act the better"
"2020-03-18 23:30:00","2020-03-19 07:30:00","Japanese National CPI Ex. Fresh Food & Energy (Feb) Y/Y 0.6% vs. Exp. 0.7% (Prev. 0.8%)"
"2020-03-18 23:21:00","2020-03-19 07:21:00","Transport For London reportedly adjusts service operations in which it will shut Waterloo & City Line, close some stations, as well as suspend night tube and night overground; night buses will still operate for those making critical journeys - Unconfirmed"
"2020-03-18 23:10:00","2020-03-19 07:10:00","ECB's Lagarde says extraordinary times require extraordinary action, adds there are no limits to our commitment to the Euro and are determined to use full potential of all our tools within our mandate"
"2020-03-18 23:08:00","2020-03-19 07:08:00","Whitehall sources say most shops could close and transport could be restricted to key workers in London by the weekend under plans being considered by UK Government, according to Sky News"
"2020-03-18 23:05:00","2020-03-19 07:05:00","Japan's government and ruling party are said to be planning more than JPY 30tln in stimulus"
"2020-03-18 23:04:00","2020-03-19 07:04:00","RBA adds AUD 12.7bln to banking system through repos"
"2020-03-18 22:55:00","2020-03-19 06:55:00","PRE-MARKET AUSTRALIAN STOCK NEWS: Co.s withdraw FY guidance, Qantas suspends all internation flights"
"2020-03-18 22:49:00","2020-03-19 06:49:00","ECB announces EUR 750bln Pandemic Emergency Purchase Programme"
"2020-03-18 22:35:00","2020-03-19 06:35:00","Westpac sees New Zealand GDP Q/Q growth at -0.2% in Q1, -2.7% in Q2 and -0.2% in Q3"
"2020-03-18 22:30:00","2020-03-19 06:30:00","RBNZ says aware and monitoring current market developments, adds these are not unanticipated or unusual and are in close contact with Treasury, as well as other market participants"
"2020-03-18 22:25:00","2020-03-19 06:25:00","Brazilian city of Sao Paolo orders closing commercial establishments excluding pharmacies, supermarkets, bakeries, restaurants and gas stations from Friday"
"2020-03-18 22:11:00","2020-03-19 06:11:00","New Zealand Government says Treasury Bill tenders will be held weekly to support increased short-term funding requirements"
"2020-03-18 21:46:00","2020-03-19 05:46:00","New York City Mayor De Blasio says 11 New York City resident have died from coronavirus"
"2020-03-18 21:43:00","2020-03-19 05:43:00","ASIAN DAILY ECONOMIC RELEASE CALENDAR IS AVAILABLE IN THE RESEARCH SECTION OF THE WEBSITE: Highlights include New Zealand GDP, Japanese CPI, RBA Monetary Policy Announcement and Australian Job Data"
"2020-03-18 21:39:00","2020-03-19 05:39:00","US President Trump tweets ""I only signed the Defense Production Act to combat the Chinese Virus should we need to invoke it in a worst case scenario in the future. Hopefully there will be no need, but we are all in this TOGETHER!"""
"2020-03-18 21:36:00","2020-03-19 05:36:00","Algeria Energy Minister says there are signs oil demand will improve during H2 and this will lift oil prices"
"2020-03-18 21:34:00","2020-03-19 05:34:00","US Treasury Secretary Mnuchin is pushing for next coronavirus legislation to be finished by early next week, according to congressional aide"
"2020-03-18 21:30:00","2020-03-19 05:30:00","ECB's Villeroy says ECB absolutely determined to fight fragmentation risk between Eurozone countries and noted will buy more bonds if needed in this exceptional period, also states French banks are solid and do not need nationalisation"
"2020-03-18 21:24:00","2020-03-19 05:24:00","US Labor Department cancels media lock ups until end of March and will release data online according to schedule"
"2020-03-18 21:15:00","2020-03-19 05:15:00","DAILY ASIA-PAC OPENING NEWS"
"2020-03-18 21:09:00","2020-03-19 05:09:00","Brazil Central Bank says rate decision was unanimous and that the environemnt for emerging economies has become challenging"
"2020-03-18 21:03:00","2020-03-19 05:03:00","Fiat Chrysler (FCAU) suspends North American production in response to coronavirus with the shutdown reported through end-March"
"2020-03-18 21:01:00","2020-03-19 05:01:00","Reports note 1 casualty from a rocket attack by eastern Libya's Haftar forces on the capital Tripoli"
"2020-03-18 20:56:00","2020-03-19 04:56:00","US President Trump says he intends to nominate White House OMB Acting Director Vought to take the post on a permanent basis"
"2020-03-18 20:52:00","2020-03-19 04:52:00","French Finance Minister Le Maire says ECB must use all of the instruments at its disposal quickly and massively"
"2020-03-18 20:44:00","2020-03-19 04:44:00","NYSE is to move temporarily to fully electronic trading with equities and options trading floors to temporarily close from Monday 23rd March"
"2020-03-18 20:34:00","2020-03-19 04:34:00","New York Fed plans to purchase USD 100bln in Treasury purchases over Thursday and Friday"
"2020-03-18 20:09:00","2020-03-19 04:09:00","Newsquawk US Market Wrap - 18th March 2020: Scramble for dollar, crude collapsed, stocks crushed"
"2020-03-18 20:03:00","2020-03-19 04:03:00","NEC Director Kudlow says government may take equity positions in companies as part of an aid package"
"2020-03-18 19:51:00","2020-03-19 03:51:00","US 1st COVID economic stimulus package has gained enough support in the Senate"
"2020-03-18 19:51:00","2020-03-19 03:51:00","MOC: SPX 350mln to buy, Dow 150mln to sell"
"2020-03-18 19:38:00","2020-03-19 03:38:00","NEC Director Kudlow says the Phase 3 economic relief bill should bring USD 1.3trln worth of stimulus; has enormous resources to deal with distressed industries - comments from Fox interview"
"2020-03-18 19:26:00","2020-03-19 03:26:00","ECB GC holding an emergency call on COVID-19 response, according to sources"
"2020-03-18 19:23:00","2020-03-19 03:23:00","JPMorgan (JPM) to close around 1,000 Chase branches (total 5,100), according to the FT"
"2020-03-18 19:21:00","2020-03-19 03:21:00","French Finance Minister calls on the ECB to take on more measures "
"2020-03-18 19:18:00","2020-03-19 03:18:00","French regulators set to allow their banks to tap their capital buffers which could free up to EUR 8bln"
"2020-03-18 19:14:00","2020-03-19 03:14:00","MOC: SPX +1.4bln; DJIA +350mln"
"2020-03-18 19:00:00","2020-03-19 03:00:00","MOC: SPX +1.2bln; DJIA +300mln"
"2020-03-18 18:53:00","2020-03-19 02:53:00","Swiss Ventilator producer Hamilton Medical says the UK faces a ""massive"" shortfall of ventilators after it failed to invest sufficiently in intensive care infrastructure "
"2020-03-18 18:53:00","2020-03-19 02:53:00","Swiss Ventilator producer Hamilton Medical says the UK faces a ""massive"" shortfall of ventilators after it failed to invest sufficiently in intensive care infrastructure "
"2020-03-18 18:40:00","2020-03-19 02:40:00","JPMorgan thinks US GDP will shrink 4% in Q1, and 14% in Q2"
"2020-03-18 18:33:00","2020-03-19 02:33:00","US Senate Appropriations Committee Chair Shelby says Republicans could unveil stimulus package measures late Wednesday or early Thursday "
"2020-03-18 18:32:00","2020-03-19 02:32:00","WTI (J0) settles USD 6.58 lower (-24.4%) at USD 20.37/bbl ; Brent (K0) settles USD 3.85 lower (-13.4%) at 24.88/bbl"
"2020-03-18 18:22:00","2020-03-19 02:22:00","Senate Majority Leader McConnell says Republicans are close to an agreement on larger economic stimulus legislation for COVID-19"
"2020-03-18 18:19:00","2020-03-19 02:19:00","France COVID-19 total cases rises to 9134 (prev. 7730), death toll rises to 264 (prev. 175)"
"2020-03-18 18:17:00","2020-03-19 02:17:00","UK PM Johnson has asked departments to draw up plans for London lockdown, according to The Times"
"2020-03-18 17:47:00","2020-03-19 01:47:00","UK PM Johnson says the Government will rule nothing out, when asked about travel restrictions; reiterates it will bring forward faster measures where necessary "
"2020-03-18 17:47:00","2020-03-19 01:47:00","UK PM Johnson, when asked about the Brexit transition period, says we are getting on with it and the legislation is in place"
"2020-03-18 17:34:00","2020-03-19 01:34:00","General Motors (GM) is to temporarily suspend production until at least March 30th "
"2020-03-18 17:32:00","2020-03-19 01:32:00","UK PM Johnson says we will not hesitate to bring further and faster measures where we think it is necessary "
"2020-03-18 17:29:00","2020-03-19 01:29:00","UK Chief Scientific Advisor says as this moves faster, more measures will be required "
"2020-03-18 17:18:00","2020-03-19 01:18:00","UK Education Secretary Williamson confirms schools will remain shut from Friday until further notice "
"2020-03-18 17:15:00","2020-03-19 01:15:00","Northern Ireland schools set to close to pupils immediately and to staff from Friday, according to Sky News "
"2020-03-18 17:13:00","2020-03-19 01:13:00","Italy COVID-19 total cases rises to 35713 (prev. 31506); death toll rises by 475 to 2978 "
"2020-03-18 17:09:00","2020-03-19 01:09:00","Swiss government to begin rationing painkillers and fever drugs "
"2020-03-18 16:57:00","2020-03-19 00:57:00","US equities trigger level 1 circuit breaker after falling 7%; trading set to resume at 13:11 ET / 17:11 GMT"
"2020-03-18 16:56:00","2020-03-19 00:56:00","US President Trump says he believes China could have given notice of COVID-19 a lot earlier"
"2020-03-18 16:54:00","2020-03-19 00:54:00","Detroit's three largest automakers (GM, F, FCAU) agree to shut down US factories amid COVID-19 after UAW request "
"2020-03-18 16:51:00","2020-03-19 00:51:00","US banking agencies looking at providing guidance to encourage lending to low-income individuals amid the virus, according to a source "
"2020-03-18 16:48:00","2020-03-19 00:48:00","Delta Air Lines (DAL) says all officers 50% pay cut through the end of June; directors and managing directors taking 25% cut "
"2020-03-18 16:47:00","2020-03-19 00:47:00","US President Trump says China has not asked the US to suspend tariffs "
"2020-03-18 16:46:00","2020-03-19 00:46:00","Activist Investor Bill Ackman calls for a thirty day lockdown - in CNBC interview "
"2020-03-18 16:32:00","2020-03-19 00:32:00","US President Trump says potential for 20% unemployment rate is a ""worst-case"" scenario, adds that we are nowhere near it "
"2020-03-18 16:27:00","2020-03-19 00:27:00","Osram Light OSR GY) withdraws its FY guidance saying that it does not expect to reach its previous guidance due to COVID-19"
"2020-03-18 16:26:00","2020-03-19 00:26:00","BP (BP/ LN) provisionally charters a 60k tonne tanker to store jet fuel at sea for up to 60 days"
"2020-03-18 16:22:00","2020-03-19 00:22:00","UK COVID-19 death toll rises to 99 (prev. 67)"
"2020-03-18 16:20:00","2020-03-19 00:20:00","UAW union requests Detroit's three main automakers again to close their factories "
"2020-03-18 16:19:00","2020-03-19 00:19:00","Brazilian Bovespa stock market hits -10% circuit breaker "
"2020-03-18 16:17:00","2020-03-19 00:17:00","US VP Pence says Trump is to hold a videoconference with Governors and FEMA on Thursday "
"2020-03-18 16:13:00","2020-03-19 00:13:00","US CDC says total cases rises to 7087 (prev. 4275); death toll rises to 97 (prev. 75)"
"2020-03-18 16:08:00","2020-03-19 00:08:00","BoC Governor Poloz says he is not ruling out actions at any time; on Tuesday, BoC did CAD 35bln worth of exceptional transactions "
"2020-03-18 16:07:00","2020-03-19 00:07:00","US President Trump says Defense Production Act will be signed imminently; FEMA activated in all regions "
"2020-03-18 16:02:00","2020-03-19 00:02:00","Turkish President Erdogan says April, May, and June VAT and social security premium payments have been delayed by six months for various sectors such as retail, steel, and hospitality  "
"2020-03-18 16:02:00","2020-03-19 00:02:00","US Senate Majority Leader McConnell has set a 18:00GMT time for the vote on the coronavirus legislation"
"2020-03-18 16:01:00","2020-03-19 00:01:00","WATCH LIVE: White House daily press briefing on coronavirus "
"2020-03-18 16:01:00","2020-03-19 00:01:00","UK is expected to close schools in order to stem the coronavirus, according to reports"
"2020-03-18 15:57:00","2020-03-18 23:57:00","New York Governor Cuomo says there are 2382 cases of the coronavirus in New York which is 1008 higher than Tuesday's figure"
"2020-03-18 15:53:00","2020-03-18 23:53:00","Portugese President de Sousa is set to declare a state of emergency, according to state TV"
"2020-03-18 15:53:00","2020-03-18 23:53:00","BoC's Poloz says that Bank is closely watching market conditions and is ready to provide all liquidity required "
"2020-03-18 15:50:00","2020-03-18 23:50:00","ECB's Rehn says expanding APP or removing issuer limit on APP could be needed"
"2020-03-18 15:50:00","2020-03-18 23:50:00","Daily FX Wrap: Dollar dominates whilst Sterling slips and commodity FX forfeit "
"2020-03-18 15:49:00","2020-03-18 23:49:00","Bernie Sanders suspends his presidential campaign; NOTE: spokesperson has since claimed that it is false "
"2020-03-18 15:49:00","2020-03-18 23:49:00","Turkish President Erdogan urges citizens to not leave home until COVID-19 outbreak passes"
"2020-03-18 15:47:00","2020-03-18 23:47:00","CIRCUIT BREAKERS (18 Mar) [REFILE]: Hard upside or downside limit of 5% during non-US hours in Futures, 7%, 13% and 20% circuit breakers in US Futures during US hours"
"2020-03-18 15:46:00","2020-03-18 23:46:00","Fox's Pergram notes that the House coronavirus bill is expected to fail"
"2020-03-18 15:45:00","2020-03-18 23:45:00","Canada will soon be significantly investing in Alberta, this will include a package to address orphan wells, according to Canadian Finance Minister Morneu "
"2020-03-18 15:43:00","2020-03-18 23:43:00","Norwegian Prime Minister says she will propose an emergency legislation which would give the right to make decisions regarding coronavirus without consulting parliament"
"2020-03-18 15:40:00","2020-03-18 23:40:00","Trump administration proposes lending to air carriers from the exchange stabilization fund following the new USD 50bln congressional appropriation, according to Treasury memo"
"2020-03-18 15:40:00","2020-03-18 23:40:00","NY Governor Cuomo says that no business is allowed to have over 50% of its workforce on site; essential members are excluded "
"2020-03-18 15:40:00","2020-03-18 23:40:00","Trump administration proposes lending to air carriers from the exchange stabilization fund following the new USD 50bln congressional appropriation, according to Treasury memo"
"2020-03-18 15:40:00","2020-03-18 23:40:00","NY Governor Cuomo says that no business is allowed to have over 50% of its workforce on site; essential members are excluded "
"2020-03-18 15:36:00","2020-03-18 23:36:00","EU regulators are reportedly weighing measures to give banks relief on bad loans"
"2020-03-18 15:33:00","2020-03-18 23:33:00","Canadian Finance Minister Morneau says that today's measures are the first phase of the government's plans "
"2020-03-18 15:32:00","2020-03-18 23:32:00","French Finance Minister Le Maire says that PSA (PSA FP) and Renault (RNO FP) have been told that they are entitled to benefit from all measures put in place to fight COVID-19"
"2020-03-18 15:29:00","2020-03-18 23:29:00","Several senior UK sources say that a London shutdown is imminent, according Daily Mirror; Government's advisory group SAGE (which is meeting today) will advise next steps"
"2020-03-18 15:14:00","2020-03-18 23:14:00","US Treasury Mnuchin says parts of the economy are being closed down to destroy the coronavirus"
"2020-03-18 15:07:00","2020-03-18 23:07:00","See below for the highlights if the White House ""stimulus 3"" proposal via Washington Post's Long"
"2020-03-18 14:55:00","2020-03-18 22:55:00","Sources close to London Mayor Khan insist they have ""heard nothing"" about an imminent London coronavirus lockdown. That's not to say it won't happen of course, just that it's not happening right away, according to Politics Home"
"2020-03-18 14:49:00","2020-03-18 22:49:00","Atlanta Fed GDPnow (Q1) 3.1% vs. Prev. 2.9%"
"2020-03-18 14:48:00","2020-03-18 22:48:00","BoE GBP 1.456bln 7-15yr buyback: o/c 1.95x vs. Prev. 2.81x"
"2020-03-18 14:45:00","2020-03-18 22:45:00","Canada announces CAD 27bln stimulus package for the economy (3% of GDP)"
"2020-03-18 14:33:00","2020-03-18 22:33:00","EU is reportedly mulling a plan that could allow ECB crisis purchases; this could put ECB bond buying by utilising rescue fund, sources state"
"2020-03-18 14:23:00","2020-03-18 22:23:00","London is braced for a lock down as the UK Government prepares emergency legislation to prevent the spread of coronavirus, according to the Telegraph, sources close to the Mayor's office expect a shutdown in the capital in the coming days"
"2020-03-18 14:18:00","2020-03-18 22:18:00","Mexican Central Bank will be auctioning USD 2bln in FX hedges today"
"2020-03-18 14:17:00","2020-03-18 22:17:00","UK Chancellor Sunak when asked about a potential ""reverse national insurance"", he says that all potential options are being looked at "
"2020-03-18 14:16:00","2020-03-18 22:16:00","DoE Expectations (bbls): Crude +3.256mln, Distillates -1.963mln, Gasoline -2.890mln, Refining +0.1%"
"2020-03-18 14:13:00","2020-03-18 22:13:00","Switzerland reports 3,028 people in the country have tested positive for coronavirus vs. 2,200 reported on Monday"
"2020-03-18 14:11:00","2020-03-18 22:11:00","Senate Majority Leader McConell says the House will vote on the virus bill later today, hopes to pass the bill despite real shortcomings  "
"2020-03-18 14:10:00","2020-03-18 22:10:00","US Senate Finance Chair Grassley says he has concerns regrading the USTR's proposed June 1st implementation date for the USMCA deal; cites compliance issues for US auto industry"
"2020-03-18 14:07:00","2020-03-18 22:07:00","London will NOT be shut down today or tomorrow, No10 sources firmly suggest. This particular rumour seems to have gone into total overdrive, according to Sun's Newton Dunn"
"2020-03-18 14:03:00","2020-03-18 22:03:00","UK virus case count stands at 2626 vs. 1950 on Tuesday"
"2020-03-18 13:59:00","2020-03-18 21:59:00","Goldman Sachs sees US oil production falling 1.3mln BPD over 5-quarters after Q2 2020"
"2020-03-18 13:57:00","2020-03-18 21:57:00","UK school closure announcement is expected around 17:00GMT, according to ITV's Hewitt"
"2020-03-18 13:53:00","2020-03-18 21:53:00","US Senate Republicans expect to vote on House COVID-19 bill later on Wednesday, according to a source"
"2020-03-18 13:51:00","2020-03-18 21:51:00","Dollar Index (DXY) tech levels to the upside north of 100; March 2017 high at ~102.20; January 2017 high 103.80"
"2020-03-18 13:49:00","2020-03-18 21:49:00","Reports note there are plans to heavily restrict travel in/out of London, will keep open supermarkets and pharmacies, as of Friday according to CityAMs Neilan"
"2020-03-18 13:47:00","2020-03-18 21:47:00","CDS index reaches levels not seen since 2009 at 731.052bps"
"2020-03-18 13:42:00","2020-03-18 21:42:00","US Equity Futures hit limit down overnight as coronavirus worries reverse Tuesday's gains, although upon the Wall St open cash markets manage to stay open; SPX -5%."
"2020-03-18 13:31:00","2020-03-18 21:31:00","CIRCUIT BREAKERS (18 Mar) [REFILE]: Hard upside or downside limit of 5% during non-US hours in Futures, 7%, 13% and 20% circuit breakers in US Futures during US hours"
"2020-03-18 13:29:00","2020-03-18 21:29:00","BoC Governor will not be any new measures or actions on Wednesday, according to BoC"
"2020-03-18 13:20:00","2020-03-18 21:20:00","Scotland's Sturgeon says schools could be shut till summer from the end of the week"
"2020-03-18 13:13:00","2020-03-18 21:13:00","White House is being urged to curb short selling, according to the New York Post"
"2020-03-18 13:12:00","2020-03-18 21:12:00","New York City Mayor De Blasio says that military assistance in the city is required; almost at the point of recommending ""shelter-in-place"" to NY Governor Cuomo"
"2020-03-18 13:11:00","2020-03-18 21:11:00","Additional US Equity Stories: COP, AAPL, CMG, COP, ECL, KEYS, KR, SBUX"
"2020-03-18 13:11:00","2020-03-18 21:11:00","EU Trade Commissioner Hogan spoke with USTR Lighthizer at the start of the week before US hiked tariffs on EU aircrafts, Hogan underscored a strong view that both sides should focus on negotiating a settlement "
"2020-03-18 13:05:00","2020-03-18 21:05:00","Netherlands cases of the coronavirus stands at 2051, vs. around 1700 earlier in the week"
"2020-03-18 13:02:00","2020-03-18 21:02:00","Newsquawk Daily US Equity Opening News - 18th March 2020"
"2020-03-18 13:00:00","2020-03-18 21:00:00","BoE Governor Bailey says we are watching Sterling very carefully, takes note of the recent fall and will consider the effects of this at the next MPC"
"2020-03-18 12:54:00","2020-03-18 20:54:00","CIRCUIT BREAKERS (18 Mar) [REFILE]: Hard upside or downside limit of 5% during non-US hours in Futures, 7%, 13% and 20% circuit breakers in US Futures during US hours"
"2020-03-18 12:49:00","2020-03-18 20:49:00","CNBC's Yoon says schools will soon be re-opening in more provinces in China as of next week"
"2020-03-18 12:48:00","2020-03-18 20:48:00","BoC Governor Poloz and Finance Minister Morneau to speak to media at 11:15 EDT to announce their economic support package"
"2020-03-18 12:46:00","2020-03-18 20:46:00","Shell (RDS.A LN) charters a supertanker to store 2mln bbls of oil at sea, according to shipping sources"
"2020-03-18 12:45:00","2020-03-18 20:45:00","Czech Central Banker Holub states that a Fed-like cut could harm the domestic economy"
"2020-03-18 12:31:00","2020-03-18 20:31:00","NY Fed overnight repo operation undersubscribed; sees USD 85.795bln of bids accepted (USD 500bln offered)"
"2020-03-18 12:30:00","2020-03-18 20:30:00","Average of the BOC's three core inflation measures was 1.97% in February (versus 2.03% in January)"
"2020-03-18 12:29:00","2020-03-18 20:29:00","BCB to buy-back dollar denominated sovereign bonds, according to a statement"
"2020-03-18 12:24:00","2020-03-18 20:24:00","Trump Administration to seek USD 45.8bln in additional finding for US agencies (this would be separate from the proposed stimulus)"
"2020-03-18 12:23:00","2020-03-18 20:23:00","Democrat Presidential nominee hopeful Bernie Sanders campaign says it is speaking with supporters to assess his capaign; statement says he is turning his attention towards the coronavirus response"
"2020-03-18 12:22:00","2020-03-18 20:22:00","Newsquawk Central Banks - PREVIEW: RBA policy announcement due 1430AED/0330GMT Thursday 19th March"
"2020-03-18 12:22:00","2020-03-18 20:22:00","Newsquawk Central Banks - PREVIEW: RBA policy announcement due 1430AED/0330GMT Thursday 19th March"
"2020-03-18 12:17:00","2020-03-18 20:17:00","UK paving way for multi-billion pound bailout of airlines by raising the cap on the level of financial support that can be provided, according to a Times reporter"
"2020-03-18 12:17:00","2020-03-18 20:17:00","Japan's Hokkaido region is reportedly to lift its state of emergency, according to Kyodo"
"2020-03-18 12:14:00","2020-03-18 20:14:00","VP Pence Chief of Staff Short says no one is forecasting 20% unemployment right now, according to Fox"
"2020-03-18 12:01:00","2020-03-18 20:01:00","British American Tobacco (BATS LN) - Co. maintains its FY20 guidance"
"2020-03-18 12:01:00","2020-03-18 20:01:00","Apple (AAPL) have unveiled their new iPad Pro, which is to be available in stores as of next-week"
"2020-03-18 12:00:00","2020-03-18 20:00:00","Saudi energy minister directs Aramco to continue supplying crude at a rate of 12.3mln BPD over the coming months"
"2020-03-18 11:56:00","2020-03-18 19:56:00","ECB's Lagarde says she sees Eurozone GDP shrinking by 5% if covid lock down continues, according to FAZ"
"2020-03-18 11:55:00","2020-03-18 19:55:00","Austria will provide up to EUR 38bln to help curb covid impact, Chancellor says; will provide another EUR 9bln in guarantees and warranties; EUR 10bln in tax deferrals; EUR 15bln in emergency aid "
"2020-03-18 11:43:00","2020-03-18 19:43:00","ESMA says Europena market infrastructure companies are holding up well in the face of volatile trading"
"2020-03-18 11:39:00","2020-03-18 19:39:00","200k COVID-19 cases worldwide according to John Hopkins University"
"2020-03-18 11:36:00","2020-03-18 19:36:00","Fresenius (FRE GY) - Co. states there is currently no reason to adjust 2020 guidance"
"2020-03-18 11:32:00","2020-03-18 19:32:00","Bundesbank says Bafin intends to cut counter-cyclical buffer to 0% from 0.25%"
"2020-03-18 11:13:00","2020-03-18 19:13:00","Chinese President Xi says we must not allow the improving trend in virus containment to reverse"
"2020-03-18 11:13:00","2020-03-18 19:13:00","US President Trump says he is to hold a press conference today to discuss ""very important"" news from the FDA regarding the ""Chinese Virus"""
"2020-03-18 11:09:00","2020-03-18 19:09:00","Polish President says there will be a budget deficit due to the virus outbreak, worth PLN 212bln"
"2020-03-18 11:07:00","2020-03-18 19:07:00","China Politburo says China's economy is facing increasing downward pressure, according to state media"
"2020-03-18 11:06:00","2020-03-18 19:06:00","Newsquawk Daily US Opening News - 18th March 2020"
