"gmt_time","hk_time","subject"
"2020-04-15 09:25:00","2020-04-15 17:25:00","South Korean President Moon could win a majority in the SK Parliament, a KBS poll shows"
"2020-04-15 09:25:00","2020-04-15 17:25:00","PRIMER: Goldman Sachs (GS) to report at 07:25 ET/12:25 BST; options imply a 5.2% swing"
"2020-04-15 09:25:00","2020-04-15 17:25:00","PRIMER: Citigroup (C) to report at 08:00 ET/13:00 BST"
"2020-04-15 09:25:00","2020-04-15 17:25:00","PRIMER: Bank of America (BAC) to report at 06:45 ET/11:45 BST"
"2020-04-15 09:25:00","2020-04-15 17:25:00","PRIMER: UnitedHealth (UNH) to report at 05:55 ET/10:55 BST; options imply a 5% swing"
"2020-04-15 09:08:00","2020-04-15 17:08:00","Spains coronavirus cases stand at 177,633 (Prev. 172,541) & death toll at 18,579 (Prev. 18,056) according to the Health Ministry"
"2020-04-15 09:07:00","2020-04-15 17:07:00","European Commission President Von der Leyen says EU countries should use a ""gradual tailor-made approach"" to lifting lockdown restrictions, adding that recommendations focus on three main preconditions (cont) "
"2020-04-15 09:04:00","2020-04-15 17:04:00","UK sells GBP 3bln 0.875% 2029 Gilt with a b/c 2.94x (Prev. 2.16x), average yield 0.269% (Prev. 0.512%) and tail 0.3bps (Prev. 0.4bps)"
"2020-04-15 09:01:00","2020-04-15 17:01:00","ECB supports the swift action taken by euro area macroprudential authorities to address the financial sector impact of the coronavirus outbreak by releasing or reducing capital buffers"
"2020-04-15 09:00:00","2020-04-15 17:00:00","SNB allots USD 900mln in its 7-day operation and USD 1.734bln in its 84-day operation"
"2020-04-15 09:00:00","2020-04-15 17:00:00","BoE allots USD 0 in its 84-day USD operation (Prev. USD 300mln)"
"2020-04-15 09:00:00","2020-04-15 17:00:00","BoE allots USD 2.045bln in its 7-day USD operation (Prev. 1.7bln) and USD 0 in its 84-day USD operation (Prev. USD 300mln)"
"2020-04-15 08:55:00","2020-04-15 16:55:00","ECB allots USD 4.806bln in its 7-day operation, allots USD 2.2602bln in its 84-day operation (Prev. USD 11.2307bln)"
"2020-04-15 08:51:00","2020-04-15 16:51:00","Several participants in a call between the German national and state governments say the will consider easing retail restrictions in the nation from April 20th"
"2020-04-15 08:38:00","2020-04-15 16:38:00","BoJ purchased JPY 121.4bln in ETFs today"
"2020-04-15 08:18:00","2020-04-15 16:18:00","India have agreed to sell Hydroxychloroquine to Malaysia for COVID-19 treatment, according to the Malaysian Minister"
"2020-04-15 08:02:00","2020-04-15 16:02:00","German government is set to extend COVID-19 restrictions until May 3rd, according to Handelsblatt"
"2020-04-15 08:02:00","2020-04-15 16:02:00","German government is set to extend COVID-19 restrictions until May 3rd, according to Handelsblatt"
"2020-04-15 08:00:00","2020-04-15 16:00:00","German Economy Ministry says that March and Q2 will likely see a collapse in industrial activity "
"2020-04-15 08:00:00","2020-04-15 16:00:00","IEA Monthly Oil Market Report: Global oil demand is set to fall by a record 9.3mln BPD in 2020, SPR purchases can reach 200mln BPD in the next three months - still awaiting details on stock purchases"
"2020-04-15 07:46:00","2020-04-15 15:46:00","Bank of Italy says that estimates suggest that as much as EUR 50bln of additional financing will be required for Italian companies between March and July, according to an official"
"2020-04-15 07:39:00","2020-04-15 15:39:00","UK debt and STIR futures back in the ascendancy"
"2020-04-15 07:33:00","2020-04-15 15:33:00","Tokyo has over 125 (prev. over 160) new cases of COVID-19 on Tuesday, according to NHK"
"2020-04-15 07:28:00","2020-04-15 15:28:00","Chinese Foreign Ministry says the US should fulfill obligations to the World Health Organisation"
"2020-04-15 07:05:00","2020-04-15 15:05:00","European equity movers this morning: Sanofi (SAN FP) +2.6%, GSK (GSK LN) +2%, ASML (ASML NA)  +0.8%, Tullow Oil (TLW LN) -14%, GVC Holding (GVC LN) -5%, Total (FP FP) -3.5%, TomTom (TOM2 NA) -3%, Adidas (ADS GY) -2.1%"
"2020-04-15 07:01:00","2020-04-15 15:01:00","Major FX expiry options for today's NY close"
"2020-04-15 06:59:00","2020-04-15 14:59:00","South African Public Servants Union said the government reneges on pay deal for workers "
"2020-04-15 06:54:00","2020-04-15 14:54:00","Additional European Equity News"
"2020-04-15 06:54:00","2020-04-15 14:54:00","Bunds: firmer bounce off higher overnight low"
"2020-04-15 06:15:00","2020-04-15 14:15:00"," Belgium are to extend lockdown measures until May 3rd, according to Belgium press"
"2020-04-15 06:12:00","2020-04-15 14:12:00","Polish Central Banker Zyzynski says that further rate cuts cannot be ruled out, according to PAP News; however, scope for further cuts is somewhat limited"
"2020-04-15 06:04:00","2020-04-15 14:04:00","Swedish Gov't present a Spring 'Mini' Budget: measures to fight COVID-19 are worth over SEK 100bln, economy is in good shape to counter the downturn "
"2020-04-15 05:52:00","2020-04-15 13:52:00","UAE's ADNOC sets its May Murban crude Official Selling Price (OSP) at a USD 6.95/bbl discount to Platts Dubai, ADNOC is committed to reducing output from its current 4.1mln BPD"
"2020-04-15 05:47:00","2020-04-15 13:47:00","Daily European Equity Opening News"
"2020-04-15 05:42:00","2020-04-15 13:42:00","Newsquawk Bond Auction Previews - 15th April 2020"
"2020-04-15 05:22:00","2020-04-15 13:22:00","EU's Centeno says he does not rule out using Eurobonds as part of a response to the COVID-19, according to a Paper; expects European Council to give guidance on the proposed recovery fund on April 23rd, part of the fund needs to be available Spring/Summer"
"2020-04-15 05:18:00","2020-04-15 13:18:00","Newsquawk Daily European Opening News - 15th April 2020"
"2020-04-15 04:51:00","2020-04-15 12:51:00","French PM's Office says insurers made new pledges to support efforts to deal with coronavirus in which they will contribute EUR 400mln to the government solidarity fund to help firms deal with the coronavirus"
"2020-04-15 04:50:00","2020-04-15 12:50:00","ASIA-PAC MARKET WRAP: Asia exhibits caution despite firm Wall St handover"
"2020-04-15 04:40:00","2020-04-15 12:40:00","Germany coronavirus cases rose by 2486 to 127584 and death toll rose by 285 to 3254, according to the RKI Health Institute"
"2020-04-15 04:35:00","2020-04-15 12:35:00","India permits industries in rural areas to operate after April 20th despite lockdown"
"2020-04-15 04:22:00","2020-04-15 12:22:00","CIRCUIT BREAKERS (15 Apr): Hard upside or downside limit of 5% during non-US hours in Futures, 7%, 13% and 20% circuit breakers in US Futures during US hours"
"2020-04-15 04:22:00","2020-04-15 12:22:00","Australia sells AUD 13.0bln in new 0.25% November 2024 Bonds through syndication, avg. yield 0.47%, b/c 1.98"
"2020-04-15 04:08:00","2020-04-15 12:08:00","Fujifilm (4901 JT) says it has widened capacity to significantly boost production of its Avigan drug for treatment of COVID-19 patients"
"2020-04-15 03:57:00","2020-04-15 11:57:00","InterGlobe Aviation (INDIGO IS) extends suspension of flights until MAy 3rd inline with the lockdown extension"
"2020-04-15 03:53:00","2020-04-15 11:53:00","Tesla (TSLA) China car registrations reached 12709 units in March from 2314 units in February"
"2020-04-15 03:30:00","2020-04-15 11:30:00","PRE-MARKET INDIAN STOCK NEWS: India extended its lockdown to May 3rd "
"2020-04-15 03:08:00","2020-04-15 11:08:00","ASIA-PAC MID-SESSION UPDATE: Asia exhibits caution despite firm Wall St handover"
"2020-04-15 03:04:00","2020-04-15 11:04:00","China's Hong Kong Liaison Office says Hong Kong system for safeguarding national security is incomplete and efforts must be made ASAP for HK's legal systems and enforecement mechanisms to address national security"
"2020-04-15 02:20:00","2020-04-15 10:20:00","Philippines Central Bank Governor Diokno says mulling another key rate cut in approaching days"
"2020-04-15 02:12:00","2020-04-15 10:12:00","Shanghai Stock Exchange suspends trade in HNA Group bonds due today amid abnormal fluctuations"
"2020-04-15 01:55:00","2020-04-15 09:55:00","Japanese PM Abe says to consider request from coalition partner regarding JPY 100k cash handouts per person amid coronavirus impact"
"2020-04-15 01:48:00","2020-04-15 09:48:00","New Zealand Finance Minister Robertson says looking at more support for businesses and households, adds next budget will be for helping kickstart the economic rebound"
"2020-04-15 01:46:00","2020-04-15 09:46:00","PBoC conducts CNY 100bln 1-year Medium-term Lending Facility at 2.95% vs. Prev. 3.15%"
"2020-04-15 01:42:00","2020-04-15 09:42:00","Japan junior coalition partner Komeito's leader asks PM Abe to consider cash handouts of JPY 100k"
"2020-04-15 01:24:00","2020-04-15 09:24:00","PBoC has not conducted reverse repo operations so far, while sources state PBoC will conduct Medium-term Lending Facility today"
"2020-04-15 01:20:00","2020-04-15 09:20:00","South Korea reports 27 additional coronavirus cases to take total to 10,591 and 3 additional deaths for a total of 225, while there were 82 newly recovered to take total to 7,616"
"2020-04-15 01:17:00","2020-04-15 09:17:00","PRE-MARKET CHINESE STOCK NEWS: Policymakers were reported to mull merger of CITIC Securities with CSC Financial in an attempt to rival Wall St, although CITIC Securities denied it received any information regarding a merger"
"2020-04-15 01:16:00","2020-04-15 09:16:00","RBA offers to buy a total of AUD 1.5bln in bonds vs. Prev. AUD 1.5bln"
"2020-04-15 01:15:00","2020-04-15 09:15:00","PBoC sets USD/CNY mid-point at 7.0402 vs. Exp. 7.0389 (Prev. 7.0406)"
"2020-04-15 01:10:00","2020-04-15 09:10:00","BoJ offers to buy JPY 80bln in up to 1yr JGBs and JPY 320bln in 1yr-3yr JGBs"
"2020-04-15 00:52:00","2020-04-15 08:52:00","UN Secretary General Guterres says now is not the time to reduce resources for WHO operations"
"2020-04-15 00:43:00","2020-04-15 08:43:00","PRE-MARKET TAIWAN AND SINGAPORE STOCK NEWS: Singapore Airlines (SIA SP) announces 1.8bln new shares in rights issuance and SGD 3.5bln in convertible bond issuance"
"2020-04-15 00:36:00","2020-04-15 08:36:00","China's Hubei province reported 0 new coronavirus cases and 1 new death for April 14th vs. Prev. 0 new cases and 0 additional deaths for April 13th"
"2020-04-15 00:30:00","2020-04-15 08:30:00","Australian Westpac Consumer Confidence Index (Apr) 75.6 (Prev. 91.9)"
"2020-04-15 00:28:00","2020-04-15 08:28:00","Mainland China reports 46 additional coronavirus cases and 1 additional death on April 14th vs. 89 additional cases and 0 deaths on April 13th"
"2020-04-15 00:19:00","2020-04-15 08:19:00","PBoC is expected to set USD/CNY mid-point at 7.0389, according to a major newswire estimate"
"2020-04-15 00:19:00","2020-04-15 08:19:00","PBoC is expected to set USD/CNY mid-point at 7.0389, according to a major newswire estimate"
"2020-04-15 00:05:00","2020-04-15 08:05:00","Asia fails to sustain the momentum from US where markets were buoyed as liquidity conditions normalized from the Easter break and amid hopes of US re-opening soon; KOSPI remains closed and Nikkei 225 lags on currency pressure"