"gmt_time","hk_time","subject"
"2020-01-14 03:02:00","2020-01-14 11:02:00","ASIA-PAC MID-SESSION UPDATE: Asia-Pac stocks are lifted after US drops China currency manipulator label, while Chinese trade data also tops estimates"
"2020-01-14 02:30:00","2020-01-14 10:30:00","China Customs Vice Minister Zhou says Phase 1 deal will boost Chinese imports from US but won't affect China's imports from other countries, adds trade growth still faces complex external environment this year"
"2020-01-14 02:24:00","2020-01-14 10:24:00","South Korea President Moon says China has played a major role in North Korea discussions but further support is required"
"2020-01-14 02:05:00","2020-01-14 10:05:00","Taiwan central bank official says we have never used swaps to intervene in FX market"
"2020-01-14 02:00:00","2020-01-14 10:00:00","Chinese Exports (CNY)(Nov) Y/Y 9.0% vs. Exp. 2.8% (Prev. 1.3%)"
"2020-01-14 02:00:00","2020-01-14 10:00:00","Chinese Imports (CNY)(Nov) Y/Y 17.7% vs. Exp. 8.8% (Prev. 2.5%)"
"2020-01-14 02:00:00","2020-01-14 10:00:00","Chinese Trade Balance (CNY)(Nov) 330B vs. Exp. 315.0B (Prev. 274.2B)"
"2020-01-14 01:37:00","2020-01-14 09:37:00","Japanese Economic Minister Nishimura says need to continue to closely monitor weakness in external demand, factory output and economies abroad, adds consumer sentiment is improving but remains at a low level"
"2020-01-14 01:32:00","2020-01-14 09:32:00","Hyundai Engineering & Construction (000720 KS) receives KRW 609.3bln skyscraper construction order in Qatar"
"2020-01-14 01:30:00","2020-01-14 09:30:00","Resolute Mining (RSG AT) in advanced discussions to offload Ravenswood gold mine"
"2020-01-14 01:26:00","2020-01-14 09:26:00","China banking regulator vice chairman says 2019 New Yuan loans CNY 17.0tln vs. Prev. CNY 15.9tln Y/Y"
"2020-01-14 01:15:00","2020-01-14 09:15:00","PBoC sets USD/CNY mid-point at 6.8954 vs. Exp. 6.8957 (Prev. 6.9263)"
"2020-01-14 01:15:00","2020-01-14 09:15:00","PBoC skips open market operations for a daily net neutral position"
"2020-01-14 01:13:00","2020-01-14 09:13:00","PRE-MARKET CHINESE STOCK NEWS: US Treasury removed China from currency manipulator list in semi-annual report"
"2020-01-14 01:10:00","2020-01-14 09:10:00","BoJ offers to buy JPY 100bln in 10yr-25yr JGBs and JPY 30bln of 25yr+ JGBs"
"2020-01-14 01:08:00","2020-01-14 09:08:00","South Korean President Moon says there is no need to be pessimistic regarding dialogue between US and North Korea"
"2020-01-14 01:00:00","2020-01-14 09:00:00","Kia Motors (000270 KS) plans KRW 29tln investment over 6 years"
"2020-01-14 00:43:00","2020-01-14 08:43:00","US President Trump administration plans to reallocate USD 7.2bln of defence funds for the border wall "
"2020-01-14 00:39:00","2020-01-14 08:39:00","PRE-MARKET TAIWAN AND SINGAPORE STOCK NEWS: US Treasury semi-annual currency report said Taiwan is close to triggering threshold for inclusion to currency monitoring list, while Singapore has been kept on the monitoring list"
"2020-01-14 00:34:00","2020-01-14 08:34:00","US Secretary of State Pompeo says US is increasingly at risk from China's actions"
"2020-01-14 00:31:00","2020-01-14 08:31:00","Phase 1 deal will include pledge by China to buy USD 200bln of US goods over a 2-year period including USD 50bln in energy, USD 40bln in agriculture, USD 35bln-40bln in services and USD 75bln in manufactured goods, according to Politico"
"2020-01-14 00:13:00","2020-01-14 08:13:00","PBoC is expected to set the USD/CNY midpoint at 6.8957"
"2020-01-14 00:08:00","2020-01-14 08:08:00","USTR Lighthizer says have about completed translation of the Phase 1 deal which includes commitments regarding currency manipulation"
"2020-01-14 00:02:00","2020-01-14 08:02:00","Asia equity markets begin positive across the board as the region takes impetus from the fresh record highs on Wall St amid the backdrop of trade optimism heading into the Phase 1 signing and after US removed China's currency manipulator designation"