"gmt_time","hk_time","subject"
"2020-02-28 06:41:00","2020-02-28 14:41:00","NATO are to meet later today, at the request of Turkey, to discuss the situation in Syria under Article 4, according to Secretary General Stolenberg"
"2020-02-28 06:20:00","2020-02-28 14:20:00","Newsquawk Daily European Opening News - 28th February 2020"
"2020-02-28 06:15:00","2020-02-28 14:15:00","Russia's Black Sea fleet says that two frigates which are equipped with cruise missiles are being sent to the Mediterranean and Syrian Coast, according to Interfax"
"2020-02-28 06:01:00","2020-02-28 14:01:00","BASF (BAS GY) - Co. sees significant negative impact in H1 from coronavrius; Reports Q4 revenue EUR 14.7bln vs. Exp. EUR 15.1bln, Adj. EBIT EUR 765mln vs. Prev. EUR 630mln; sees 2020 adj. EBIT between EUR 4.2-4.8bln vs. Prev. EUR 4.5bln"
"2020-02-28 05:54:00","2020-02-28 13:54:00","Turkish Capital Markets regulator has banned short-selling on the Istanble stock exchange for today"
"2020-02-28 05:44:00","2020-02-28 13:44:00"," Russian Defence Ministry says Turkish soldiers should not have been in the area in Syria's Idlib according to the information provided to them by Turkey"
"2020-02-28 05:38:00","2020-02-28 13:38:00","Outgoing BoE Governor Carney says Coronavirus could mean economic growth downgrade for UK, it's too early to tell what it means for the UK, or its magnitude, Sky News Interview"
"2020-02-28 05:19:00","2020-02-28 13:19:00"," Mexico's Health Ministry says a man has tested positive for coronavirus in an initial test, but they're waiting for results from a 2nd test. If confirmed, it would be Mexico's 1st case and the 2nd in Latin America, according to BNO Newsroom"
"2020-02-28 05:18:00","2020-02-28 13:18:00","Belarus reports its first case of the coronavirus, according to Tass citing Health Ministry"
"2020-02-28 05:05:00","2020-02-28 13:05:00","Emergency margin call has been triggered for Japanese index futures, according to JSCC"
"2020-02-28 04:40:00","2020-02-28 12:40:00","New Zealand confirms its first case of the coronavirus "
"2020-02-28 03:38:00","2020-02-28 11:38:00","South Korea's Health Ministry completes tests for 1299 members of a Church in South Korea who showed symptoms of COVID-19; Results will be made available over the weekend, so far ratio of confirmed cases among suspected cases is ""very high"", reports say"
"2020-02-28 03:36:00","2020-02-28 11:36:00","Japan sells JPY tln in 2yr JGBs b/c 4.59x (Prev. 4.49x), avg. yield -0.2410% (Prev. -0.147%)"
"2020-02-28 03:32:00","2020-02-28 11:32:00","JPMorgan (JPM) restricts all non-essential travel globally"
"2020-02-28 03:23:00","2020-02-28 11:23:00","PRE-MARKET INDIA STOCK NEWS"
"2020-02-28 02:55:00","2020-02-28 10:55:00","National Australia Bank says the impact of the coronavirus are beginning to be felt across industries, with a number of companies citing an impact"
"2020-02-28 02:54:00","2020-02-28 10:54:00","Japan MOF senior official says have not decided whether to hold an emergency MOF, BoJ and FSA meeting on Friday"
"2020-02-28 02:42:00","2020-02-28 10:42:00","Tokyo Disneyland is to close from Saturday through to March 15th amid coronavirus fears, according to NHK"
"2020-02-28 02:40:00","2020-02-28 10:40:00","US President Trump tweets that there are only a small number of coronavirus cases in the US and China's numbers look to be going down, ""all countries are working well together"""
"2020-02-28 02:30:00","2020-02-28 10:30:00","New Zealand is to impose temporary travel restrictions to travellers from Iran and is also to increase health staff presence at airports"
"2020-02-28 02:26:00","2020-02-28 10:26:00","Hyundai Motors (005380 KS) - suspends productions at its Number 2 factory in Ulsan South Korea after a worker tested positive for coronavirus"
"2020-02-28 02:16:00","2020-02-28 10:16:00","Hyundai Motors (005380 KS) - One worker at its Ulsan factory in South Korea tests positive for coronavirus"
"2020-02-28 02:01:00","2020-02-28 10:01:00","ASIA-PAC MID-SESSION UPDATE: Red across the board in Asia as stocks continued bleeding from virus contagion "
"2020-02-28 02:00:00","2020-02-28 10:00:00","South Korean Finance Minister says extra budget to tackle the coronavirus will be larger than KRW 11.6tln MERS package, details to be announced next week"
"2020-02-28 01:52:00","2020-02-28 09:52:00","Japanese PM Abe says will take steps if needed to ensure the virus outbreak does not have a huge impact on the Japanese economy, we still have huge resereves to tap for response, no immediate need for additional funding"
"2020-02-28 01:51:00","2020-02-28 09:51:00","Lithuania reports its first case of coronavirus, according to BNO Newsroom"
"2020-02-28 01:16:00","2020-02-28 09:16:00","PBOC skips open market operations for a daily net neutral position"
"2020-02-28 01:15:00","2020-02-28 09:15:00","PBoC sets USD/CNY mid-point at 7.0066 vs. Exp. 7.0095 (Prev. 7.0215)"
"2020-02-28 01:00:00","2020-02-28 09:00:00","PRE-MARKET CHINESE STOCK NEWS: PBoC is to conduct CNY 5.0bln central bank swaps operations today. (Newswires) "
"2020-02-28 00:57:00","2020-02-28 08:57:00","South Korea reports 256 new cases of coronavirus, raising total to 2022"
"2020-02-28 00:54:00","2020-02-28 08:54:00","China is reportedly to resume road traffic in regions with lower virus risks "
"2020-02-28 00:43:00","2020-02-28 08:43:00","Nigeria reports the first case of coronavirus, according to BNO Newsroom"
"2020-02-28 00:37:00","2020-02-28 08:37:00","Japanese Health Minister wont rule out the chance that schools may be shut for longer than 1-2 weeks, contingent on the virus developments"
"2020-02-28 00:36:00","2020-02-28 08:36:00","PRE-MARKET TAIWAN AND SINGAPORE STOCK NEWS: Taiwan markets closed for Peace Day"
"2020-02-28 00:35:00","2020-02-28 08:35:00","US State Department says they stand by their NATO ally Turkey"
"2020-02-28 00:30:00","2020-02-28 08:30:00","Hearing that 2 people tested positve for Coronavirus in Oklahoma, according to News9, sources later noted that tests are being conducted and test results haven't been concluded positive yet"
"2020-02-28 00:27:00","2020-02-28 08:27:00","PBoC is expected to set the USD/CNY midpoint at 7.0095, according to Newswires estimates"
"2020-02-28 00:02:00","2020-02-28 08:02:00","US Health and Human Services secretary Azar repeats the risk to American from COVID19 is low but that can change"
"2020-02-28 00:01:00","2020-02-28 08:01:00","UK Lloyds Business Barometer (Feb) 23 (Prev. 23)"