"gmt_time","hk_time","subject"
"2020-02-28 21:32:00","2020-02-29 05:32:00","Newsquawk US Market Wrap - 28th February 2020: Largest weekly SPX loss since ‘08; 50bps cut priced for March FOMC"
"2020-02-28 21:29:00","2020-02-29 05:29:00","Newsquawk Central Banks - Previewing BOC; Reviewing FOMC speak, BOK, BOI, Banxico."
"2020-02-28 21:29:00","2020-02-29 05:29:00","North Korea's Kim Jong-Un is guiding overseas military drills, according to KCNA"
"2020-02-28 21:28:00","2020-02-29 05:28:00","Newsquawk Week in Focus - Week in Focus; week commencing 3rd March 2020"
"2020-02-28 21:07:00","2020-02-29 05:07:00","Fitch Affirms Ireland at 'A+'; Outlook stable"
"2020-02-28 21:06:00","2020-02-29 05:06:00","Fitch Affirms Switzerland at 'AAA'; Outlook Stable"
"2020-02-28 21:05:00","2020-02-29 05:05:00","Fitch affirms Norway at ""AAA"", Outlook Stable"
"2020-02-28 20:41:00","2020-02-29 04:41:00","US VP & COVID-19 Czar Mike Pence says there is only one American with the virus still in hospital"
"2020-02-28 20:27:00","2020-02-29 04:27:00","German government crisis committee calls on cancellations of imminent major international events and conferences, as well as intensifying cross-border measures "
"2020-02-28 20:25:00","2020-02-29 04:25:00","Turkish Defence Ministry says one Turkish soldier was killed, with two wounded, from the shelling in Idlib, Syria, where Turkish forces retaliated"
"2020-02-28 20:24:00","2020-02-29 04:24:00","White House officials are to discuss tax cuts and other emergency measures in hopes of tackling COVID-19 fallout, according to Washington Post citing people familiar with the matter"
"2020-02-28 20:12:00","2020-02-29 04:12:00","US House of Representatives members are being advised to put plans in place for office operations in the event of widespread COVID-19 infections in the US"
"2020-02-28 20:09:00","2020-02-29 04:09:00","Constellation Brands (STZ) states it has seen no impact to people, facilities or operations from COVID-19"
"2020-02-28 20:06:00","2020-02-29 04:06:00","US official says the US has info-sharing and military equipment ties with Turkey and is examining how to urgently help on that basis"
"2020-02-28 19:49:00","2020-02-29 03:49:00","Acting White House Budget Office Chief Vought says we will need supplemental funding shortly, although we have not run out of money"
"2020-02-28 19:46:00","2020-02-29 03:46:00","US Health Secretary Azar says closing some schools is possible but it depends on the circumstances; do not yet have a ""definitive link"" on how California patient contracted the virus and doesn't think it was related to the air base repatriation effort "
"2020-02-28 19:37:00","2020-02-29 03:37:00","NEC Director Kudlow says people should ""buy the dip"" in stock markets"
"2020-02-28 19:34:00","2020-02-29 03:34:00","Brazil reportedly has 182 suspected COVID-19 cases, according to state media"
"2020-02-28 19:33:00","2020-02-29 03:33:00","WTI (J0) settles USD 2.33 lower at USD 44.76/bbl; Brent (K0) settles USD 2.06 lower at USD 49.67/bbl"
"2020-02-28 19:30:00","2020-02-29 03:30:00","Fed Chair Powell says the Fed will use its tools and act as appropriate to support the economy; fundamentals for the economy remain strong but COVID-19 poses evolving risks; closely monitoring developments and their implications for the economic outlook"
"2020-02-28 19:23:00","2020-02-29 03:23:00","New York City says it is unable to reliably test for COVID-19: ""The kits that were sent to us have demonstrated performance issues and cannot be relied upon to provide an accurate result"", according to ProPublica"
"2020-02-28 19:20:00","2020-02-29 03:20:00","UK Department of Health ""As of 28th February, a total of 8,986 people have been tested:  8,966 negative. 20 positive."""
"2020-02-28 19:10:00","2020-02-29 03:10:00","Apollo (APO) has made a takeover offer for Tutor Perini (TPC), according to sources"
"2020-02-28 18:46:00","2020-02-29 02:46:00","France now has 57 confirmed COVID-19 cases (prev. 38 on Thursday); Health Minister says several virus clusters have been identified and it is now circulating in France"
"2020-02-28 18:34:00","2020-02-29 02:34:00","FCC Chairman Pai confirms that the FCC is proposing to fine four cell phone companies (VZ, T, S, TMUS) more than USD 200mln due to consumer data violations"
"2020-02-28 18:24:00","2020-02-29 02:24:00","Apple (AAPL) CEO Cook says Co has reopened over 80% of stores in China, according to FBN"
"2020-02-28 18:07:00","2020-02-29 02:07:00","North Sea Brent crude stream to load 3 cargoes in April (prev. 4 in March); Oseberg crude stream to load 5 cargoes (prev. 6); Ekofisk crude stream to load 14 cargoes (prev. 12); Troll crude stream to load 8 cargoes (prev. 10) - according to a programme"
"2020-02-28 18:02:00","2020-02-29 02:02:00","Iran Health Ministry spokesperson rejects the BBC report that there could be at least 210 deaths from COVID-19"
"2020-02-28 18:01:00","2020-02-29 02:01:00","Baker Hughes Rig Count (28th Feb): Oil -1 at 678, natural gas unchanged at 110 and total -1 at 790 rigs"
"2020-02-28 18:00:00","2020-02-29 02:00:00","Amazon (AMZN) is asking all employees to defer non-essential travel, including in the US"
"2020-02-28 17:40:00","2020-02-29 01:40:00","North Sea Forties Crude stream is to load 17 cargoes in April (vs. 18 in March), according to a trade source"
"2020-02-28 17:38:00","2020-02-29 01:38:00","Libyan oil production stood at 120.6k BPD as of February 28th (prev. 136k BPD on February 26th)"
"2020-02-28 17:35:00","2020-02-29 01:35:00","White Housed spokesperson says Presidents Trump and Erdogan agreed that Syrian government, Russia and Iran must halt their offenses in Northwest Syria"
"2020-02-28 17:32:00","2020-02-29 01:32:00","US CDC says risk to Americans from COVID-19 still remains low and total cases has increased to 61 from 60"
"2020-02-28 17:30:00","2020-02-29 01:30:00","General Motors (GM) to add more than 1,200 jobs at its Lansing, MI assembly plants"
"2020-02-28 17:24:00","2020-02-29 01:24:00","US CDC confirms 44 cases of COVID-19 from repatriated citizens from the Diamond Princess cruise ship"
"2020-02-28 17:21:00","2020-02-29 01:21:00","Nigerian official says 28 people have been quarantined in Nigeria following contact with a COVID-19 patient "
"2020-02-28 17:20:00","2020-02-29 01:20:00","Apple (AAPL) CEO Cook says he is unsure if constraints to supply chains will put a hit on next quarter"
"2020-02-28 17:18:00","2020-02-29 01:18:00","Turkish President Erdogan and US President Trump agreed on a need to carry out additional steps to resolve the humanitarian dram in Idlib, Syria, according to an official"
"2020-02-28 17:16:00","2020-02-29 01:16:00","CNN Super Tuesday Democratic primary poll: Sanders holds big lead (as expected by FiveThirtyEight polling)"
"2020-02-28 17:12:00","2020-02-29 01:12:00","Witness reports of a major fire ongoing at Paris Gare de Lyon area (a large train station in France)"
"2020-02-28 17:11:00","2020-02-29 01:11:00","Iranian COVID-19 death toll could be at least 210, according to BBC "
"2020-02-28 17:09:00","2020-02-29 01:09:00","Death toll in Italy stands at 21 while the cases increased to 850 (Prev. 650 on Thursday)"
"2020-02-28 17:08:00","2020-02-29 01:08:00","Chicago official says the city is monitoring ""hundreds"" of recent travelers for COVID-19"
"2020-02-28 17:03:00","2020-02-29 01:03:00","SNB's Zurbruegg says COVID-19 is a factor in the CHF's strength; rate differential is key for the exchange rate; can't say if supply disruptions will lead to inflation pressures"
"2020-02-28 17:00:00","2020-02-29 01:00:00","Occidental Petroleum (OXY) is confident it will reach USD 15bln of divestitures "
"2020-02-28 16:59:00","2020-02-29 00:59:00","Three further COVID-19 deaths in Italy's Lombardy region, bringing the total to at least 20, according to an official"
"2020-02-28 16:49:00","2020-02-29 00:49:00","Illinois Governor Pritzker says the state ""successfully contained"" COVID-19 to two confirmed cases and both patients have now fully recovered and are back home"
"2020-02-28 16:42:00","2020-02-29 00:42:00","US House of Representatives could vote on emergency COVID-19 bill as soon as next week, according to a congressional source"
"2020-02-28 16:36:00","2020-02-29 00:36:00","FCC votes 3-2 to advance auction spectrum, which will approve up to USD 9.7bln in incentive payments to five existing satellite users  "
"2020-02-28 16:36:00","2020-02-29 00:36:00","FCC votes 3-2 to advance auction spectrum, which will approve up to USD 9.7bln in incentive payments to five existing satellite users  "
"2020-02-28 16:30:00","2020-02-29 00:30:00","European stocks prelim cash closes: Stoxx50 -4.3% at 3047, Dax -4.3% at 11836, FTSE 100 -3.4% at 6566, Cac 40 -3.6% at 5299, IBEX -3.1% at 8707, FTSE MIB -3.5% at 22006, SMI -3.7% at 9831."
"2020-02-28 16:25:00","2020-02-29 00:25:00","EIA: US crude oil production fell by 84k BPD in December to 12.779mln BPD "
"2020-02-28 16:22:00","2020-02-29 00:22:00","US Congress is working on a USD 6bln-8bln package to fight against COVID-19"
"2020-02-28 16:22:00","2020-02-29 00:22:00","Weekly FX Wrap: coronavirus captures all the attention and crushes risk appetite"
"2020-02-28 16:20:00","2020-02-29 00:20:00","Goldman Sachs sees a ""short-lived"" global economic contraction and no outright global recession "
"2020-02-28 16:17:00","2020-02-29 00:17:00","Newsquawk Central Banks - Previewing BOC; Reviewing FOMC speak, BOK, BOI, Banxico."
"2020-02-28 16:17:00","2020-02-29 00:17:00","Newsquawk Daily US Equity Opening News - Week in Focus; week commencing 3rd March 2020"
"2020-02-28 16:16:00","2020-02-29 00:16:00","Occidental Petroleum (OXY) could trim 2020 spending if the current situation doesn't improve; maintaining FY20 capex view of USD 5.2bln-5.4bln"
"2020-02-28 16:11:00","2020-02-29 00:11:00","EU health ministers are to hold an extraordinary meeting next Friday due to the COVID-19"
"2020-02-28 16:04:00","2020-02-29 00:04:00","Spirit Aerosystems (SPR) expects to reach a fuselage rate of 52 per month by late 2022"
"2020-02-28 16:01:00","2020-02-29 00:01:00","WHO's Tedros says it would be a big mistake to abandon the containment strategy, should do this aggressively in each country and we can stop it"
"2020-02-28 16:00:00","2020-02-29 00:00:00","Turkish Officials have told Russian delegation during talks, that a sustainable ceasefire must immediately be established in Syria's, Idlib, according to the Turkish Foreign Ministry"
"2020-02-28 15:56:00","2020-02-28 23:56:00","WHO's Ryan says that with a robust public health response, the course of these multiple epidemics can be altered significantly; the word 'Pandemic' does not need to enter the history of the event"
"2020-02-28 15:56:00","2020-02-28 23:56:00","Russia's Kremlin says the leaders of Russia and Turkey could meet on March 5th or 6th, according to RIA"
"2020-02-28 15:56:00","2020-02-28 23:56:00","NEC Director Kudlow expects a rebound in the stock market, citing ""sound"" fundamentals of the economy; does not think people should panic, stocks look pretty cheap to me"
"2020-02-28 15:45:00","2020-02-28 23:45:00","WHO says much of the global community is not yet ready to implement measures that have contained the coronavirus in China, according to a report"
"2020-02-28 15:43:00","2020-02-28 23:43:00","NEC Director Kudlow says there’s no higher priority than the safety of Americans, by all accounts the President has taken historic and unprecedented actions... we believe that the risks here are on the low"
"2020-02-28 15:41:00","2020-02-28 23:41:00","Lagardere (MMB FP) - Activist Investor Amber now has 13.6% of Co's capital and 10.19% of their voting rights"
"2020-02-28 15:38:00","2020-02-28 23:38:00","WHO Expert says there is no reason to think it would act differently in different climates, can transmit the same in China as in Mexico, regarding the coronavirus"
"2020-02-28 15:34:00","2020-02-28 23:34:00","CDC official says in prepared remarks to lawmakers says the current risk to the US from COVID-19 is low, according to a source "
"2020-02-28 15:34:00","2020-02-28 23:34:00","WHO's Tederos says over 20 vaccines are in development global, and several in clinical trials; expects results within the next few weeks"
"2020-02-28 15:32:00","2020-02-28 23:32:00","Fed's Bullard (Non-Voter, Dove) says he does not pre-judge the March meeting, but does not feel the Fed has to cut just on the basis of market pricing "
"2020-02-28 15:26:00","2020-02-28 23:26:00","WHO says its assessment of the risks regarding the spread of COVID19 is now ""very high at a global level"" (prev. just a ""high"" level)"
"2020-02-28 15:25:00","2020-02-28 23:25:00","Department of Energy says US will sell 12mln barrels of crude from its Strategic Petroleum Reserve, in compliance with the 2015 Budget Act"
"2020-02-28 15:19:00","2020-02-28 23:19:00","Chile copper producer Codelco has recieved government permission for a USD 1bln expansion of its Salvador copper mine"
"2020-02-28 15:18:00","2020-02-28 23:18:00","SNB says that COVID-19 has raised economic risk, adding that if the international environment was to deteriorate, this would have consequences for the small and open Swiss economy"
"2020-02-28 15:12:00","2020-02-28 23:12:00","Atlanta Fed GDPnow tracker 2.6% in Q1 2020 (prev. 2.7%) "
"2020-02-28 15:07:00","2020-02-28 23:07:00","Volkswagen (VOW3 GY) - FY revenue rose 7.1% to EUR 252.6bln, operating profit before special items rose 12.8% to EUR 19.3bln, Adj. operating profit EUR 19.3bln vs. Exp. EUR 18.6bln"
"2020-02-28 14:50:00","2020-02-28 22:50:00","Motiva Port Arthur, Texas Refinery (636k BPD) restarts its small crude unit and hydrotreater, according to sources"
"2020-02-28 14:43:00","2020-02-28 22:43:00","Volvo Cars says production situation in China has improved due to the fact it could open its production plant earlier this week"
"2020-02-28 14:43:00","2020-02-28 22:43:00","Italy will certainly use budget flexibility over coronavirus outbreak, as foreseen by EU rules; is evident the virus will impact economic growth"
"2020-02-28 14:42:00","2020-02-28 22:42:00","US Equity Open: MMM +1.8%, MNST +0.9%, NFLX +0.9%, MYL -9.9%, NEM -5.5%, OXY -4.6%"
"2020-02-28 14:42:00","2020-02-28 22:42:00","New coronavirus criteria means the International Trade Fair should be cancelled, Bild citing German Health Ministry"
"2020-02-28 14:38:00","2020-02-28 22:38:00","Fed's Bullard (Non-Voter, Dove) does not see rates going negative in the US"
"2020-02-28 14:32:00","2020-02-28 22:32:00","Nevada (Jan) casino gaming Revenue USD 1.04bln (+5.5% Y/Y); Las Vegas strip Revenue USD 572mln (+7.5% Y/Y)"
"2020-02-28 14:32:00","2020-02-28 22:32:00","Fed’s Bullard (non-voter, dovish) says the world is a long way from the COVID-19 approaching the mortality levels of the seasonal flu, even if the market is indicating a worse outcome"
"2020-02-28 14:31:00","2020-02-28 22:31:00","Russian Finance Minister says he is confident that oil prices will not stay low for long "
"2020-02-28 14:05:00","2020-02-28 22:05:00","Fed's Bullard (non-voter) says US rate cuts are ""a possibility"" if coronavirus intensifies but it is not the base case, if coronavirus intensifies to a global pandemic with health impacts approaching seasonal Flu impacts, the Fed might react"
"2020-02-28 14:04:00","2020-02-28 22:04:00","Newsquawk Daily US Equity Opening News - 28th February 2020"
"2020-02-28 14:01:00","2020-02-28 22:01:00","Turkish Communications Director says President Erdogan told Russian President Putin that all Syrian governments have become targets and will be hit"
"2020-02-28 13:59:00","2020-02-28 21:59:00","US White House Chief of Staff Mulvaney says schools may need to be closed due to the coronavirus"
"2020-02-28 13:59:00","2020-02-28 21:59:00","Fixed and FX latest: NA data a minor distraction during nCoV vigil"
"2020-02-28 13:43:00","2020-02-28 21:43:00","Spirit Aerosystems (SPR) says it will resume Boeing (BA) 737 max production in March and slowly ramp up output in 2020, where Boeing (BA) will pay USD 275mln in cash to SPR"
"2020-02-28 13:41:00","2020-02-28 21:41:00","Fed's Kaplan (Voter) says he is watching credit spreads and liquidity, and it is too soon to comment on what the Federal reserve will do amid the market downturn"
"2020-02-28 13:18:00","2020-02-28 21:18:00","Mexico Deputy Health Minister has confirmed its first case of the coronavirus"
"2020-02-28 12:59:00","2020-02-28 20:59:00","Eurogroup Head Centeno says coronavirus is a downside risk but it is premature at this stage to analyst the imapct on the economy, notes we stand ready to act if it becomes ""less temporary"" "
"2020-02-28 12:35:00","2020-02-28 20:35:00","ECB’s Weidmann (hawk) cautions against undermining the debt brake, suggests previous surpluses provides some fiscal leeway "
"2020-02-28 12:34:00","2020-02-28 20:34:00","Scotiabank FX Daily - Equity Rout Drives JPY & CHF Up, Commodity FX Down  "
"2020-02-28 12:32:00","2020-02-28 20:32:00","Spirit Aerosystems (SPR) is not providing guidance due to uncertainty surrounding the return of the Boeing (BA) 737 MAX jet"
"2020-02-28 12:32:00","2020-02-28 20:32:00","Spirit Aerosystems (SPR) is not providing guidance due to uncertainty surrounding the return of the Boeing (BA) 737 MAX jet"
"2020-02-28 11:55:00","2020-02-28 19:55:00","Deutsche Post (DPW GY) are looking for a EUR 60-70mln negative impact on EBIT for the month of February amid COVID-19"
"2020-02-28 11:48:00","2020-02-28 19:48:00","France's Finance Minister says they have decided the coronavirus can be a cause for declaring force majeure in public contracts with SMES"
"2020-02-28 11:44:00","2020-02-28 19:44:00","Newsquawk Daily US Opening News - 28th February 2020"
"2020-02-28 11:42:00","2020-02-28 19:42:00","French Finance Minister Le Maire says that we are ready to take all necessary decisions at the European level in order to support the economy "
"2020-02-28 11:41:00","2020-02-28 19:41:00","RBA watcher McCrann sees RBA cutting rates at its meeting next week "
"2020-02-28 11:32:00","2020-02-28 19:32:00","Newsquawk EU Mid Session - 28th February 2020; The global equity slide continues as COVID-19 dominates sentiment "
"2020-02-28 11:28:00","2020-02-28 19:28:00","Fixed Income: bears emerge from the woods, but fortune still favours bulls"
"2020-02-28 11:24:00","2020-02-28 19:24:00","Brazil is likely to cut its GDP growth forecast as a result of the coronavirus and currently does not see fiscal stimulus being necessary, according to local press citing a government official"
"2020-02-28 11:22:00","2020-02-28 19:22:00","NATO Secretary General Stoltenberg says that NATO members are considering more support for Turkey"
"2020-02-28 11:15:00","2020-02-28 19:15:00","Wirecard (WDI GY) affirms 2020 EBITDA guidance despite COVID-19, according to Business Insider"
"2020-02-28 11:13:00","2020-02-28 19:13:00","Commerzbank (CBK GY) – Capital Group’s stake in Commerzbank has been increased to 4.82%"
"2020-02-28 11:11:00","2020-02-28 19:11:00","FX Morning Colour: investors flock to the Yen and fellow safe havens, but Gold shunned"
"2020-02-28 11:10:00","2020-02-28 19:10:00","Multiple OPEC members including Saudi Arabia are leaning in favour of a deeper oil output reduction with discussions of a 1mln bpd cut vs. Prev. suggestion of 0.6mln bpd, according to sources"
"2020-02-28 10:57:00","2020-02-28 18:57:00","Germany economy spokesperson says no stimulus is currently planned, but we need to improve the tax framework"
"2020-02-28 10:56:00","2020-02-28 18:56:00","ECB's Weidmann (hawk) says there is no need for any immediate monetary action due to the coronavirus"
"2020-02-28 10:43:00","2020-02-28 18:43:00","Germany's Health Ministry says almost 60 confirmed COVID19 cases have been reported in the country"
"2020-02-28 10:27:00","2020-02-28 18:27:00","Sandvik (SAND SS) notes that the re-opening of Chinese operations which began on 10th February is progressing will"
"2020-02-28 10:20:00","2020-02-28 18:20:00","German authorities have raided the offices of Porsche (PAH3 GY), Der Spiegel"
"2020-02-28 10:13:00","2020-02-28 18:13:00","Societe Generale maintain their 2020 brent forecast at USD 56.25/bbl"
"2020-02-28 10:12:00","2020-02-28 18:12:00","Automakers have been notified that Geneva's car show is to be cancelled, according to sources"
"2020-02-28 10:11:00","2020-02-28 18:11:00","WHO Spokesman says the coronavirus outbreak is 'getting bigger' the scenario of it reaching multiple, 'if not all countries' is something that we have warned about for a while"
"2020-02-28 10:10:00","2020-02-28 18:10:00","Russian Foreign Minister Lavrov says that Russia and Turkey are ready to continue cooperation regarding Syria's Idlib, RIA: Presidents Erdogan and Putin have spoken by phone, discussed implementation of agreements"
"2020-02-28 10:05:00","2020-02-28 18:05:00","China's State Planner says they are to create a list of small-companies at risk of bankruptcy from the coronavirus, and encourage larger Co's to offer support"
"2020-02-28 10:00:00","2020-02-28 18:00:00","ECB's Weidmann says impact from coronavirus cannot be measured yet "
"2020-02-28 09:54:00","2020-02-28 17:54:00","Netherlands has reported its second case of the coronavirus, with the diagnosis reported in Amsterdam "
"2020-02-28 09:51:00","2020-02-28 17:51:00","Tokyo senior official says there is no ""plan B"" for the Tokyo Olympics despite concern over COVID-19"
"2020-02-28 09:42:00","2020-02-28 17:42:00","UK announces it has 19 confirmed cases of coronavirus "
"2020-02-28 09:17:00","2020-02-28 17:17:00","ECB's Vasiliauskas does not see that the ECB can do anything in March regarding the coronavirus"
"2020-02-28 09:09:00","2020-02-28 17:09:00","Volkswagen (VOW3 GY) has struck an agreement with consumer groups, according to a German court; details will be released today at 1200GMT"
"2020-02-28 08:58:00","2020-02-28 16:58:00","Commerzbank (CBK GY) - have been urged to make deep cuts as well as to overhaul their business model, via a consultant review"
"2020-02-28 08:49:00","2020-02-28 16:49:00","The Mayor of Nice announced a coronavirus diagnosis in the area from someone who has returned from Milan, Italy"
"2020-02-28 08:48:00","2020-02-28 16:48:00","Turkish Defence Minister says that the nation's ground forces and drones have targeted over 200 Syrian government targets following attacks in Idlib, according to Anadolu "
"2020-02-28 08:43:00","2020-02-28 16:43:00","UK debt and STIR futures burst back into Liffe, but momentum fading"
"2020-02-28 08:40:00","2020-02-28 16:40:00","Japan's Hokkaido has declared a state of emergency; Hokkaido is the northernmost of the nation's main islands "
"2020-02-28 08:31:00","2020-02-28 16:31:00","UPDATED: Boeing (BA) 777 plane returning to Moscow airport due to a cracked cockpit window has landed safely"
"2020-02-28 08:29:00","2020-02-28 16:29:00","EU's Foreign Affairs Minister Borrell says there is a risk that events in Idlib could slide into a major open international military confrontation"
"2020-02-28 08:26:00","2020-02-28 16:26:00","BAML: funds saw outflows of USD 20bln, high-yield bonds outflows of USD 6.9bln; USD 12.9bln into bond funds while US equity funds saw the largest outflow in 9-weeks of USD 17.7bln"
"2020-02-28 08:19:00","2020-02-28 16:19:00","Major FX option expiries for today's NY cut"
"2020-02-28 08:11:00","2020-02-28 16:11:00","Indonesian Central Bank say they have intervened in the FX market, this has been done directly through inter-bank and brokers on Friday, according to an Official "
"2020-02-28 08:10:00","2020-02-28 16:10:00","Japanese PM Abe is to hold a news conference at 09:00GMT on Sunday, Kyodo News"
"2020-02-28 08:09:00","2020-02-28 16:09:00","Kuwait says their total number of coronavirus cases has reached 45, Kuwait News Agency"
"2020-02-28 08:08:00","2020-02-28 16:08:00","South Korea case count now stands at 2337, as an additional 315 are reported, CDC"
"2020-02-28 08:06:00","2020-02-28 16:06:00","European Equity Movers this Morning: Rolls Royce (RR/ LN) +6.5%; ThyssenKrupp (TKA GY) +3.3%; IAG (IAG LN) -8.2%; GVC (GVC LN) -10.0%; Munich Re (MUV2 GY) -9.2%; Air France (AF FP) -6.8%; William Hill (WMH LN) -6.9%; Lufthansa (LHA GY) -7.0%"
"2020-02-28 08:03:00","2020-02-28 16:03:00","BoJ say they plan to keep their current pace of bond buying in March "
"2020-02-28 07:56:00","2020-02-28 15:56:00","16 Syrian army members have been killed in Turkish shelling in NorthWestern Syria, Sky News Arabia"
"2020-02-28 07:53:00","2020-02-28 15:53:00","Bunds: another day and another big figure"
"2020-02-28 07:39:00","2020-02-28 15:39:00","Boeing (BA) 777 plane is returning to Moscow airport due to a cracked cockpit window, craft is carrying over 200 people, Tass citing Emergency Services"
"2020-02-28 07:29:00","2020-02-28 15:29:00","The U.K. government is planning to also publish its negotiating objectives for a U.S. trade deal on Monday, according to Politico "
"2020-02-28 07:18:00","2020-02-28 15:18:00","Senior Russian Lawmaker says that any full-scale Turkish military operation in Syria's, Idlib would end badly for Turkey, according to Interfax"
"2020-02-28 07:18:00","2020-02-28 15:18:00","Senior Russian Lawmaker says that any full-scale Turkish military operation in Syria's, Idlib would end badly for Turkey, according to Interfax"
"2020-02-28 07:15:00","2020-02-28 15:15:00","China's National Health Commission says that recovered coronavirus patients have not been found to be infectious"
"2020-02-28 07:10:00","2020-02-28 15:10:00","A man in Japan has died from the coronavirus, NHK"
"2020-02-28 07:04:00","2020-02-28 15:04:00","Additional European Equities post release of the Daily European Equity Opening News"
"2020-02-28 06:52:00","2020-02-28 14:52:00","Turkey's Communication Director says the international community must implement a Syria no-fly zone"
"2020-02-28 06:48:00","2020-02-28 14:48:00","Daily European Equity Opening News"
