"gmt_time","hk_time","subject"
"2018-06-03 23:50:00","2018-06-04 07:50:00","Japanese Monetary Base (May) Y/Y 8.1% vs. Exp. 7.4% (Prev. 7.8%)"
"2018-06-03 23:50:00","2018-06-04 07:50:00","IATA lowers 2018 global airline profit forecast to USD 33.8bln vs. Prev. forecast of USD 38.4bln"
"2018-06-03 23:50:00","2018-06-04 07:50:00","Japanese Monetary Base End of Period (JPY)(May) 492.6T vs. Exp. 492.9T (Prev. 498.3T)"
"2018-06-03 23:29:00","2018-06-04 07:29:00","PRE-MARKET AUSTRALIAN, JAPANESE AND SOUTH KOREAN STOCK NEWS: CBA to pay AUD 700mln to resolve AUSTRAC proceedings; Trump declares US-North Korea summit is back on"
"2018-06-03 22:52:00","2018-06-04 06:52:00","China Q2 growth is expected at between 6.7%-6.8%, according to China Daily Commentary"
"2018-06-03 22:49:00","2018-06-04 06:49:00","Commonwealth Bank of Australia (CBA AT) resolves anti-money laundering/counter-terrorist finance proceedings with AUSTRAC in which it will pay civil penalty of AUD 700mln "
"2018-06-03 22:10:00","2018-06-04 06:10:00","ASIAN DAILY ECONOMIC RELEASES CALENDAR NOW AVAILABLE IN THE RESEARCH SECTION: Highlights Include Australian Retail Sales and Japanese Monetary Base; New Zealand is shut for holiday"
"2018-06-03 21:15:00","2018-06-04 05:15:00","DAILY ASIA-PAC OPENING NEWS:"
"2018-06-03 21:00:00","2018-06-04 05:00:00","ASIA-PAC SERVICE IS NOW LIVE FOR TODAY'S SESSION"