"gmt_time","hk_time","subject"
"2018-04-12 01:34:00","2018-04-12 09:34:00","BoJ Executive Director Maeda says central bank is moving steadily towards inflation target and says will persistently continue with monetary easing"
"2018-04-12 01:32:00","2018-04-12 09:32:00","White House National Security Council are to meet Thursday afternoon to decide on Syria response, according to CNN citing sources"
"2018-04-12 01:32:00","2018-04-12 09:32:00","Australian Value of Loans (Feb) M/M 1.3% (Prev. 0.5%)"
"2018-04-12 01:25:00","2018-04-12 09:25:00","Toshiba (6502 JT) said to likely miss the deadline for China approval of chip unit sale, but is planning to go ahead with the sale to Bain"
"2018-04-12 01:15:00","2018-04-12 09:15:00","Australia Communications and Media Authority to roll out new rules for gambling advertisements on streaming media"
"2018-04-12 01:15:00","2018-04-12 09:15:00","PBoC sets CNY mid-point at 6.2834 (Prev. 6.2911)"
"2018-04-12 01:12:00","2018-04-12 09:12:00","PRE-MARKET CHINESE  STOCK NEWS: China State Construction Engineering (601668 CH) FY17 net CNY 32.9bln vs. Prev. CNY 29.9bln Y/Y"
"2018-04-12 01:11:00","2018-04-12 09:11:00","PBoC skips open market operations again today"
"2018-04-12 01:08:00","2018-04-12 09:08:00","PBoC Governor Yi Gang says Chinese Q1 data has been slightly better than estimated"
"2018-04-12 01:03:00","2018-04-12 09:03:00","PBoC Governor Yi Gang says international financial institutions like IMF played key role in Belt & Road and that the initiative aims for mutually beneficial cooperation"
"2018-04-12 01:00:00","2018-04-12 09:00:00","Australian Consumer Inflation Expectations (Apr) 3.6% (Prev. 3.7%)"
"2018-04-12 00:48:00","2018-04-12 08:48:00","British Chambers of Commerce says domestic demand remains muted and that growth is being led by the global environment"
"2018-04-12 00:32:00","2018-04-12 08:32:00","PRE-MARKET TAIWAN AND SINGAPORE STOCK NEWS: Hon Hai revenue reaches record for Q1"
"2018-04-12 00:25:00","2018-04-12 08:25:00","BoJ Governor Kuroda says will maintain QQE w/ YCC for as long as necessary to reach 2% target in stable manner, adds will adjust policy as needed to maintain momentum towards price target & will keep increasing monetary base till inflation stably tops 2%"
"2018-04-12 00:03:00","2018-04-12 08:03:00","Asia stocks begin mixed amid a mild improvement in tone from Wall St, where geopolitical concerns and hawkish FOMC minutes saw all majors in the red; ASX 200 (+0.1%), Nikkei 225 (-0.1%), KOSPI (+0.2%)"
"2018-04-12 00:03:00","2018-04-12 08:03:00","Asia stocks begin mixed amid a mild improvement in tone from Wall St, where geopolitical concerns and hawkish FOMC minutes saw all majors in the red; ASX 200 (+0.1%), Nikkei 225 (-0.1%), KOSPI (+0.2%)"