"gmt_time","hk_time","subject"
"2018-08-20 23:45:00","2018-08-21 07:45:00","Australian Home Affairs Minister Dutton is to step down after failed leadership challenge"
"2018-08-20 23:33:00","2018-08-21 07:33:00","PRE-MARKET AUSTRALIAN, JAPANESE AND SOUTH KOREAN STOCK NEWS: Australian PM Turnbull survives leadership challenge; Earnings from Amcor and BHP"
"2018-08-20 23:30:00","2018-08-21 07:30:00","Australian ANZ Roy Morgan Consumer Confidence (Aug 19) W/W 114.1 (Prev. 118.2)"
"2018-08-20 23:29:00","2018-08-21 07:29:00","Australian PM Turnbull wins leadership vote for ruling Liberal Party by 48 to 35 votes"
"2018-08-20 23:16:00","2018-08-21 07:16:00","Reports note that Australian Home Affairs Minister Dutton is to challenge PM Turnbull for leadership"
"2018-08-20 23:13:00","2018-08-21 07:13:00","Twitter reports note that Australia's Liberal Party leadership has been declared vacant, which means there is a challenge to PM Turbull "
"2018-08-20 22:56:00","2018-08-21 06:56:00","UK Foreign Secretary Hunt is said to call for further sanctions on Russia, according to Sky reports"
"2018-08-20 22:50:00","2018-08-21 06:50:00","Chinese insurance companies are reported to have raised purchases of A-shares, according to press reports"
"2018-08-20 22:18:00","2018-08-21 06:18:00","BHP (BHP AT) FY18 net USD 3.7bln vs. Exp. USD 6.6bln, Prev. USD 5.9bln Y/Y, underlying profit USD 9.6bln vs. Exp. USD 9.2bln"
"2018-08-20 22:03:00","2018-08-21 06:03:00","RBA Governor Lowe reiterates likely next move in rates will be up and not down"
"2018-08-20 21:57:00","2018-08-21 05:57:00","US President Trump declines to say whether he will undergo interview with Special Counsel Mueller's team which he states could be a perjury trap"
"2018-08-20 21:48:00","2018-08-21 05:48:00","ASIAN DAILY ECONOMIC RELEASES CALENDAR NOW AVAILABLE IN THE RESEARCH SECTION: Highlights Include RBA Minutes and Governor Lowe Comments, New Zealand Credit Card Spending & Japanese 29yr Auction"
"2018-08-20 21:28:00","2018-08-21 05:28:00","DAILY ASIA-PAC OPENING NEWS"
"2018-08-20 21:20:00","2018-08-21 05:20:00","US President Trump says it is likely will have a 2nd summit with North Korean leader Kim"
"2018-08-20 21:00:00","2018-08-21 05:00:00","US SERVICE IS NOW CLOSED, PLEASE SWITCH OVER TO THE ASIA CHANNEL"
"2018-08-20 21:00:00","2018-08-21 05:00:00","ASIA-PAC SERVICE IS NOW LIVE FOR TODAY'S SESSION"
"2018-08-20 20:42:00","2018-08-21 04:42:00","US President Trump says it is fine if Iranian President Rouhani wants to meet him, but he could not care less if not"
"2018-08-20 20:39:00","2018-08-21 04:39:00","US President Trump says thought he had a deal with Turkey for pastor's release and that he helped Israel to free a Turkish citizen for the pastor's release"
"2018-08-20 20:38:00","2018-08-21 04:38:00","US President Trump says would consider lifting Russian sanctions if Moscow took steps to cooperate with US on issues such as Syria and Ukraine"
"2018-08-20 20:20:00","2018-08-21 04:20:00","US President Trump has no time-frame for ending China trade dispute, does not anticipate much coming from the trade talks with China this week"
"2018-08-20 20:08:00","2018-08-21 04:08:00","RANsquawk US Market Wrap - 20th August 2018 - Trump takes another swipe at the Fed"
"2018-08-20 19:50:00","2018-08-21 03:50:00","US President Trump says he disagrees with the Fed’s decision to hike interest rates, saying he is not thrilled with Powell for doing so"
"2018-08-20 19:47:00","2018-08-21 03:47:00","BP Whiting Indiana Refinery is running above normal capacity after the restart of its crude unit, according to sources"
"2018-08-20 19:38:00","2018-08-21 03:38:00","Tesla’s (TSLA) cash fell to USD 1.69bln in the first six weeks of Q3"
"2018-08-20 19:26:00","2018-08-21 03:26:00","IMAX’s (IMAX) VR camera project with Alphabet (GOOGL) has been cancelled, according to Variety"
"2018-08-20 18:43:00","2018-08-21 02:43:00","Apple (AAPL) is reportedly planning an updated, cheaper Mac computer to revive desktop computer sales"
"2018-08-20 18:34:00","2018-08-21 02:34:00","WTI (U8) FUTURES SETTLE  52c HIGHER AT USD 66.43/bbl, Brent (V8) FUTURES SETTLE 38c HIGHER AT USD 72.21/bbl"
"2018-08-20 18:33:00","2018-08-21 02:33:00","World refined Copper market deficit narrowing to 31,000 tons in May from 98,000 tons in April, according to ICSG"
"2018-08-20 18:02:00","2018-08-21 02:02:00","Nvidia (NVDA) RTX Platform is introducing real time Ray Tracing and AI to a range of blockbuster games"
"2018-08-20 17:04:00","2018-08-21 01:04:00","The DoE has offered 11mln barrels sour crude for sale from the US reserves, newswires report"
"2018-08-20 16:57:00","2018-08-21 00:57:00","ECB's Weidmann says central banks may need to tackle imbalances "
"2018-08-20 16:56:00","2018-08-21 00:56:00","US Agricultural Secretary Perdue says a trade war is needed to get exports up and to get a level field "
"2018-08-20 16:35:00","2018-08-21 00:35:00","CNBC’s Najarian notes option activity in Range Resources (RRC) and Autodesk (ADSK)"
"2018-08-20 16:16:00","2018-08-21 00:16:00","France’s Macron and Germany's Merkel will be meeting in Paris early September to discuss Brexit; according to a French official "
"2018-08-20 15:54:00","2018-08-20 23:54:00","US President Trump is said to have been complaining about Fed raising rates, and reportedly lamented Powell hasn’t been a cheap money fed chair, which he expected, according to three people familiar with the matter"
"2018-08-20 15:47:00","2018-08-20 23:47:00","Fed's Bostic (voter, dovish) says the economy no longer needs the stimulus it required before; the economy is doing pretty well, GDP is 'strong' and unemployment rate 'very very low' historically"
"2018-08-20 15:47:00","2018-08-20 23:47:00","The SEC faces pressure to act swiftly on Tesla (TSLA), but to not blow up any potential privatization deal that would be good for investors, according to FBN's Gasparino"
"2018-08-20 15:38:00","2018-08-20 23:38:00","EUROPEAN PRELIMINARY CASH EQUITY CLOSE: EURO STOXX 50 (+0.69%), FTSE 100 (+0.46%), DAX (+0.97%), CAC (+0.65%), IBEX (+0.53%), FTSE MIB (+0.32%), SMI (+0.57%)"
"2018-08-20 15:18:00","2018-08-20 23:18:00","Moody's says it is extending its review for downgrade on Italy's Baa2 ratings as to get better visibility on Italy's policy direction"
"2018-08-20 15:18:00","2018-08-20 23:18:00","Moody's says it is extending its review for downgrade on Italy's Baa2 ratings as to get better visibility on Italy's policy direction"
"2018-08-20 15:00:00","2018-08-20 23:00:00","WTO confirms Turkey has lodged a complaint against US tariffs, according to AFP news"
"2018-08-20 14:44:00","2018-08-20 22:44:00","SEC reportedly under pressure to move quickly with investigation of Tesla (TSLA), Fox reports citing sources"
"2018-08-20 14:40:00","2018-08-20 22:40:00","Canadian PM Trudeau is looking forward to more NAFTA engagement shortly"
"2018-08-20 14:31:00","2018-08-20 22:31:00","Daily FX Wrap: minimal movement out of moribund Monday bounds"
"2018-08-20 14:27:00","2018-08-20 22:27:00","HP Enterprises (HPE) enters into a cloud solutions agreement with an Alibaba (BABA) unit"
"2018-08-20 14:15:00","2018-08-20 22:15:00","Linde (LIN GY) and Praxair (PX) merger approved by EU antitrust regulator"
"2018-08-20 14:09:00","2018-08-20 22:09:00","Standard Chartered (STAN LN) completes sale of principal finance real estate business in Asia to Actis; also in talks to sell remaining non-Asia principal finance real estate business to Intermediate Capital Group; according to sources"
"2018-08-20 13:54:00","2018-08-20 21:54:00","BoC's Wilkins says high levels of debt mean monetary policy has more impact; adds mortgage holders will eventually feel higher rates"
"2018-08-20 13:43:00","2018-08-20 21:43:00","Of note for PG&E (PCG) and Edison (EIX); California State Senator Dodd says lawmakers are abandoning attempts to protect electrical utilities from wildfire liability"
"2018-08-20 13:40:00","2018-08-20 21:40:00","RPM International (RPM) may be up for sale by Elliott, as according to Dealreporter"
"2018-08-20 13:22:00","2018-08-20 21:22:00","Italy's Cabinet Undersecretary Giorgetti does not exclude that 2019 deficit could be above 3% of GDP"
"2018-08-20 13:19:00","2018-08-20 21:19:00","Fixed and FX latest: Bunds and Gilts revisit/set new session highs, Usd drifts"
"2018-08-20 13:02:00","2018-08-20 21:02:00","Additional US Equity Stories "
"2018-08-20 12:51:00","2018-08-20 20:51:00","RANsquawk Daily US Equity Opening News - 20th August 2018 - JP Morgan cuts its price target for TSLA the automaker to USD 195 from USD 308"
"2018-08-20 12:42:00","2018-08-20 20:42:00","Chinese Vice Premier Liu He states that China are to bolster IP protection and increase legal enforcement "
"2018-08-20 11:54:00","2018-08-20 19:54:00","Scotiabank FX Daily - Central Bank Headline Risk Elevated Into Jackson Hole"
"2018-08-20 11:21:00","2018-08-20 19:21:00","Shell says Nigeria's Trans Ramos pipeline that feeds some crude to the Forcados stream is still shut"
"2018-08-20 11:13:00","2018-08-20 19:13:00","Volkwagen (VOW3 GY) are said to recall 700K Tiguan and Tourcan cars worldwide"
"2018-08-20 11:13:00","2018-08-20 19:13:00","The EU says their efforts are undiminished in Brexit negotiations "
"2018-08-20 11:05:00","2018-08-20 19:05:00","Saudi crude output rose by 459k BPD MM to 10.489mln BPD in June; Saudi crude exports rose by 260k BPD MM to 7.24mln BPD in June, according to JODI data"
"2018-08-20 10:47:00","2018-08-20 18:47:00","PBoC is reportedly said to have provided USD liquidity to the market "
"2018-08-20 10:45:00","2018-08-20 18:45:00","Estee Lauder (EL) Q4 EPS USD 0.61 vs Exp. USD 0.56, Revenue USD 3.3bln vs Exp. USD 3.25bln "
"2018-08-20 10:42:00","2018-08-20 18:42:00","Italian Deputy PM says government will stand up against market speculation"
"2018-08-20 10:39:00","2018-08-20 18:39:00","UBS says near-term upside in EUR is likely more limited than expected and lower their year-end forecast for EUR/USD to 1.20 from 1.25"
"2018-08-20 10:21:00","2018-08-20 18:21:00","RANsquawk Daily US Opening News - 20th August 2018"
"2018-08-20 10:19:00","2018-08-20 18:19:00","France has objected to plans for a Brexit hard shipping corridor, according to Le Monde "
"2018-08-20 10:02:00","2018-08-20 18:02:00","Petrobras says a fire occurred at its Replan refinery in Sao Paulo, no injuries reported. Petrobras says the fire is under control and they paralyzed production preemptively "
"2018-08-20 10:00:00","2018-08-20 18:00:00","Bundesbank monthly report says Q3 GDP may be slower than that seen in H1"
"2018-08-20 09:29:00","2018-08-20 17:29:00","RANsquawk EU Mid Session: EU stocks accelerate gains amid US-Sino trade road map - 20th August 2018"
"2018-08-20 09:26:00","2018-08-20 17:26:00","China is said to have shifted to Iranian tankers to keep oil flowing amid US sanctions"
"2018-08-20 09:18:00","2018-08-20 17:18:00","Fixed Income: a bit more switching out of core EU debt"
"2018-08-20 09:01:00","2018-08-20 17:01:00","Atlantia's (ATL IM) Autostrade have received a Transport Ministry letter asking for defence of the company's conduct in relation to the Genoa bridge collapse within 15 days"
"2018-08-20 09:00:00","2018-08-20 17:00:00","ASIA-PAC SERVICE HAS NOW FINISHED, PLEASE REVERT BACK TO YOUR ORIGINAL CHANNEL FOR COVERAGE ON THE UK & EUROPEAN SESSION"
"2018-08-20 08:57:00","2018-08-20 16:57:00","Novo Nordisk (NOVOB DC) trial achieved its primary objective for people treated with Oral Semaglutide "
"2018-08-20 08:57:00","2018-08-20 16:57:00","FX Morning Colour: risk sentiment somewhat mixed, and currencies muddled"
"2018-08-20 08:45:00","2018-08-20 16:45:00","State-backed banks in China are said to have bought blue-chip stocks to help stabilise the market"
"2018-08-20 08:41:00","2018-08-20 16:41:00","UK union confirms offshore oil & gas platform strike has begun"
"2018-08-20 08:06:00","2018-08-20 16:06:00","Turkish President Erdogan reiterates they will not ask for IMF assistance"
"2018-08-20 08:02:00","2018-08-20 16:02:00","Morgan Stanley Cross-Asset Playbook: Equal weight Equities & Rates, Underweight Credit, Overweight Cash"
"2018-08-20 08:00:00","2018-08-20 16:00:00","Italian Interior Minister Salvini says they are open to discussions for the renationalization of roads"
"2018-08-20 07:43:00","2018-08-20 15:43:00","Italy's Deputy PM Salvini says all funds raised for infrastructure will be invested"
"2018-08-20 07:22:00","2018-08-20 15:22:00","Morgan Stanley trade of the week - buy Eur/Nok at market (around 9.6500), target 9.9000, stop 9.5000"
"2018-08-20 07:17:00","2018-08-20 15:17:00","UK debt and STIR futures: mixed impulses as Liffe resumes"
"2018-08-20 07:12:00","2018-08-20 15:12:00","ECB says banks borrowed EUR 128mln at marginal rate & deposited EUR 681.591bln; Excess liquidity EUR 1.872tln"
"2018-08-20 07:07:00","2018-08-20 15:07:00","Iran says the EU should speed up efforts to keep Tehran in the 2015 multinational nuclear deal"
"2018-08-20 07:03:00","2018-08-20 15:03:00","European equity movers this morning: Atlantia (ATL IM) Failed to open, BHP Billiton (BLT LN) +2.4%, NMC Health (NMC LN) +2.9%, AstraZeneca (AZN LN) -0.4%, Bayer (BAYN GY) +1.2%, ArcelorMittal (MT FP) +2.3%"
"2018-08-20 06:54:00","2018-08-20 14:54:00","FX option expiries for today's NY cut "
"2018-08-20 06:48:00","2018-08-20 14:48:00","EU's Moscovici says in theory, a Brexit vote could be reversed; adding it is not certain there will be a Brexit deal"
"2018-08-20 06:40:00","2018-08-20 14:40:00","Bunds: inauspicious start to the new week"
"2018-08-20 06:40:00","2018-08-20 14:40:00","Bunds: inauspicious start to the new week"
"2018-08-20 06:15:00","2018-08-20 14:15:00","Barclays trade recommendation - Short Aud/Usd at market (circa 0.7300), target 0.7170 and 0.7390 stop"
"2018-08-20 05:53:00","2018-08-20 13:53:00","Additional European equity stories post the release of the Daily European equity opening news"
"2018-08-20 05:50:00","2018-08-20 13:50:00","DAILY EUROPEAN EQUITY OPENING NEWS"
"2018-08-20 05:24:00","2018-08-20 13:24:00","Yemeni Houthis have fired a missile at Saudi's Najran province"
"2018-08-20 05:13:00","2018-08-20 13:13:00","RANsquawk Daily European Opening News - 20th August 2018"
"2018-08-20 04:56:00","2018-08-20 12:56:00","ASIA-PAC MARKET WRAP: Asia began the week mostly positive but with price action across asset classes contained by a lack of drivers"
"2018-08-20 04:17:00","2018-08-20 12:17:00","China is said to be planning a reduction in retail fuel prices tomorrow"
"2018-08-20 04:15:00","2018-08-20 12:15:00","China Telecom (728 HK) H1 net rose 8.1% Y/Y to CNY 13.57bln, rev. grew 4.7% Y/Y to CNY 193.03bln, total number of mobile subscribers rose by 31.66mln to 282mln vs. end of last year"
"2018-08-20 04:08:00","2018-08-20 12:08:00","British American Tobacco (BATS LN) plans to increase cigarette prices in Japan"
"2018-08-20 03:59:00","2018-08-20 11:59:00","Amazon (AMZN) reportedly part of consortium seeking to purchase More supermarket chain from India's Aditya Birla Group"
"2018-08-20 03:22:00","2018-08-20 11:22:00","India sovereign credit risk from INR decline is limited and noted that India has relatively strong external finances"
"2018-08-20 03:21:00","2018-08-20 11:21:00","Chinese Premier Li says China is prepared to boost imports of goods from Malaysia to a large extent"
"2018-08-20 03:15:00","2018-08-20 11:15:00","PRE-MARKET INDIA STOCK NEWS: Amtek Auto (AMTEKAUTO IS) and Gitanjali Gems (GITG IS) are among the firms which will be suspended from September 10th for failing to comply with listing guidelines"
"2018-08-20 02:56:00","2018-08-20 10:56:00","United Microelectronics (2303 TT) shareholders approve plan to list subsidiary in China"
"2018-08-20 02:38:00","2018-08-20 10:38:00","Apple (AAPL) is said to have removed 25k apps from China market"
"2018-08-20 02:30:00","2018-08-20 10:30:00","Thailand GDP (Q2) Q/Q 1.0% Vs. Exp. 1.0% (Prev. 2.0%)"
"2018-08-20 02:30:00","2018-08-20 10:30:00","Thailand GDP (Q2) Y/Y 4.6% vs. Exp. 4.5% (Prev. 4.8%)"
"2018-08-20 02:26:00","2018-08-20 10:26:00","ASIA-PAC MID-SESSION UPDATE: Asia begins the week mostly positive but with price action contained by a lack of drivers"
"2018-08-20 01:25:00","2018-08-20 09:25:00","Samsung Heavy (010140 KS) receives contract valued at KRW 412.3bln "
"2018-08-20 01:17:00","2018-08-20 09:17:00","Moody's states that China's shadow banking activity continues to decline, although reduction of risks in the financial sector is likely to moderate"
"2018-08-20 01:15:00","2018-08-20 09:15:00","PBoC sets CNY mid-point at 6.8718 (Prev. 6.8894)"
"2018-08-20 01:15:00","2018-08-20 09:15:00","PBoC injects CNY 120bln via 7-day reverse repos"
"2018-08-20 01:02:00","2018-08-20 09:02:00","PRE-MARKET CHINESE  STOCK NEWS: China Banking and Insurance Regulatory Commission instructed banks to increase lending towards infrastructure projects and exporters"
"2018-08-20 00:46:00","2018-08-20 08:46:00","China is to begin another bout of inspections on P2P lenders"
"2018-08-20 00:24:00","2018-08-20 08:24:00","PRE-MARKET TAIWAN AND SINGAPORE NEWS: Taiwan Q2 final GDP prints inline with expectations; Taiwan also plans to reduce repatriation tax"
"2018-08-20 00:17:00","2018-08-20 08:17:00","Australian PM Turnbull plans to raise ACCC funding so it can monitor power prices"
"2018-08-20 00:10:00","2018-08-20 08:10:00","Invest Commercial Property is to offload 9.99% stake in Investa Office Fund (IOF AT) to Oxford Property Group"
"2018-08-20 00:04:00","2018-08-20 08:04:00","Nordea says it still recommends buying dips on EUR/SEK and also states to sell rallies above 0.9000 in EUR/GBP"
"2018-08-20 00:00:00","2018-08-20 08:00:00","Asia stocks begin mixed with the region lacking any significant drivers and with earnings dominating newsflow; ASX 200 (Unch), Nikkei 225 (-0.1%), KOSPI (+0.7%)"