"gmt_time","hk_time","subject"
"2018-03-06 23:50:00","2018-03-07 07:50:00","Japanese Official Reserve Assets (USD)(Feb) 1261.7B (Prev. 1268.5B)"
"2018-03-06 23:42:00","2018-03-07 07:42:00","Samsung Engineering (028050 KS) receives USD 473mln order in UAE order"
"2018-03-06 23:31:00","2018-03-07 07:31:00","PRE-MARKET JAPANESE AND SOUTH KOREAN STOCK NEWS: North Korea is said to be open to denuclearization"
"2018-03-06 23:22:00","2018-03-07 07:22:00","US President Trump administration is said to push for conservative targets in regards to the Affordable Care Act, according to WSJ"
"2018-03-06 23:20:00","2018-03-07 07:20:00","China new loans in Feb M/M may decline to below CNY 1tln from the record high of CNY 2.9tln in January, according to China Securities Journal"
"2018-03-06 23:02:00","2018-03-07 07:02:00","US equity futures gap lower at the reopen with Emini S&P down over 1%, while DJIA futures have shed over 300 points in reaction to the news that White House Economic Adviser Cohn is to resign"
"2018-03-06 23:01:00","2018-03-07 07:01:00","US is said to consider broad curbs on Chinese imports and takeovers"
"2018-03-06 22:58:00","2018-03-07 06:58:00","Larry Kudlow, Jason Miller and David Urban are said be among the shortlisted to replace Gary Cohn"
"2018-03-06 22:57:00","2018-03-07 06:57:00","Australian PM Turnbull says election to be held H1 2019"
"2018-03-06 22:52:00","2018-03-07 06:52:00","PRE-MARKET AUSTRALIAN STOCK NEWS: KKR (KKR) and PetroChina (857 HK) said to have expressed interest in Woolworths (WOW AT) gas stations"
"2018-03-06 22:46:00","2018-03-07 06:46:00","US President Trump is said to cancel the tariff meeting on Thursday that Cohn organized"
"2018-03-06 22:36:00","2018-03-07 06:36:00","UK Chancellor Hammond says it is in both UK and EU interest to include financial services in Brexit deal"
"2018-03-06 22:31:00","2018-03-07 06:31:00","White House Economic Adviser Gary Cohn is to resign and expected to leave in next few weeks, according to NYT"
"2018-03-06 22:21:00","2018-03-07 06:21:00","ASIAN DAILY ECONOMIC RELEASES CALENDAR NOW AVAILABLE IN THE RESEARCH SECTION: Highlights Include Australian GDP, Speeches from Fed's Brainard and Kaplan"
"2018-03-06 22:12:00","2018-03-07 06:12:00","RBA Governor Lowe says central scenario is that rates will increase, but is not inevitable and would depend on how quick unemployment could be lowered"
"2018-03-06 22:09:00","2018-03-07 06:09:00","DAILY ASIA-PAC OPENING NEWS:  "
"2018-03-06 22:07:00","2018-03-07 06:07:00","RBA Governor Lowe says would be helpful to have lower AUD but adds currency is not broadly overvalued, also stated AUD around fair value and 'we have what we have'"
"2018-03-06 22:00:00","2018-03-07 06:00:00","ASIA-PAC SERVICE IS NOW LIVE FOR TODAY'S SESSION"
"2018-03-06 22:00:00","2018-03-07 06:00:00","US SERVICE IS NOW CLOSED, PLEASE SWITCH OVER TO THE ASIA CHANNEL"
"2018-03-06 22:00:00","2018-03-07 06:00:00","US SERVICE IS NOW CLOSED, PLEASE SWITCH OVER TO THE ASIA CHANNEL"
"2018-03-06 22:00:00","2018-03-07 06:00:00","ASIA-PAC SERVICE IS NOW LIVE FOR TODAY'S SESSION"
"2018-03-06 21:48:00","2018-03-07 05:48:00","Telecom Italia (TIT IM) Q4 EBITDA EUR 2.2bln vs. Prev EUR 2.1bln Y/Y"
"2018-03-06 21:45:00","2018-03-07 05:45:00","New Zealand Volume of All Buildings (Q4) Q/Q 1.4% vs. Exp. 1.0% (Prev. 2.7%)"
"2018-03-06 21:36:00","2018-03-07 05:36:00","RBA’s Lowe repeats likely the next move in rates will be up not down and also repeats does not see a case for a near term adjustment of monetary policy "
"2018-03-06 21:10:00","2018-03-07 05:10:00","US MARKET WRAP: 6 MAR 2018: Geopolitics spur risk on, trade concerns linger"
"2018-03-06 21:01:00","2018-03-07 05:01:00","Autodesk Inc (ADSK) Q4 EPS USD -0.09 vs. Exp. USD -0.11, revenue USD 0.554bln vs. Exp. USD 0.54bln"
"2018-03-06 21:01:00","2018-03-07 05:01:00","Ross Stores Inc (ROST) Q4 EPS USD 1.19 vs. Exp. USD 0.93, revenue USD 4.10bln vs. Exp. USD 3.95bln"
"2018-03-06 20:49:00","2018-03-07 04:49:00","Trump reiterates that the US will go ahead with tariffs plan"
"2018-03-06 20:28:00","2018-03-07 04:28:00","Envision Healthcare (EVHC): UnitedHealth (UNH) reportedly amongst bidders"
"2018-03-06 19:42:00","2018-03-07 03:42:00","Even if tariffs are implemented adviser Cohn is said to remain in White House, reports Fox, citing sources"
"2018-03-06 19:35:00","2018-03-07 03:35:00","EU said UK PM May speech is 'double cherry-picking' on Brexit"
"2018-03-06 19:31:00","2018-03-07 03:31:00","WTI futures settle 3 cents higher at USD 62.60 per barrel; Brent settles 25 cents higher at USD 65.79 per barrel"
"2018-03-06 19:24:00","2018-03-07 03:24:00","Senate Majority leader McConnell states there is a lot of concern over steel and aluminium tariffs. Concerned it could turn in to a trade war."
"2018-03-06 19:18:00","2018-03-07 03:18:00","Plans to restart reformer of Marathon Galveston Bay Texas refinery by early next week"
"2018-03-06 19:15:00","2018-03-07 03:15:00","Mondelez (MDLZ) confirms cancellation of UBS conference, but note that it was due to illness"
"2018-03-06 19:13:00","2018-03-07 03:13:00","Trump repeats he would like to go down a peaceful path, but would be willing to go either way"
"2018-03-06 19:11:00","2018-03-07 03:11:00","Statements coming out of North Korea have been positive says President Trump"
"2018-03-06 18:43:00","2018-03-07 02:43:00","OPEC Secretary General Barkindo states will hit 100mln barrels per day of demand faster than any forecasts expected"
"2018-03-06 18:30:00","2018-03-07 02:30:00","Passport Capital says Overstock (OSTK) is the largest holding in a cryptocurrency fund"
"2018-03-06 18:22:00","2018-03-07 02:22:00","Mondelez (MDLZ) pulls out of UBS conference"
"2018-03-06 18:00:00","2018-03-07 02:00:00","Senator Purdue says President Trump is open to changes on tariffs"
"2018-03-06 17:51:00","2018-03-07 01:51:00","Fox (FOX) expected to launch a recommended offer for Sky (SKY LN) by June"
"2018-03-06 17:32:00","2018-03-07 01:32:00","France's Finance Minister Le Maire states that France's reportedly tough stance on Brexit is ""not correct"""
"2018-03-06 17:31:00","2018-03-07 01:31:00","Pitney Bowes (PBI) reportedly confirms it is reviewing strategic alternatives and notes it's plan has greater value than selling the co. now  "
"2018-03-06 17:25:00","2018-03-07 01:25:00"," UAE Energy Minister says both OPEC NON-OPEC members still have work to do to rebalance the market   "
"2018-03-06 17:10:00","2018-03-07 01:10:00","CVS (CVS) sets size for nine-part USD offering at USD 40bln, as expected"
"2018-03-06 17:04:00","2018-03-07 01:04:00","EIA cuts forecast for 2018 world oil demand growth by 30k BPD to 1.72mln BPD Y/Y increase (Prev. +10k BPD to 1.73mln) "
"2018-03-06 17:00:00","2018-03-07 01:00:00","RANsquawk Daily US Earnings Estimates - 7th March 2018"
"2018-03-06 16:46:00","2018-03-07 00:46:00","Goldman Sachs lowers its Q1 GDP to 2% from 2.1% citing “softer pace of Q1 equipment investment relative to our previous assumptions”"
"2018-03-06 16:42:00","2018-03-07 00:42:00","CVS receives orders of over USD 120bln for its multi tranche bond sale for Aetna (AET) acquisition, according to sources "
"2018-03-06 16:29:00","2018-03-07 00:29:00","Motiva’s Port Arthur Texas refinery’s large crude unit has been taken out of production, according to sources "
"2018-03-06 15:57:00","2018-03-06 23:57:00","Citigroup (C) CFO says Q1 markets revenue seen rising by 'low-to-mid' single-digits vs last year"
"2018-03-06 15:45:00","2018-03-06 23:45:00","Lam Research (LRCX) to add USD 2bln to the share repurchase authorisation "
"2018-03-06 15:42:00","2018-03-06 23:42:00","RANsquawk sources note vague takeover chatter for ON Semiconductor (ON), with Intel (INTC) rumoured as potential acquirer – unconfirmed "
"2018-03-06 15:42:00","2018-03-06 23:42:00","Motiva's Port Arthur Refinery has returned its large crude unit to minimum production, according to sources "
"2018-03-06 15:40:00","2018-03-06 23:40:00","CVS receives orders of approx. USD 107bln+ for multi-tranche bond sale for Aetna (AET) acquisition"
"2018-03-06 15:35:00","2018-03-06 23:35:00","Mexico will tax the most 'politically sensitive' US goods if hit with tariffs, according to a minister"
"2018-03-06 15:29:00","2018-03-06 23:29:00","FX Daily Wrap: marked turnaround in risk appetite/sentiment "
"2018-03-06 15:29:00","2018-03-06 23:29:00","Vodafone (VOD LN) is being investigated by Ofcom over whether they breached net neutrality rules"
"2018-03-06 15:18:00","2018-03-06 23:18:00","US House speaker Ryan has urged White House to make tariffs less broad"
"2018-03-06 15:13:00","2018-03-06 23:13:00","CVS receives orders of approx. USD 78bln for multi-tranche bond sale for Aetna (AET) acquisition"
"2018-03-06 15:00:00","2018-03-06 23:00:00","US IBD TIPP Economic Optimism (Mar) 55.6 vs. Exp. 58.2 (Prev. 56.7)"
"2018-03-06 14:47:00","2018-03-06 22:47:00","PREVIEW: ECB Monetary Policy Decision & Press Conference Thursday 8th March 2018"
"2018-03-06 14:46:00","2018-03-06 22:46:00","US President Trump is said to be convinced that Cohn is to leave the White House if tariffs are instituted"
"2018-03-06 14:42:00","2018-03-06 22:42:00","Qatar and HNA unlikely to seek a stake in Deutsche Bank (DBK GY) asset management unit IPO, according to sources"
"2018-03-06 14:38:00","2018-03-06 22:38:00","Volkswagen (VOW3 GY) February brand deliveries up 5.7%"
"2018-03-06 14:32:00","2018-03-06 22:32:00","UK Brexit Minister Davis says it is possible, though improbable, that a deal falls apart towards the end of negotiations  "
"2018-03-06 14:30:00","2018-03-06 22:30:00","Major FX option expiries for today's NY cut"
"2018-03-06 14:20:00","2018-03-06 22:20:00","Additional US Equity Stories - post the release of the US Equity Opening News "
"2018-03-06 14:20:00","2018-03-06 22:20:00","Additional US Equity Stories - post the release of the US Equity Opening News "
"2018-03-06 14:13:00","2018-03-06 22:13:00","US President Trump says possible progress has been made in talks with North Korea; Trump adds this may be false hope but the US is ready to ""go hard"" in either direction"
"2018-03-06 14:08:00","2018-03-06 22:08:00","Russian deputy energy minister says he is not considering joining OPEC"
"2018-03-06 14:07:00","2018-03-06 22:07:00","Russia expects oil market rebalancing in H2 or end-Q3 this year, according to RIA"
"2018-03-06 14:06:00","2018-03-06 22:06:00","Brexit secretary Davis says there is a good chance of reaching a transition agreement in March"
"2018-03-06 13:48:00","2018-03-06 21:48:00","DAILY US EQUITY OPENING NEWS - Nordstrom (JWN) – The retailer has rejected the initial takeover offer from the Nordstrom family for USD 50/shr. "
"2018-03-06 13:32:00","2018-03-06 21:32:00","Fixed Income: bears picking off levels"
"2018-03-06 13:15:00","2018-03-06 21:15:00","Fed's Kaplan (non-voter) says the Fed should start tightening policy soon"
"2018-03-06 13:00:00","2018-03-06 21:00:00","European Parliament' Brexit coordinator Verhofstadt says had very useful meeting with UK PM May"
"2018-03-06 12:59:00","2018-03-06 20:59:00","Scotiabank FX Daily - Risk Appetite Rebounds On Signs Of Korea Detente"
"2018-03-06 12:45:00","2018-03-06 20:45:00","JPM Treasury Client Weekly Survey: Shorts at lowest since last October"
"2018-03-06 12:38:00","2018-03-06 20:38:00","CVS Health (CVS) have launched a 9-part offering to finance their purchase of Aetna (talk had been for a size of around USD 40bln)"
"2018-03-06 12:24:00","2018-03-06 20:24:00","Libya's Sharara oil field output is said to rise to 300k bpd "
"2018-03-06 12:10:00","2018-03-06 20:10:00","Prosiebensat (PSM GY) states that media reports of a short seller against the company is unfounded"
"2018-03-06 11:31:00","2018-03-06 19:31:00","Daimler (DAI GY) Feb car sales +6.3%"
"2018-03-06 11:30:00","2018-03-06 19:30:00","Target Corp (TGT) Q4 EPS USD 1.37 vs. Exp. USD 1.38, revenue USD 22.80bln vs. Exp. USD 22.53bln"
"2018-03-06 11:29:00","2018-03-06 19:29:00","DAILY US OPENING NEWS: North Korea is said to be open to denuclearisation if regime safety is guaranteed, and added they are willing to freeze nuclear and missile activities during discussions with the US"
"2018-03-06 11:08:00","2018-03-06 19:08:00","EU DEBT LATEST: stop chase and clear out"
"2018-03-06 11:07:00","2018-03-06 19:07:00","North Korea is said to be open to denuclearisation if regime safety is guaranteed, according to South Korean Envoy"
"2018-03-06 11:05:00","2018-03-06 19:05:00","OPEC pumped 32.39mln bpd of crude in Feb (a fall of 70,000bpd from Jan), according to the latest Platts OPEC survey "
"2018-03-06 10:38:00","2018-03-06 18:38:00","Germany sells EUR 402mln vs. Exp. EUR 500mln 0.1% 2026 I/L and EUR 389mln vs. Exp. EUR 500mln 0.50% 2030 I/L Auction"
"2018-03-06 10:35:00","2018-03-06 18:35:00","UK sells GBP 2.25bln 1.5% 2047 Gilt Auction Bund Auction with a b/c 2.1 (Prev. b/c 1.65), average yield 1.937% (Prev. 1.806%) and tail 0.2bps (Prev. 1bps)"
"2018-03-06 10:30:00","2018-03-06 18:30:00","ECB allots EUR 1.146bln in 7-day MRO"
"2018-03-06 10:06:00","2018-03-06 18:06:00","EU MID-SESSION UPDATE: European bourses firmer as trade war tensions ease (for now?). USD marginally softer, USD/JPY back below 106.00."
"2018-03-06 09:59:00","2018-03-06 17:59:00","Fixed Income: Gilts now wagging the tail"
"2018-03-06 09:55:00","2018-03-06 17:55:00","A short seller that previously was negative on Steinhoff now says ProSiebensat (PSM GY) is ‘uninvestable’ "
"2018-03-06 09:31:00","2018-03-06 17:31:00","Barclays on today's European and UK supply"
"2018-03-06 09:30:00","2018-03-06 17:30:00","FX Morning Colour: DXY back near 90.000 handle amidst mixed and choppy trade"
"2018-03-06 09:00:00","2018-03-06 17:00:00","ASIA-PAC SERVICE HAS NOW FINISHED, PLEASE REVERT BACK TO YOUR ORIGINAL CHANNEL FOR COVERAGE ON THE UK & EUROPEAN SESSION"
"2018-03-06 08:44:00","2018-03-06 16:44:00","Riksbank’s Ingves says it's too early and too big a risk to raise rates now"
"2018-03-06 08:44:00","2018-03-06 16:44:00","PREVIEW: Fonterra GDT Dairy Auction - futures indicate around a 2% fall in WMP prices"
"2018-03-06 08:14:00","2018-03-06 16:14:00","Riksbank’s Ohlsson says that inflation has remained close to the target and now is the time to begin normalising monetary policy"
"2018-03-06 08:11:00","2018-03-06 16:11:00","UK DEBT/STIR Futures: acknowledging bearish external leads"
"2018-03-06 08:11:00","2018-03-06 16:11:00","ECB says banks borrowed EUR 51mln at marginal rate & deposited EUR 686.97bln; excess liquidity EUR 1.878tln "
"2018-03-06 08:09:00","2018-03-06 16:09:00","Morning EU movers: Smurfit Kappa (SKG LN) +17.2%, Thales (HO FP) +6.0%, GKN (GKN LN) +2.6%, IWG (IWG LN) -1.3%, Ontex (ONTEX BB) -1.7%, Ashtead Group (AHT LN) -3.3%, Just Eat (JE LN) -12.4%"
"2018-03-06 08:04:00","2018-03-06 16:04:00","Riksbank Governor Ingves states that weaker inflationary pressures creating uncertainty, adding that monetary policy needs to proceed cautiously"
"2018-03-06 08:03:00","2018-03-06 16:03:00","Kantar Worldpanel Market Update"
"2018-03-06 07:35:00","2018-03-06 15:35:00","Bunds: deeper pull-back from 160.00+ highs"
"2018-03-06 07:33:00","2018-03-06 15:33:00","DAILY BOND AUCTION PREVIEW: Supply today comes from Germany and the UK"
"2018-03-06 07:32:00","2018-03-06 15:32:00","EU is said to consider tariffs of US steel, denim and bourbon, according to sources"
"2018-03-06 07:21:00","2018-03-06 15:21:00","BoJ’s Kuroda stated that he only said an exit strategy may be debated if inflation reaches 2% during 2019"
"2018-03-06 06:53:00","2018-03-06 14:53:00","Additional EU equities stories post-the release of the Daily EU Equity Opening News"
"2018-03-06 06:49:00","2018-03-06 14:49:00","DAILY EUROPEAN EQUITY OPENING NEWS: Highlights include stories from GlaxoSmithKline, GKN, Volkswagen and Fiat Chrysler"
"2018-03-06 06:28:00","2018-03-06 14:28:00","Option expiries of note for today's 10.00am NY cut (1500GMT)"
"2018-03-06 06:20:00","2018-03-06 14:20:00","DAILY EUROPEAN OPENING NEWS: Asian stocks were mostly higher after sentiment rolled over from Wall St where all majors gained at least 1%"
"2018-03-06 06:03:00","2018-03-06 14:03:00","China is to lower bank provisions requirement"
"2018-03-06 06:00:00","2018-03-06 14:00:00","Nikkei 225 closes up 1.8% at 21417"
"2018-03-06 05:51:00","2018-03-06 13:51:00","ASIA-PAC MARKET WRAP: Asia stocks took impetus from Wall St's, while Nikkei 225 surges on weaker JPY"
"2018-03-06 05:06:00","2018-03-06 13:06:00","Woodside Petroleum (WPL AT) discloses oil & gas discovery in offshore Gabon"
"2018-03-06 05:02:00","2018-03-06 13:02:00","ASX 200 preliminary close is up 1.1% at 5961.10"
"2018-03-06 05:02:00","2018-03-06 13:02:00","ASX 200 preliminary close is up 1.1% at 5961.10"
"2018-03-06 04:33:00","2018-03-06 12:33:00","BoJ Governor Kuroda says will obviously debate on exit strategy once target is achieved, adds central bank is brainstorming how a future exit could impact the balance sheet"
"2018-03-06 04:28:00","2018-03-06 12:28:00","BoJ Governor Kuroda says cannot weaken extent of monetary easing or end easing when inflation hasn't yet reached target "
"2018-03-06 04:14:00","2018-03-06 12:14:00","Toyota (7203 JT) plans to phase out all diesel cars in Europe beginning this year and will focus on hybrid cars, as well as other green vehicles"
"2018-03-06 04:09:00","2018-03-06 12:09:00","BoJ Governor Kuroda says BoJ is keeping policy accommodative and that it takes time to get rid of deflationary mindset"
"2018-03-06 04:05:00","2018-03-06 12:05:00","New Zealand names Chris Eichbaum to the RBNZ board"
"2018-03-06 03:57:00","2018-03-06 11:57:00","SGX says Straits Times Index constituents are unchanged following FTSE Russell March quarterly review"
"2018-03-06 03:45:00","2018-03-06 11:45:00","Japan sells JPY 647bln in 30yr JGBs b/c 4.24 vs. Prev. 4.27, avg. yield 0.750% vs. Prev. 0.820%"
"2018-03-06 03:25:00","2018-03-06 11:25:00","PRE-MARKET INDIAN STOCK NEWS: ONGC (ONGC IS) unit and Oil India among the participants that received approval for development of Golfinho-Atum natgas field in Mozambique"
"2018-03-06 03:13:00","2018-03-06 11:13:00","Malaysia comments on EU step to curb palm oil and states that that it would respond with might and tact if a trade war is forced on them"
"2018-03-06 03:12:00","2018-03-06 11:12:00","NDRC says China is to relax the foreign shareholding restrictions and will revise foreign investment negative list in 2018"
"2018-03-06 02:56:00","2018-03-06 10:56:00","PREVIEW: RBA expected to keep rates unchanged at record low 1.50% in decision due at 0330GMT/2230EST/1130HKT "
"2018-03-06 02:40:00","2018-03-06 10:40:00","ASIA-PAC MID-SESSION UPDATE: Asia mostly takes impetus from Wall St's gains, with Nikkei 225% surging over 2% on JPY weakness"
"2018-03-06 02:24:00","2018-03-06 10:24:00","Crownbet is close to acquiring William Hill's (WMH LN) Australian business"
"2018-03-06 02:12:00","2018-03-06 10:12:00","NDRC Chairman says China cut 250mln tons of coal capacity and 55mln tons of steel capacity in 2017"
"2018-03-06 02:05:00","2018-03-06 10:05:00","Hyundai Heavy (009540 KS) announces its planned share issuance to be valued around KRW 906.5blna"
"2018-03-06 01:50:00","2018-03-06 09:50:00","CIMIC (CIM AT) UGL unit receives AUD 150mln contract extension"
"2018-03-06 01:41:00","2018-03-06 09:41:00","South Korea is to announce scale and date of military exercises with US after March 18th"
"2018-03-06 01:31:00","2018-03-06 09:31:00","US President Trump to meet with US companies that use steel and aluminium on Thursday to discuss planned tariffs "
"2018-03-06 01:15:00","2018-03-06 09:15:00","PBoC sets USD/CNY mid-point at 6.3386 vs. Prev. 6.3431 "
"2018-03-06 01:10:00","2018-03-06 09:10:00","PBoC skips open market operations"
"2018-03-06 01:07:00","2018-03-06 09:07:00","PRE-MARKET CHINESE STOCK NEWS: Evergrande Real Estate (3333 HK) Feb. contracted sales CNY 48.1bln vs. Prev. CNY 31.2bln Y/Y"
"2018-03-06 01:00:00","2018-03-06 09:00:00","Philippines CPI (Feb) M/M 0.8% (Prev. 1.0%)"
"2018-03-06 00:55:00","2018-03-06 08:55:00","Press reports note renewed speculation GrainCorp (GNC AT) could sell its terminal assets"
"2018-03-06 00:51:00","2018-03-06 08:51:00","Bluescope Steel (BSL AT) may be exempt from US steel tariff according to press reports which cite comments by White House trade advisor"
"2018-03-06 00:35:00","2018-03-06 08:35:00","James Packer to sell over AUD 100mln in Crown Resorts (CWN AT) shares"
"2018-03-06 00:22:00","2018-03-06 08:22:00","PRE-MARKET TAIWAN AND SINGAPORE STOCK NEWS: Catcher Tech (2474 TT) Q4 net fell 13% Y/Y to TWD 8.27bln"
"2018-03-06 00:08:00","2018-03-06 08:08:00","BHP (BHP AT) says sale of shale assets could be resolved sooner than though"
"2018-03-06 00:02:00","2018-03-06 08:02:00","Asia stocks bounce back from yesterday's losses with all majors up at least 1% in early trade following a similar showing on Wall St, while Nikkei 225 surges nearly 2% on JPY weakness"