"gmt_time","hk_time","subject"
"2018-09-12 23:59:00","2018-09-13 07:59:00","Fanuc (6954 JT) planning to spend JPY 5.5bln for new US plant"
"2018-09-12 23:53:00","2018-09-13 07:53:00","Propertylink Holdngs (PLG AT) confirms to purchase Centuria Industrial REIT for implied value of AUD 755mln"
"2018-09-12 23:30:00","2018-09-13 07:30:00","PRE-MARKET AUSTRALIAN, JAPANESE AND SOUTH KOREAN STOCK NEWS: WTI crude futures gained 1.7% and briefly rose above USD 71.00/bbl before pulling-back"
"2018-09-12 23:30:00","2018-09-13 07:30:00","PRE-MARKET AUSTRALIAN, JAPANESE AND SOUTH KOREAN STOCK NEWS: WTI crude futures gained 1.7% and briefly rose above USD 71.00/bbl before pulling-back"
"2018-09-12 23:25:00","2018-09-13 07:25:00","UK PM May reportedly wants to announce strict immigration controls at Conservative Party conference to give reassurance to Eurosceptics in the face of increasing revolt "
"2018-09-12 23:23:00","2018-09-13 07:23:00","US is said to be readying to expose some sanction violations related to North Korea"
"2018-09-12 23:07:00","2018-09-13 07:07:00","Allianz Chief Economic Adviser El-Erian says cryptocurrencies and blockchain technology are not dead"
"2018-09-12 23:05:00","2018-09-13 07:05:00","IMF says Portugal outlook is positive, although it sees external risks"
"2018-09-12 23:02:00","2018-09-13 07:02:00","UK government is to publish no-deal Brexit papers on Thursday related to mobile roaming charges, environmental and vehicle guidelines"
"2018-09-12 22:10:00","2018-09-13 06:10:00","ASIAN DAILY ECONOMIC RELEASES CALENDAR NOW AVAILABLE IN THE RESEARCH SECTION: Highlights Include Australian Jobs Data, New Zealand Food Prices, Japanese PPI, Machinery Orders & 5yr JGB Auction"
"2018-09-12 22:08:00","2018-09-13 06:08:00","JCER says Japanese GDP fell 0.5% M/M in July"
"2018-09-12 21:55:00","2018-09-13 05:55:00","DAILY ASIA-PAC OPENING NEWS"
"2018-09-12 21:30:00","2018-09-13 05:30:00","UK Brexit Secretary Raab reportedly warns the UK will not pay divorce bill without a Brexit deal, according to Telegraph"
"2018-09-12 21:10:00","2018-09-13 05:10:00","Notice: The earlier technical issues affecting the website have now been resolved and all is running as normal; apologies for the inconvenience during the earlier disruption"
"2018-09-12 21:00:00","2018-09-13 05:00:00","ASIA-PAC SERVICE IS NOW LIVE FOR TODAY'S SESSION"
"2018-09-12 21:00:00","2018-09-13 05:00:00","US SERVICE IS NOW CLOSED, PLEASE SWITCH OVER TO THE ASIA CHANNEL"
"2018-09-12 20:07:00","2018-09-13 04:07:00","US MARKET WRAP – 12 Sep 2018: US proposes new round of trade talks with China"
"2018-09-12 20:06:00","2018-09-13 04:06:00","NEC director Kudlow confirms US has invited China for trade talks"
"2018-09-12 18:59:00","2018-09-13 02:59:00","Teva's (TEVA) medis division said to be attracting interest from Recipharm and EMS"
"2018-09-12 18:44:00","2018-09-13 02:44:00","Iran OPEC Governor says oil prices rising in favour of Russia and Saudi Arabia, while US is punishing its allies, adding Trump is bullying oil markets, and warned of risks, according to Platts"
"2018-09-12 18:39:00","2018-09-13 02:39:00","Apple (AAPL) says iPhone XR will start from USD 749; iPhone XS will start at USD 999 and iPhone XS Max will start from USD 1099"
"2018-09-12 18:32:00","2018-09-13 02:32:00","WTI (V8) settles USD 1.12 higher at USD 70.37/bbl; Brent (X8) settles USD 0.68 higher at USD 79.74"
"2018-09-12 18:18:00","2018-09-13 02:18:00","Mexico President Elect Lopez Obrador will reportedly continue the oil hedge programme"
"2018-09-12 18:00:00","2018-09-13 02:00:00","Fed's Beige Book - most districts noted concerns about trade tensions, particularly but not only for manufacturers"
"2018-09-12 17:59:00","2018-09-13 01:59:00","NHC says although slow weakining is expected to begin by late Thursday, hurricane Florence is still forecast to be extremely dangerous when it nears the US"
"2018-09-12 17:47:00","2018-09-13 01:47:00","CBS (CBS) '60 Minutes' executive producer out at CBS News effective immediately after allegations of sexual misconduct, CNBC reports"
"2018-09-12 17:34:00","2018-09-13 01:34:00","Apple (AAPL) new Watch (the Series 4) will start at USD 399 (for GPS model, USD 499 for LTE model), and Apple will cut prices on its older model to USD 279"
"2018-09-12 17:32:00","2018-09-13 01:32:00","NHC says 70% chance of cyclone in the next 48 hours for storms near the Azores in the Atlantic "
"2018-09-12 17:24:00","2018-09-13 01:24:00","Canada's Freeland plans to return to Washington on Wednesday night for talks with the USTR; Canada not under pressure to get a NAFTA deal done immediately, most optimistic scenario is to reach a deal next week, sources say "
"2018-09-12 17:09:00","2018-09-13 01:09:00","Fed's Barainard says it is very early to say if the US fiscal stimulus is boosting productivity growth or the supply side"
"2018-09-12 17:03:00","2018-09-13 01:03:00","US Sells 23bln in 10yr notes, Stops-through by 0.5bps "
"2018-09-12 17:03:00","2018-09-13 01:03:00","EU is said to expect a UK shift on the Irish issue from the after the Tory party conference"
"2018-09-12 16:51:00","2018-09-13 00:51:00","EU has reportedly begun redrafting an Irish Brexit protocol in order to appease the UK"
"2018-09-12 16:45:00","2018-09-13 00:45:00","Fed's Brainard (Voter, Dovish) says further gradual interest rate increases are likely to be appropriate over the next year or two "
"2018-09-12 16:36:00","2018-09-13 00:36:00","CME says some CME Direct customers are reporting disconnects, and support is investigating"
"2018-09-12 16:29:00","2018-09-13 00:29:00","Fresenius Medical Care (FMS) sees net income growth at 6%-9%, basis sales at 5%-8% and confirms 2020 targets"
"2018-09-12 16:18:00","2018-09-13 00:18:00","Comcast (CMCSA) says its offer for Sky (SKY LN) is being further extended and will remain open for acceptance until 1.00pm BST on October 6th"
"2018-09-12 16:00:00","2018-09-13 00:00:00","Canadian PM Trudeau says no deal is better than getting a bad NAFTA deal"
"2018-09-12 15:30:00","2018-09-12 23:30:00","AUCTION PREVIEW: US to sell USD 23bln of 10-year notes at 1800 BST/1300 EST"
"2018-09-12 15:30:00","2018-09-12 23:30:00","EUROPEAN PRELIMINARY CASH EQUITY CLOSE: EURO STOXX 50 (+0.59%), FTSE 100 (+0.54%), DAX (+0.58%), CAC (+0.98%), IBEX (+0.29%), FTSE MIB (+0.51%), SMI (+0.52%)"
"2018-09-12 15:27:00","2018-09-12 23:27:00","Boeing (BA) CEO says global trade tensions have not yet had an impact on the co."
"2018-09-12 15:25:00","2018-09-12 23:25:00","MediaSet (MS IM) is said to sell their premium pay tv platform to Sky (SKY LN)"
"2018-09-12 15:24:00","2018-09-12 23:24:00","e.l.f. Beauty (ELF), Jefferies says the co. may be worth USD 25"
"2018-09-12 15:22:00","2018-09-12 23:22:00","Venezuela's PDVSA could reopen Jose oil port's damaged south dock by the end of September and 1mln bbl cargo of venezuelan crude for Rosneft was canceled after the dock collision; according to documents"
"2018-09-12 15:14:00","2018-09-12 23:14:00","Boeing (BA) is on track for mid-teen profit margins by the end of the decade"
"2018-09-12 15:13:00","2018-09-12 23:13:00","The US is said to propose a new round of trade talks with China in the near future; talks are aimed at getting bilateral economic negotiations back on track"
"2018-09-12 15:08:00","2018-09-12 23:08:00","Fed's Bullard (Non-voter, Dove) says he expects more forecasters in 2019 to increase estimates for GDP growth to low 2% range and would consider marking up his current long-run growth forecast of 2% if growth remains above that"
"2018-09-12 15:07:00","2018-09-12 23:07:00","Mexico Economy Minister says we cannot rule out U.S. and Canada not reaching an agreement and must be ready to pursue a bilateral agreement with the U.S. "
"2018-09-12 15:03:00","2018-09-12 23:03:00","Deutsche Bank (DB) management board is considering converting their bank to a holding company structure"
"2018-09-12 14:56:00","2018-09-12 22:56:00","A UK spokesman said a no-deal Brexit is not a likely scenario"
"2018-09-12 14:41:00","2018-09-12 22:41:00","NHC says Air Force Hurricane Hunter finds Florence has had little change while moving towards the U.S. SouthEast coast"
"2018-09-12 14:40:00","2018-09-12 22:40:00","Viacom (VIAB) CEO says the company is exploring more skinny bundles"
"2018-09-12 14:35:00","2018-09-12 22:35:00","Mexico Economy Minister Guajardo says the preliminary NAFTA agreement is written as trilateral"
"2018-09-12 14:35:00","2018-09-12 22:35:00","Mexico Economy Minister Guajardo says the preliminary NAFTA agreement is written as trilateral"
"2018-09-12 14:31:00","2018-09-12 22:31:00","Daily FX Wrap: several midweek humps and bumps ahead of ‘Central Bank Thursday’"
"2018-09-12 14:19:00","2018-09-12 22:19:00","Citron Research they will gladly short Tilray (TLRY) shares if they go higher"
"2018-09-12 14:09:00","2018-09-12 22:09:00","DUP leader has said that he does not have a preference with regards to the current Brexit plans, as it is unlikely to be either"
"2018-09-12 14:09:00","2018-09-12 22:09:00","Fed's Bullard (non-voter, dove) says there is ""some room to run"" in the labour market"
"2018-09-12 14:05:00","2018-09-12 22:05:00","US FDA says it is mulling a serious policy change that would lead to the removal of flavoured e-cigarette products from the market"
"2018-09-12 13:59:00","2018-09-12 21:59:00","Mexican Economy Minster Guajardo sees a high chance of a US-Canadian trade deal"
"2018-09-12 13:55:00","2018-09-12 21:55:00","Fed's Bullard says the JOLTS report shows a normal not overheated labour market"
"2018-09-12 13:46:00","2018-09-12 21:46:00","Wynn Resort (WYNN) exploring a sale after receiving an unsolicited approach, speaking of prices, USD 180/share is being touted - unconfirmed"
"2018-09-12 13:37:00","2018-09-12 21:37:00","FDA is taking new steps to address ""epidemic of youth e-cigarette use""; adding action is taken against more than 1,300 retailers and 5 major manufacturers "
"2018-09-12 13:33:00","2018-09-12 21:33:00","Fed's Bullard (dove, non-voter) states an inflation surge is unlikely and US interest rates are neutral to restrictive"
"2018-09-12 13:18:00","2018-09-12 21:18:00","North Sea Buzzard oil field is said to be in the process of restarting"
"2018-09-12 13:05:00","2018-09-12 21:05:00","Additional US Equity Stories - MCD, C"
"2018-09-12 12:59:00","2018-09-12 20:59:00","RANsquawk Daily US Equity Opening News - 12th September 2018"
"2018-09-12 12:46:00","2018-09-12 20:46:00","Citigroup (C) CFO says Q3 trading revenue likely to be flat-to-slightly-higher in YY terms"
"2018-09-12 12:43:00","2018-09-12 20:43:00","Turkey has stepped up arms shipping to Syrian rebels in the NorthWest to assist in the stave off of feared Idlib offensive, according to Rebel sources"
"2018-09-12 12:40:00","2018-09-12 20:40:00","German Foreign Minister Maas says Germany will make an autonomous decision on whether it will intervene in Syria in line with its constitution and law"
"2018-09-12 12:24:00","2018-09-12 20:24:00","US FDA has sent e-cigarette warning letters"
"2018-09-12 12:23:00","2018-09-12 20:23:00","Hungarian Foreign Minister says Hungary will seek legal ways to challenge the decision of the European Parliament "
"2018-09-12 12:22:00","2018-09-12 20:22:00","EU commission head Juncker says is 'in harmony' with the European Parliament decision to start a punitive action against Hungary over the rule of law "
"2018-09-12 12:04:00","2018-09-12 20:04:00","Scotiabank FX Daily - CAD Climbs On NAFTA Hopes; Risk In Bullard & Brainard"
"2018-09-12 12:02:00","2018-09-12 20:02:00","US Secretary of State Pompeo says Saudi and UAE moves have been certified to congress"
"2018-09-12 11:59:00","2018-09-12 19:59:00","UK PM May's spokesperson says we are focused on taking forward the Chequers Brexit plan and says to not want a customs border down the Irish sea"
"2018-09-12 11:56:00","2018-09-12 19:56:00","NHC says dangerous Florence is heading the US Southeast cost and is expected to bring life-threatening storm surge and rainfall in portions of Carolinas and mid-Atlantic states"
"2018-09-12 11:51:00","2018-09-12 19:51:00","Fixed and FX latest: not really FTQ, but risk-off for sure"
"2018-09-12 11:46:00","2018-09-12 19:46:00","5 Star Lawmaker says that normal dialog is occurring with Finance Minister Tria, he will not resign and the Italian Government will not fail"
"2018-09-12 11:43:00","2018-09-12 19:43:00","BoE Alex Braziers says the UK will remain a global financial centre regardless of what happens with Brexit"
"2018-09-12 11:37:00","2018-09-12 19:37:00","Italy's government denies 5 Star looking to remove Economy Minister Tria if resources not found for universal income; according to a source in prime minister's office"
"2018-09-12 11:30:00","2018-09-12 19:30:00","European Parliament votes 448 in favour 197 against motion to trigger article 7 punitive procedure against Hungary "
"2018-09-12 11:29:00","2018-09-12 19:29:00","Senior 5 Star source tells Reuters there is no tension over budget resources but no threats to remove Tria "
"2018-09-12 11:20:00","2018-09-12 19:20:00","UK PM May says we are working to get a good deal on Brexit for the whole of the UK; adds without a Brexit deal the position on the divorce payment to the EU changes"
"2018-09-12 11:13:00","2018-09-12 19:13:00","Italy's 5 Star seeks EUR 10bln for corporate income tax or Economy Minister Tria resignation "
"2018-09-12 11:10:00","2018-09-12 19:10:00","OPEC monthly report: OPEC crude production rose 278k bpd in August to average 32.56mln bpd, according to secondary sources"
"2018-09-12 11:02:00","2018-09-12 19:02:00","Large Technology companies are to appear before US senate to discuss privacy, as according to the WSJ"
"2018-09-12 10:58:00","2018-09-12 18:58:00","The DUP is supporting the ERG's solution to the NI-Ireland border, as according to Robert Peston, which he states ""is surely chilling for a PM who rubbishes that solution and whose grip on power depends on DUP support"""
"2018-09-12 10:39:00","2018-09-12 18:39:00","RANsquawk Daily US Opening News - 12th September 2018"
"2018-09-12 10:25:00","2018-09-12 18:25:00","Ryanair (RYA LN) affirm Net profit at EUR 1.25-1.35bln, and say the risk of a no-deal Brexit is being underestimated and could lead to grounding of flights; CEO says strikes are not wanted but they will put up with them to defend low cost flying "
"2018-09-12 10:21:00","2018-09-12 18:21:00","Riksbank Governor Ingves reiterates that still expects enough demand in the system for inflation to rise towards 2% target; adding the Riksbank are on track to tighten monetary policy slowly"
"2018-09-12 10:07:00","2018-09-12 18:07:00","Fevertree Drinks (FEVR LN) shares spike to session highs after a mention on FT's Alphaville on potential bidders for the company, with Pepsico (PEP) mentioned"
"2018-09-12 10:02:00","2018-09-12 18:02:00","RANsquawk EU Mid Session: ERG release alternate Brexit plan whilst playing down May overthrow - 12th September 2018"
"2018-09-12 10:01:00","2018-09-12 18:01:00","Libya's NOC say that oil production is to be stable at 1mln BPD"
"2018-09-12 09:55:00","2018-09-12 17:55:00","Prysmian (PRY IM) says that works on Westernlink Interconnection have been temporarily suspended due to the need to investigate a problem which occur in onshore section of cable"
"2018-09-12 09:48:00","2018-09-12 17:48:00","UK's North Sea Buzzard oilfield did not restart as planned yesterday evening due to adverse weather conditions"
"2018-09-12 09:33:00","2018-09-12 17:33:00","HSBC raises Brent forecast from USD 70/bbl to USD 80/bbl in end-2019, USD 85/bbl end-2020 and USD 75/bbl end-2021"
"2018-09-12 09:33:00","2018-09-12 17:33:00","Germany sells EUR 0.768bl vs. Exp. EUR 1bln 1.25% 2048 Bund; b/c 2.0 (Prev. 1.2) average yield 1.1% (Prev. 1.02%) and retention 23.2% (Prev. 17.76%)"
"2018-09-12 09:31:00","2018-09-12 17:31:00","The ERG have released their alternative for the NI-Irish border, where they promise technological solutions, trusted-trader schemes and equivalence of standards on agricultural products "
"2018-09-12 09:26:00","2018-09-12 17:26:00","Fixed Income: upside extension after downside rejection"
"2018-09-12 09:11:00","2018-09-12 17:11:00","Former Junior Brexit Minister Steve Baker denies reports that he or any other officers of the ERG are plotting to remove UK PM May"
"2018-09-12 09:03:00","2018-09-12 17:03:00","FX Morning Colour: Pound jumps as EU’s Juncker picks up pro-Brexit deal baton"
"2018-09-12 09:00:00","2018-09-12 17:00:00","ASIA-PAC SERVICE HAS NOW FINISHED, PLEASE REVERT BACK TO YOUR ORIGINAL CHANNEL FOR COVERAGE ON THE UK & EUROPEAN SESSION"
"2018-09-12 09:00:00","2018-09-12 17:00:00","ASIA-PAC SERVICE HAS NOW FINISHED, PLEASE REVERT BACK TO YOUR ORIGINAL CHANNEL FOR COVERAGE ON THE UK & EUROPEAN SESSION"
"2018-09-12 08:53:00","2018-09-12 16:53:00","NHC says Hurricane Florence is heading towards the US East Coast and is expected to bring life-threatening storm surge and rainfall to portions of the Carolinas and mid-Atlantic states"
"2018-09-12 08:50:00","2018-09-12 16:50:00","ECB allots USD 99mln in their 7-day USD operation "
"2018-09-12 08:41:00","2018-09-12 16:41:00","E.ON (EOAN GY) affirms guidance following a profit warning by SSE (SSE LN)"
"2018-09-12 08:40:00","2018-09-12 16:40:00","Source reports suggest that the ECB have lowered their projections for economic growth, and see downside risk to growth due to weaker external demand, but keep inflation outlook unchanged"
"2018-09-12 08:32:00","2018-09-12 16:32:00","Iberia (IAG LN) Flight Airbus (AIR FP) A350 has suffered technical failures and diverted, with problem due to a Rolls Royce (RR. LN) engine "
"2018-09-12 08:20:00","2018-09-12 16:20:00","Flughafen Wien (FLU AV) say passenger guidance for 2018 may be ""significantly surpassed"""
"2018-09-12 08:14:00","2018-09-12 16:14:00","RANsquawk Bond Auction Previews - 12th September 2018"
"2018-09-12 07:45:00","2018-09-12 15:45:00","Gilts and Short Sterling narrowly ahead in line with core counterparts"
"2018-09-12 07:39:00","2018-09-12 15:39:00","EU's Juncker welcomes UK PM May's close partnership proposal and agrees with Chequers proposal to start a close partnership on trade"
"2018-09-12 07:22:00","2018-09-12 15:22:00","UK Environment Secretary Gove states that people need to get behind UK PM May and that there is a clear plan and is the only plan on the table to ensure departure form the EU and single market "
"2018-09-12 07:17:00","2018-09-12 15:17:00","Russian Deputy Finance Minister says RUB weakening is expected to end by year-end"
"2018-09-12 07:10:00","2018-09-12 15:10:00","ECB says banks borrowed EUR 240mln at marginal rate & deposited EUR 671.144bln"
"2018-09-12 07:07:00","2018-09-12 15:07:00","Morning  EU Movers: Hermes (RMS FP) +1.4%, RBS (RBS LN) +1.3%, Taylor Wimpey (TW/ LN) +1.2%, Inditex (ITX SM) -0.5%, Swiss Prime Site (SPSN SW) -2.0%, SSE (SSE LN) -10.0%"
"2018-09-12 06:57:00","2018-09-12 14:57:00","Bunds: reversing some BTP convergence ahead of German supply"
"2018-09-12 06:53:00","2018-09-12 14:53:00","Additional European equity stories post the release of the Daily European equity opening news"
"2018-09-12 06:39:00","2018-09-12 14:39:00","Czech Central Bank Governor Rusnok says a September interest rate hike is “quite close”, arguments to wait are weak; adding he sees two rate hikes by end-2018 as a “strong scenario”"
"2018-09-12 06:27:00","2018-09-12 14:27:00","Major FX option expiries for today's NY cut"
"2018-09-12 06:26:00","2018-09-12 14:26:00","US and China trade talks may start after the November US mid-term elections"
"2018-09-12 05:51:00","2018-09-12 13:51:00","DAILY EUROPEAN EQUITY OPENING NEWS"
"2018-09-12 05:43:00","2018-09-12 13:43:00","NHC says Hurricane Florence is expected to bring life threatening storm surge and rainfall to all portions of the Carolinas and mid-Atlantic states. The hurricane is about 625miles southeast of Cape Fear, North Carolina with sustained winds of 140mph"
"2018-09-12 05:39:00","2018-09-12 13:39:00","Italy's Deputy PM Do Maio says there is no need for Italy to breach the 3% deficit limit"
"2018-09-12 05:20:00","2018-09-12 13:20:00","RANsquawk Daily European Opening News - 12th September 2018 "
"2018-09-12 05:16:00","2018-09-12 13:16:00","Russian President Putin notes growing protectionism is a challenge for global economy, especially in Asia"
"2018-09-12 05:02:00","2018-09-12 13:02:00","Tokyu (9005 JT) to split off railway business around September next year"
"2018-09-12 05:00:00","2018-09-12 13:00:00","Singapore Retail Sales (Jul) Y/Y -2.6% (Prev. 2.0%)"
"2018-09-12 05:00:00","2018-09-12 13:00:00","Singapore Retail Sales (Jul) M/M -2.9% (Prev. 1.2%)"
"2018-09-12 04:56:00","2018-09-12 12:56:00","ECB SSM Chief Nuoy says consolidation needed to bolster EU banks' profitability"
"2018-09-12 04:53:00","2018-09-12 12:53:00","ASIA-PAC MARKET WRAP: Asia stocks declined across the board as region failed to sustain Wall St momentum"
"2018-09-12 04:39:00","2018-09-12 12:39:00","BoE Governor Carney warns against complacency in the 10th anniversary of the GFC, while he outlined risks to the UK economy including high levels of household debt, no-deal Brexit, high debt for China's economy and catastrophic cyber attack"
"2018-09-12 04:10:00","2018-09-12 12:10:00","Kubota (6326 JT) to conduct press conference related to issues with product inspection reports"
"2018-09-12 04:01:00","2018-09-12 12:01:00","EU official says UK will definitely exit EU in March but will never be an ordinary third country for the EU, adds Juncker is to say EU will remain firm on its divorce demands but wants a close partnership with UK post-Brexit"
"2018-09-12 04:00:00","2018-09-12 12:00:00","Turkish President Erdogan reportedly named as head of Turkey's wealth fund"
"2018-09-12 03:27:00","2018-09-12 11:27:00","PRE-MARKET INDIA STOCK NEWS: Supreme Court ordered a stay on insolvency proceedings to provide relief for defaulters in the power, sugar, shipping and textile sectors"
"2018-09-12 03:11:00","2018-09-12 11:11:00","S&P downgrades 7 local government financing vehicles in China"
"2018-09-12 03:00:00","2018-09-12 11:00:00","South Korean Bank Lending to Households in August increased by KRW 5.9tln to KRW 802.6tln"
"2018-09-12 03:00:00","2018-09-12 11:00:00","South Korean M2 Money Supply (Jul) Y/Y 6.7% (Prev. 6.1%)"
"2018-09-12 02:59:00","2018-09-12 10:59:00","Reports note speculation amongst FX dealers the RBI may announce measures soon to support INR"
"2018-09-12 02:55:00","2018-09-12 10:55:00","NHC says Florence is forecast to be an extremely dangerous major hurricane through landfall and expected to bring life-threatening storm surge and rainfall to the Carolinas and mid-Atlantic states"
"2018-09-12 02:41:00","2018-09-12 10:41:00","Gazprom Neft CEO says doubtful OPEC+ will agree to raise supply soon"
"2018-09-12 02:37:00","2018-09-12 10:37:00","ASIA-PAC MID-SESSION UPDATE: Asia stocks trade in the red after failing to sustain Wall St momentum"
"2018-09-12 02:30:00","2018-09-12 10:30:00","Norilsk Nickel analysts says global nickel deficit seen at 90K tons by August YTD which is expected to increase to 120k tons by year-end"
"2018-09-12 02:26:00","2018-09-12 10:26:00","US officials are said to note discussions with India related to new trade agreements"
"2018-09-12 01:50:00","2018-09-12 09:50:00","Gateway Lifestyle Operations (GTY AT) recommends shareholders accept takeover offer valued at AUD 2.25/Shr from Hometown"
"2018-09-12 01:37:00","2018-09-12 09:37:00","North Korea and South Korea will open liaison office in Gaeseong this Friday"
"2018-09-12 01:34:00","2018-09-12 09:34:00","Russia Energy Minister Novak states countries have potential to raise oil output, also states Russia has potential to increase oil production mid-term"
"2018-09-12 01:30:00","2018-09-12 09:30:00","Philippines Economic Chief says economic managers have proposed 9 measures to tackle inflation"
"2018-09-12 01:15:00","2018-09-12 09:15:00","PBOC are to inject CNY 60bln via 7-day reverse repos"
"2018-09-12 01:15:00","2018-09-12 09:15:00","PBoC sets CNY mid-point at 6.8546(Prev. 6.8488)"
"2018-09-12 01:10:00","2018-09-12 09:10:00","BoJ offers to buy JPY 450bln in 5yr-10yr, JPY 180bln 10yr-25yr and JPY 60bln in 25yr+ JGBs"
"2018-09-12 01:10:00","2018-09-12 09:10:00","BoJ offers to buy JPY 450bln in 5yr-10yr, JPY 180bln 10yr-25yr and JPY 60bln in 25yr+ JGBs"
"2018-09-12 01:05:00","2018-09-12 09:05:00","South Korean Finance Minister Kim says do not expect a short-term rebound in job market"
"2018-09-12 01:00:00","2018-09-12 09:00:00","Australia To Sell AUD 1bln 2.25% 2028 Bonds, b/c 3.2, avg. yield 2.589%"
"2018-09-12 01:00:00","2018-09-12 09:00:00","PRE-MARKET CHINESE  STOCK NEWS: China were reportedly to ask the WTO to authorize trade sanctions on the US because of the non-compliance in 2017 trade dispute ruling which related to the dumping dispute started in 2013"
"2018-09-12 00:51:00","2018-09-12 08:51:00","BofAML opened long position in GBP/USD via 1.3500 6-month call, states prefer options play as path is unlikely to be smooth and that no deal rhetoric has declined, adds bar to Brexit deal is relatively low and that GBP is cheap vs. rate spreads"
"2018-09-12 00:43:00","2018-09-12 08:43:00","Russian Energy Minister Novak says Russia wants to achieve 20% share of global LNG market"
"2018-09-12 00:30:00","2018-09-12 08:30:00","Australian Westpac Consumer Confidence Index (Sep) 100.5 (Prev. 103.6)"
"2018-09-12 00:23:00","2018-09-12 08:23:00","PRE-MARKET TAIWAN AND SINGAPORE NEWS: Market Researcher TrendForce stated that memory chip prices could continue to decline next quarter."
"2018-09-12 00:11:00","2018-09-12 08:11:00","Japanese Economic Minister Motegi and US Trade Representative Lighthizer likely to conduct trade discussions on September 21st"
