"gmt_time","hk_time","subject"
"2018-12-28 21:30:00","2018-12-29 05:30:00","AUDIO SERVICE HAS NOW CLOSED FOR THE WEEK. THE ASIA DESK WILL REOPEN ON SUNDAY AT 2200GMT, EUROPEAN SERVICE WILL RESUME ON MONDAY AT 0630GMT. HAVE A PLEASANT WEEKEND."
"2018-12-28 18:00:00","2018-12-29 02:00:00","CHRISTMAS PERIOD OPENING HOURS  "
"2018-12-28 13:00:00","2018-12-28 21:00:00","RANSQUAWK CHRISTMAS PERIOD OPENING HOURS"
"2018-12-28 10:00:00","2018-12-28 18:00:00","DESK CHRISTMAS PERIOD OPENING HOURS"
"2018-12-28 09:00:00","2018-12-28 17:00:00","ASIA-PAC SERVICE HAS NOW FINISHED, PLEASE REVERT BACK TO YOUR ORIGINAL CHANNEL FOR COVERAGE ON THE UK & EUROPEAN SESSION"
"2018-12-28 06:45:00","2018-12-28 14:45:00","RANSQUAWK CHRISTMAS PERIOD OPENING HOURS"