"gmt_time","hk_time","subject"
"2018-11-15 09:39:00","2018-11-15 17:39:00","Telegraph political editor Swinford tweets ""I'm told Penny Mordaunt is still pushing hard for Cabinet to be given a free vote, despite being rebuffed by PM"""
"2018-11-15 09:35:00","2018-11-15 17:35:00","James Rothwell Telegraph Brexit correspondent tweets A plugged-in Tory source, not a Brexiteer, reckons 6 Cabinet resignations to follow Raab, three unknowns, the rest will back the deal."
"2018-11-15 09:25:00","2018-11-15 17:25:00","Sam Coates political editor of The Times tweets that Michael Gove is being urged to quit by friends"
"2018-11-15 09:21:00","2018-11-15 17:21:00","ITV's Peston states ""It is almost impossible to see how she can survive as Tory leader and PM after such a shattering blow to her reputation for competence"""
"2018-11-15 09:00:00","2018-11-15 17:00:00","ASIA-PAC SERVICE HAS NOW FINISHED, PLEASE REVERT BACK TO YOUR ORIGINAL CHANNEL FOR COVERAGE ON THE UK & EUROPEAN SESSION"
"2018-11-15 08:59:00","2018-11-15 16:59:00","UK debt and STIR futures fly as pressure mounts against PM May"
"2018-11-15 08:54:00","2018-11-15 16:54:00","UK Brexit Secretary Raab has resigned "
"2018-11-15 08:43:00","2018-11-15 16:43:00","Government have confirmed a statement at 10:30GMT from PM May in the House of Commons on the Withdrawal Agreement; according to Labour Whips"
"2018-11-15 08:41:00","2018-11-15 16:41:00","Russia have cut oil output in the first two weeks of November to 11.38mln BPD, according to IFX"
"2018-11-15 08:12:00","2018-11-15 16:12:00","ECB says banks borrowed 66mln at marginal rate & deposited EUR 630.6bln with it overnight"
"2018-11-15 08:12:00","2018-11-15 16:12:00","Bunds: somewhat begrudging and fleeting acknowledgment of upturn in risk sentiment"
"2018-11-15 08:07:00","2018-11-15 16:07:00","Barclays raise their USDCNY forecast to 7.15 by mid 2019 vs prev. 6.95"
"2018-11-15 08:05:00","2018-11-15 16:05:00","European equity movers this morning: Antofagasta (ANTO LN) +2.6%; Hugo Boss (BOSS GY) +2.6%; Bouygues (EN FP) +2.2%; Ipsen (IPN FP) +2.0%; Dialog Semiconductor (DLG GY) - 3.3%; Daimler (DAI GY) -1.5%"
"2018-11-15 07:58:00","2018-11-15 15:58:00","ITV's Peston says that Tory MP's tell him that 48 letters of no-confidence are to be lodged by lunchtime today"
"2018-11-15 07:47:00","2018-11-15 15:47:00","Deutsche Bank (DBK GY) see the Stoxx 600 falling 5% below current levels by next year"
"2018-11-15 07:43:00","2018-11-15 15:43:00","Option expiries of note for today's 10.00am NY cut (1500GMT)"
"2018-11-15 07:38:00","2018-11-15 15:38:00","DUP MP Shannon says they feel betrayed and will ""certainly"" vote against May's Brexit deal"
"2018-11-15 07:38:00","2018-11-15 15:38:00","RANsquawk Bond Auction Previews - 15th November 2018"
"2018-11-15 07:34:00","2018-11-15 15:34:00","Minister of State for Northern Ireland Shailesh Vara has resigned"
"2018-11-15 07:29:00","2018-11-15 15:29:00","Chinese commerce ministry says US and China have resumed high level talks on trade"
"2018-11-15 07:24:00","2018-11-15 15:24:00","EU's Chief Negotiator Barnier says agreement with Britain on Brexit is fair and balanced; EC President Tusk confirms November 25th as the Brexit Summit"
"2018-11-15 07:21:00","2018-11-15 15:21:00","Paul Waugh of HuffPost tweets ""NEW: A Minister of State is going to announce he is quitting in the next 15 minutes, I'm told.  A former Remainer, he's furious at May's Brexit deal."""
"2018-11-15 07:09:00","2018-11-15 15:09:00","Italian PM Conte seeks to work with the EU on budget impasse; according to La Stampa"
"2018-11-15 07:03:00","2018-11-15 15:03:00","Additional European equity stories post the release of the Daily European equity opening news"
"2018-11-15 06:55:00","2018-11-15 14:55:00","DAILY EUROPEAN EQUITY OPENING NEWS"
"2018-11-15 06:23:00","2018-11-15 14:23:00","RANsquawk Daily European Opening News - 15th November 2018 "
"2018-11-15 06:09:00","2018-11-15 14:09:00","Barclays forecast Q4 Brent prices to USD 75/BBL and WTI from USD 66/BBL to USD 68/BBL"
"2018-11-15 06:04:00","2018-11-15 14:04:00","Twitter source suggests that meaningful on Brexit is to be held on December 18th - Unconfirmed"
"2018-11-15 05:57:00","2018-11-15 13:57:00","Iraq says it needs Kirkuk oil for domestic refining amid export pipeline dispute, while US is said to be frustrated with Iraq's excuses on delaying Kirkuk crude exports according to Rudaw news agency"
"2018-11-15 05:50:00","2018-11-15 13:50:00","ASIA-PAC MARKET WRAP: Asia stocks mostly recover from early losses with China buoyed following Tencent's earning beat"
"2018-11-15 05:37:00","2018-11-15 13:37:00","Keppel Infrastructure Trust (KIT SP) signs AUD 1bln deal with Blackstone Group (BX) to acquire Ixom"
"2018-11-15 05:35:00","2018-11-15 13:35:00","Suzuki (7269 JT) recalls 507.1k vehicles due to power steering"
"2018-11-15 05:18:00","2018-11-15 13:18:00","Moody's says Asia-Pac credit conditions are seen broadly stable next year, adds increasing trade tensions between US and China will pose risks through trade and investment flows for Asia Pacific"
"2018-11-15 05:07:00","2018-11-15 13:07:00","Press reports note that China is said to halt customs clearance of coal imports for this year"
"2018-11-15 05:01:00","2018-11-15 13:01:00","CJ CheilJedang (097950 KS) is said to pay around KRW 2.1tln to buy Schwan's Company"
"2018-11-15 04:37:00","2018-11-15 12:37:00","US Vice President Pence says believes Trump-Kim summit will happen after January 1st"
"2018-11-15 04:14:00","2018-11-15 12:14:00","Canadian PM Trudeau says to continue to work with China on an eventual free trade agreement"
"2018-11-15 03:49:00","2018-11-15 11:49:00","Canadian Trade Diversification Minister Carr anticipates rising pressure from WTO reform"
"2018-11-15 03:48:00","2018-11-15 11:48:00","Australian PM Morrison says concluded negotiation on Hong Kong trade"
"2018-11-15 03:35:00","2018-11-15 11:35:00","Japan sells JPY 1.64tln in 5yr JGBs b/c 3.89 vs. Prev. 4.88, avg. yield -0.087% vs. Prev. -0.055%"
"2018-11-15 03:30:00","2018-11-15 11:30:00","US Vice President Pence says much work remains to denuclearize North Korea, but there has been meaningful progress"
"2018-11-15 03:28:00","2018-11-15 11:28:00","South Korean President Moon says 2nd US-North Korea summit can make progress"
"2018-11-15 03:25:00","2018-11-15 11:25:00","PRE-MARKET INDIA STOCK NEWS: ING (INGA NA) is selling remaining stake in Kotak Mahindra Bank (KMB IS) which could be valued at INR 76bln"
"2018-11-15 03:02:00","2018-11-15 11:02:00","China's NDRC says have not looked into cutting tax on auto purchases"
"2018-11-15 03:00:00","2018-11-15 11:00:00","Japanese Tokyo Condominium Sales (Oct) Y/Y 2.8% (Prev. 13.2%)"
"2018-11-15 02:47:00","2018-11-15 10:47:00","ASIA-PAC MID-SESSION UPDATE: Asia trades mixed after subdued Wall St lead and as region focuses on bank and tech earnings"
"2018-11-15 02:11:00","2018-11-15 10:11:00","India is mulling tax proposals in its interim budget"
"2018-11-15 02:11:00","2018-11-15 10:11:00","China NDRC approved CNY 91.8bln in fixed asset investment last month"
"2018-11-15 02:11:00","2018-11-15 10:11:00","India is mulling tax proposals in its interim budget"
"2018-11-15 02:00:00","2018-11-15 10:00:00","RBA Deputy Governor Debelle says macro prudential measures have lowered risk of new home borrowing and that lending curbs have improved resilience of economy to future shocks"
"2018-11-15 01:18:00","2018-11-15 09:18:00","US Congress report notes that China's hegemonic ambitions pose a certain threat to US security and economic interests, according to Japanese press reports"
"2018-11-15 01:17:00","2018-11-15 09:17:00","ICBC (1398 HK) New York Branch reportedly is cancelling USD FRN issue"
"2018-11-15 01:15:00","2018-11-15 09:15:00","PBoC sets CNY mid-point at 6.9392 (Prev. 6.9402)"
"2018-11-15 01:10:00","2018-11-15 09:10:00","PBoC skips open market operations"
"2018-11-15 01:01:00","2018-11-15 09:01:00","PRE-MARKET CHINESE  STOCK NEWS: Tencent (700 HK) Q2 net CNY 23.3bln vs. Exp. CNY 18.4bln; although reports note prospects are clouded amid China video game freeze on new titles "
"2018-11-15 00:30:00","2018-11-15 08:30:00","Australian RBA FX Transactions Government (AUD)(Oct) -542M (Prev. -801M)"
"2018-11-15 00:30:00","2018-11-15 08:30:00","Australian RBA FX Transactions Other (AUD)(Oct) -3906M (Prev. 1719M)"
"2018-11-15 00:30:00","2018-11-15 08:30:00","Australian RBA FX Transactions (AUD)(Oct) 450M (Prev. 640M)"
"2018-11-15 00:30:00","2018-11-15 08:30:00","Australian Part Time Employment Oct -9.5k (Prev. -14.7k)"
"2018-11-15 00:24:00","2018-11-15 08:24:00","New Zealand PM Arden says discussed benefits of free trade with US Vice President Pence, also discussed steel and aluminium tariffs"
"2018-11-15 00:17:00","2018-11-15 08:17:00","PRE-MARKET TAIWAN AND SINGAPORE NEWS: Earnings from HTC and SinoPac Financial"
"2018-11-15 00:06:00","2018-11-15 08:06:00","Asia equity markets begin mixed with Nikkei 225 underperforming on JPY strength and with large financials' earnings in focus; ASX 200 (+0.1%), Nikkei 225 (-0.7%), KOSPI (Open delayed by 1 hour)"
"2018-11-15 00:02:00","2018-11-15 08:02:00","Tokyo Stock Exchange confirms Toshiba (6502 JT) repurchased around 3.97mln shares today"
"2018-11-15 00:00:00","2018-11-15 08:00:00","Australian MI Inflation Expectations (Nov)	3.6% (Prev. 4.0%)"