"gmt_time","hk_time","subject"
"2018-10-11 23:56:00","2018-10-12 07:56:00","US officials were told by Turkey that they have video and audio proof that Khashoggi was killed in Saudi consulate"
"2018-10-11 23:52:00","2018-10-12 07:52:00","NHC says Tropical Storm Michael is losing Tropical characteristics "
"2018-10-11 23:50:00","2018-10-12 07:50:00","Japanese M2 Money Stock  2.8% vs. Exp. 2.9% (Prev. 2.9%)"
"2018-10-11 23:50:00","2018-10-12 07:50:00","Japanese M3 Money Stock	2.5 % vs. Exp. 2.5%	"
"2018-10-11 23:31:00","2018-10-12 07:31:00","South Korea's Financial Regulator says they will respond to stabilise the market if needed"
"2018-10-11 23:28:00","2018-10-12 07:28:00","PRE-MARKET JAPANESE AND SOUTH KOREAN STOCK NEWS: - US Treasury Department is said to have sought meetings with South Korean banks in regard to North Korea's sanctions. (Newswires)"
"2018-10-11 23:01:00","2018-10-12 07:01:00","Irish Central Bank raises 2018 GDP forecast to 6.7% (Prev. 4.7%) and 2019 to 4.8% (Prev. 4.2%)"
"2018-10-11 22:52:00","2018-10-12 06:52:00","US President Trump says ""the US is doing so well, other than the Fed"""
"2018-10-11 22:30:00","2018-10-12 06:30:00","US President Trump's lawyers are preparing to answer questions by Special Counsel Mueller; according to NBC citing sources"
"2018-10-11 22:25:00","2018-10-12 06:25:00","US Treasury Department is said to have sought meetings with South Korean banks in regards to North Korea's sanctions"
"2018-10-11 22:23:00","2018-10-12 06:23:00","PRE-MARKET AUSTRALIAN STOCK NEWS: ASX set to extend losses following the downbeat tone from Wall St. (SMH)"
"2018-10-11 22:14:00","2018-10-12 06:14:00","Mexican Government said it will take necessary actions to protect exporters in the short term, adding it will use all mechanisms available under NAFTA and WTO to be totally excluded from Canada's safeguards"
"2018-10-11 22:10:00","2018-10-12 06:10:00","US Senators push vote to block Saudi arms sale following the journalist disappearance"
"2018-10-11 21:48:00","2018-10-12 05:48:00","Mexico are said to plan to review Canada steel tariffs as a potential violation of NAFTA"
"2018-10-11 21:47:00","2018-10-12 05:47:00","Shell (RDSA LN) is seeking to sell a stake in Venezuelan oil JV Petroregional Del Lago to Maurel & Prom; according to sources"
"2018-10-11 21:24:00","2018-10-12 05:24:00","Louisiana Offshore Oil Port has resumed normal operations at its Marine terminal following the shutdown due to Hurricane Michael"
"2018-10-11 21:20:00","2018-10-12 05:20:00","UK PM May is facing the threat of Cabinet resignations after she accepted EU demands that there will be no time limit on her controversial Brexit backstop plan."
"2018-10-11 21:17:00","2018-10-12 05:17:00","ASIAN DAILY ECONOMIC RELEASES CALENDAR NOW AVAILABLE IN THE RESEARCH SECTION: Highlights include the RBA's Financial Stability Review"
"2018-10-11 21:07:00","2018-10-12 05:07:00","Brazilian Central Bank Governor says the country is well positioned to resist shocks"
"2018-10-11 21:00:00","2018-10-12 05:00:00","US SERVICE IS NOW CLOSED, PLEASE SWITCH OVER TO THE ASIA CHANNEL"
"2018-10-11 21:00:00","2018-10-12 05:00:00","ASIA-PAC SERVICE IS NOW LIVE FOR TODAY'S SESSION"
"2018-10-11 20:53:00","2018-10-12 04:53:00","NHC says Tropical Storm Michael is expected to turn towards the East-NorthEast at an even faster foward speed"
"2018-10-11 20:51:00","2018-10-12 04:51:00","DAILY ASIA-PAC OPENING NEWS"
"2018-10-11 20:49:00","2018-10-12 04:49:00","US President Trump is mulling candidates who could replace Attorney General Sessions, according to the WSJ"
"2018-10-11 20:42:00","2018-10-12 04:42:00","A top DUP MP tells Sky News that Conservatives may have to change leader to ""heal wounds"" with the DUP and ensure its confidence and supply agreement ""stays in place"""
"2018-10-11 20:08:00","2018-10-12 04:08:00","RANsquawk US Market Wrap - 11th October 2018: Stocks extend rout; Trump renews Fed criticism"
"2018-10-11 19:55:00","2018-10-12 03:55:00","US Treasury Secretary Mnuchin says US is committed to fair trading agreement with China, fair and reciprocal trade deals"
"2018-10-11 19:44:00","2018-10-12 03:44:00","The US State Department says it is not aware of any deal to secure the release of US Pastor Brunson "
"2018-10-11 19:39:00","2018-10-12 03:39:00","Turkish officials expect the court to release Pastor Brunson on Friday"
"2018-10-11 19:14:00","2018-10-12 03:14:00","US President Trump and Chinese president Xi are set to meet at G20 next month"
"2018-10-11 18:48:00","2018-10-12 02:48:00","BBC's Laura Kuenssberg says no real progress has been made at the cabinet meeting and no decision have been made but discussions will continue"
"2018-10-11 18:31:00","2018-10-12 02:31:00","WTI (X8) settles USD 2.20 lower at USD 70.97/bbl, Brent (Z8) settles USD 2.83 lower at USD 80.26/bbl"
"2018-10-11 18:23:00","2018-10-12 02:23:00","UK PM May briefed her inner cabinet on Thursday evening that a historic Brexit deal is close"
"2018-10-11 18:23:00","2018-10-12 02:23:00","UK PM May briefed her inner cabinet on Thursday evening that a historic Brexit deal is close"
"2018-10-11 18:18:00","2018-10-12 02:18:00","ECB won't come to Italy's rescue if government and banks run out of cash unless EU bailout in place, ECB Sources"
"2018-10-11 18:05:00","2018-10-12 02:05:00","US Gulf of Mexico oil producers shut in 40% of oil output ahead of hurricane Michael (prev. 42%), shut in 29% natural gas output (prev. 32%)"
"2018-10-11 17:42:00","2018-10-12 01:42:00","DUP lawmaker says we are not trying to oust UK PM May"
"2018-10-11 17:40:00","2018-10-12 01:40:00","NHC says tropical storm Michael is producing flash floodings across portions of North Carolina and South-Central Virginia"
"2018-10-11 17:37:00","2018-10-12 01:37:00","A secret agreement has been brokered to release Pastor Brunson, according to NBC"
"2018-10-11 17:32:00","2018-10-12 01:32:00","BP has begun redeploying offshore personnel to company-operated facilities in the deepwater Gulf of Mexico"
"2018-10-11 17:26:00","2018-10-12 01:26:00","British PM May says Brexit backstop talks are likely to continue until November"
"2018-10-11 17:20:00","2018-10-12 01:20:00","Fed's George (hawk) says gradual rate hikes needed, pace and extent of hikes are a key part of the FOMC's deliberations; risks to US economy are balanced but inflation could rise over the next couple of years"
"2018-10-11 17:02:00","2018-10-12 01:02:00","US sells USD 15bln of 30-year bonds, stops through by 0.9bps"
"2018-10-11 16:49:00","2018-10-12 00:49:00","Chevron (CVX) is returning crews and restoring output at two Gulf of Mexico oil platforms "
"2018-10-11 16:47:00","2018-10-12 00:47:00","United Technology (UTX) and Rockwell Collins (COL) reportedly file for Chinese ministerial approval approval for merger; according to a M&A blog "
"2018-10-11 16:46:00","2018-10-12 00:46:00","""Bond King"" Jeffrey Gundlach says 30-year Treasury could go to 4%"
"2018-10-11 16:39:00","2018-10-12 00:39:00","Medtronic (MDT) says it has disables internet ipdates for two models of pacemaker programmers due to cyber-security vulnerability"
"2018-10-11 16:26:00","2018-10-12 00:26:00","DUP leader says PM May could not in good conscience recommend a deal which places a trade barrier within the UK"
"2018-10-11 16:23:00","2018-10-12 00:23:00","China will not be named currency manipulator in Treasury's Semiannual Currency Report next week, ForexLive reports citing Politico"
"2018-10-11 16:06:00","2018-10-12 00:06:00","Brazilian presidential candidate Haddad wants to use 10% of Brazil's FX reserves to finance wind and solar energy projects in the North-East"
"2018-10-11 15:51:00","2018-10-11 23:51:00","Colonial says it is experiencing power outages at delivery facilities south of Macon, Albany and Bainbridge "
"2018-10-11 15:42:00","2018-10-11 23:42:00","Italy's Senate votes to push balanced budget goal beyond 2021, approves budget deficit target"
"2018-10-11 15:41:00","2018-10-11 23:41:00","US President Trump says the Fed is out of control, is far too stringent and making a mistake"
"2018-10-11 15:36:00","2018-10-11 23:36:00","AUCTION PREVIEW: US to sell USD 15bln of 30-year bonds on 11 October 2018 at 1800 BST/ 1300 EST"
"2018-10-11 15:35:00","2018-10-11 23:35:00","US oil firms restoring operations in Gulf of Mexico"
"2018-10-11 15:31:00","2018-10-11 23:31:00","EUROPEAN PRELIMINARY CASH EQUITY CLOSE: EURO STOXX 50 (-1.77%), FTSE 100 (-1.95%), DAX (-1.49%), CAC (-1.79%), IBEX (-1.66%), FTSE MIB (-1.81%), SMI (-2.79%)"
"2018-10-11 15:31:00","2018-10-11 23:31:00","OPEC oil shipments will fall by 450k BPD to 25.1mln BPD in the four weeks to Oct. 27 vs. period to Sept. 29, according to data from tanker tracker Oil Movements. Mideast shipments, including Oman and Yemen, will slump by 730k BPD to 17.94m BPD"
"2018-10-11 15:16:00","2018-10-11 23:16:00","Japan Finance Minister Aso says carefully watching financial markets moves, including FX"
"2018-10-11 15:14:00","2018-10-11 23:14:00","Russia Energy Minister says oil production in Russia is 10,000 bpd higher than September levels, since October start"
"2018-10-11 15:04:00","2018-10-11 23:04:00","UK PM May spokeswoman says Britain still intends to set out new proposals on regulatory aspects of Northern Ireland backstop in due course"
"2018-10-11 14:51:00","2018-10-11 22:51:00","UK PM May is said to be facing a cabinet revolt over her new backstop plan amid concerns that it will keep Britain in a customs union with Brussels indefinitely. "
"2018-10-11 14:30:00","2018-10-11 22:30:00","Daily FX Wrap: DXY down, but not quite out as risk sentiment stabilises"
"2018-10-11 14:24:00","2018-10-11 22:24:00","Italy's Di Maio says the Government will cut tax benefits on bank interest payments"
"2018-10-11 14:06:00","2018-10-11 22:06:00","NEC Director Kudlow says the Fed is independent, the President has his own ideas"
"2018-10-11 14:03:00","2018-10-11 22:03:00","DoE Expectations for today: Crude Stocks +2.620mln; Distillate Stocks -2.005mln; Gasoline Stocks -0.042mln; Refining Utilisation -0.7% "
"2018-10-11 13:59:00","2018-10-11 21:59:00","UK Lawmakers demand the BoE publishes their analysis of Brexit's impact"
"2018-10-11 13:59:00","2018-10-11 21:59:00"," Beijing ‘looking into joining trans-Pacific trade pact’ to hedge against US, SCMP reports"
"2018-10-11 13:44:00","2018-10-11 21:44:00","EU's Malmstrom says that the EU is open to US talks on all industrial goods and cars"
"2018-10-11 13:41:00","2018-10-11 21:41:00","Pentagon looking at grounding Lockheed Martin's (LMT) F-35 fleet, as according to Task and Purpose"
"2018-10-11 13:40:00","2018-10-11 21:40:00","Netherlands are ready to cut the corporate tax rate to 21%"
"2018-10-11 13:23:00","2018-10-11 21:23:00","EU Trade Commissioner Malmstrom says Europe mulling not negotiating with the US on trade; adds Trump's strategy to negotiate trade is working "
"2018-10-11 13:09:00","2018-10-11 21:09:00","Fixed and FX latest: classic, albeit restrained post-US CPI reaction"
"2018-10-11 12:53:00","2018-10-11 20:53:00","Brazilian Election second round XP/IPESPE poll shows Bolsonaro in the lead at 51%, Haddad at 36%"
"2018-10-11 12:40:00","2018-10-11 20:40:00","RANsquawk Daily US Equity Opening News - 11th October 2018"
"2018-10-11 12:35:00","2018-10-11 20:35:00","US President Trump says that his policies have impacted the Chinese economy and he 'has a lot more to do'"
"2018-10-11 12:32:00","2018-10-11 20:32:00","US President Trump says the Fed is getting a little bit ""too cute"""
"2018-10-11 12:28:00","2018-10-11 20:28:00","Scotiabank FX Daily - Equity Market Turmoil Showing Limited Spillover To FX"
"2018-10-11 12:20:00","2018-10-11 20:20:00","DUP lawmaker Sammy Wilson says if PM May breaks promise to DUP then will have no choice but to vote against her"
"2018-10-11 11:52:00","2018-10-11 19:52:00","DEBT UPDATE: marginal new session lows ahead of US open"
"2018-10-11 11:35:00","2018-10-11 19:35:00","OPEC monthly report: OPEC crude production rose 132k bpd in September to average 32.76mln bpd, according to secondary sources"
"2018-10-11 11:30:00","2018-10-11 19:30:00","ECB Minutes state that factors behind growth slowdown may not be transitory, trade tensions could lead to more general decline in confidence"
"2018-10-11 11:19:00","2018-10-11 19:19:00","PRIMER: ECB September Minutes due to be released Thursday 11th October at 1230BST/0630CDT"
"2018-10-11 11:10:00","2018-10-11 19:10:00","European Commission states 'we are not there yet' on a Brexit deal, there has been no breakthrough"
"2018-10-11 11:10:00","2018-10-11 19:10:00","European Commission states 'we are not there yet' on a Brexit deal, there has been no breakthrough"
"2018-10-11 11:08:00","2018-10-11 19:08:00","RANsquawk Daily US Opening News - 11th October 2018"
"2018-10-11 11:00:00","2018-10-11 19:00:00","Walgreens Boots Alliance Inc (WBA) Q4 EPS USD 1.48 vs. Exp. USD 1.45, revenue USD 33.4bln vs. Exp. USD 33.78bln"
"2018-10-11 11:00:00","2018-10-11 19:00:00","Delta Air Lines Inc (DAL) Q3 EPS USD 1.80 vs. Exp. USD 1.74, revenue USD 11.8bln vs. Exp. USD 11.94bln "
"2018-10-11 10:34:00","2018-10-11 18:34:00","RANsquawk EU Mid Session - 11th October 2018"
"2018-10-11 10:28:00","2018-10-11 18:28:00","EU's Moscovici says has not rejected the Italian budget yet"
"2018-10-11 10:24:00","2018-10-11 18:24:00","UK PM May's spokesman says there have been a series of meetings recently when ministers receive negotiation updates, such as today. Adds, Northern Ireland backstop is an issue to be resolved but there are others"
"2018-10-11 10:19:00","2018-10-11 18:19:00","EU's Katainen says the commissions interest is to convince the Italian government to take responsibility on the budget, adds that it is not too late to show that public finances are on a credible path"
"2018-10-11 09:52:00","2018-10-11 17:52:00","Fixed Income: minor range extension, but relatively major risk aversion, albeit contained"
"2018-10-11 09:51:00","2018-10-11 17:51:00","Ingenico (ING FB) Is talking to Natixis but has not started talks with Edenred"
"2018-10-11 09:29:00","2018-10-11 17:29:00","FX Morning Colour: Dollar deflated pre-US CPI, but Sek elated after Swedish inflation data"
"2018-10-11 09:20:00","2018-10-11 17:20:00","Italy sells EUR 6.5bln vs. Exp. EUR 5-6.5bln 2.30% 2021, 2.50% 2025, 2.45% 2033 and 4.0% 2037 BTP Auction "
"2018-10-11 09:10:00","2018-10-11 17:10:00","Irish Foreign Minister says that there is not an agreement on a way forward on a Brexit deal yet, and it is too soon to claim there is an agreement yet"
"2018-10-11 09:00:00","2018-10-11 17:00:00","ASIA-PAC SERVICE HAS NOW FINISHED, PLEASE REVERT BACK TO YOUR ORIGINAL CHANNEL FOR COVERAGE ON THE UK & EUROPEAN SESSION"
"2018-10-11 08:50:00","2018-10-11 16:50:00","OPEC Secretary General Barkindo says that there is no cause for alarm, OPEC+ is ready to keep the market supplied"
"2018-10-11 08:20:00","2018-10-11 16:20:00","Italian Pension Chief says government plan would further increase 2021 pension spending by 1% of GDP"
"2018-10-11 08:18:00","2018-10-11 16:18:00","OPEC secretary Barkindo states that both Russia and Saudi Arabia have spare capacity"
"2018-10-11 08:07:00","2018-10-11 16:07:00","Italy's Pension body chief says the governments plan to lower the retirement age will cost future generations approximately EUR 100bln"
"2018-10-11 07:58:00","2018-10-11 15:58:00","Major option expiries for today's NY cut"
"2018-10-11 07:56:00","2018-10-11 15:56:00","UK debt and STIR futures taking stock of downturn in risk sentiment"
"2018-10-11 07:31:00","2018-10-11 15:31:00","Ingenico (ING FP) said to also draw preliminary interest from Edenred"
"2018-10-11 07:15:00","2018-10-11 15:15:00","Indian Financial Minister source says they expect the rupee to appreciate slightly from it's current level"
"2018-10-11 07:12:00","2018-10-11 15:12:00","ECB says banks borrowed EUR 65mln at marginal rate & deposited EUR 654.8bln"
"2018-10-11 07:08:00","2018-10-11 15:08:00","China's commerce ministry says China has not and will not engage in economic invasion"
"2018-10-11 07:07:00","2018-10-11 15:07:00","Italian Deputy PM Salvini says will not take even a cent off of the budget measure"
"2018-10-11 07:01:00","2018-10-11 15:01:00","Riskbank's Skingsley says bank will likely exit negative interest rate policies in 2019"
"2018-10-11 07:00:00","2018-10-11 15:00:00","European equity movers this morning: Natixis (KN FP) -4.3%, LVMH (LVMH IM) -2.4%, WH Smith (SMWH LN) -6.5%, Bayer (BAYN GY) +6.5%, Dialog Semiconductor (DLG GY) +27.3%, Ingenico (ING FP) +11.2%, IAG (IAG LN) -3.1%"
"2018-10-11 06:58:00","2018-10-11 14:58:00","Bunds: core bonds back in favour as stock rout intensifies"
"2018-10-11 06:43:00","2018-10-11 14:43:00","ECB's Hansson says wouldn't want to be any more precise with the guidance for rates, and is happy with the forward guidance. "
"2018-10-11 06:34:00","2018-10-11 14:34:00","Turkish Interior Minister asks that governors take measures against those who are hiking prices by 'taking advantage' of Forex developments"
"2018-10-11 06:33:00","2018-10-11 14:33:00","Italian Junior Minister Siri says the 2019 budget law is to include tax breaks for citizens who buy Government bonds"
"2018-10-11 06:27:00","2018-10-11 14:27:00","ECB's Rehn states that core inflation is still rather weak, therefore accommodative policy is required still; additionally that having monetary policy room for manouvre is part of resilience at the next downturn"
"2018-10-11 06:10:00","2018-10-11 14:10:00","Fast Retailing (9983 JT) - FY 2017/18 net profit JPY 154.81bln (+29.8%) and forecast 2018/19 net profit of JPY 165bln "
"2018-10-11 06:09:00","2018-10-11 14:09:00","RBA's Lowe says that they have been hoping for higher US rates for a while"
"2018-10-11 06:03:00","2018-10-11 14:03:00","Additional European equity stories post the release of the Daily European equity opening news"
"2018-10-11 05:56:00","2018-10-11 13:56:00","DAILY EUROPEAN EQUITY OPENING NEWS"
"2018-10-11 05:53:00","2018-10-11 13:53:00","Goldman Equity Research says they expect that oil can continue to grow by 1mln BPD/year until 2021 at the earliest"
"2018-10-11 05:51:00","2018-10-11 13:51:00","BoJ's Sakurai says it is hard to predict when inflation will hit 2% and that they are monitoring stock price movements"
"2018-10-11 05:49:00","2018-10-11 13:49:00","Fed's Bullard says that despite the surprise on GDP size, the Fed hasn't sped up rate hikes; adding that the Fed has normalized policy quite a bit, and says that we have hit the point where policy rates are at a good position"
"2018-10-11 05:28:00","2018-10-11 13:28:00","JP Morgan's Head of Fixed Income says that wider Italian Bond yield spread provides an ""investment opportunity"" alongside saying they are increasing their exposure to BTP bonds as political instability well remunerated"
"2018-10-11 05:25:00","2018-10-11 13:25:00","RANsquawk Daily European Opening News - 11th October 2018 "
"2018-10-11 05:18:00","2018-10-11 13:18:00","UAE Minister says UAE began to increase oil production in Q3 and expects to further increase production in October and November 2018;  2018 year-end production capacity to be 3.5mln BPD and Dec production will be subject to demand"
"2018-10-11 05:09:00","2018-10-11 13:09:00","ASIA-PAC MARKET WRAP: Asia mimicked the bloodbath seen on Wall St. "
"2018-10-11 05:04:00","2018-10-11 13:04:00","Italy's Budget Committee head Borghi said he expects the EU to reject Italy's 2019 fiscal plans"
"2018-10-11 04:42:00","2018-10-11 12:42:00","Japans Securities Clearing Corporation says emergency margin call triggered for index futures trading"
"2018-10-11 04:31:00","2018-10-11 12:31:00","NHC says Hurricane Michael weakens to a tropical storm over South-Central Georgia"
"2018-10-11 04:27:00","2018-10-11 12:27:00","ESM's Managing Director Regling said there is no immediate danger of Italy losing market access, nor being downgraded below investment grade"
"2018-10-11 03:58:00","2018-10-11 11:58:00","US DoJ charged Chinese Intelligence officer, Yanjun Xu, of economic espionage for stealing trade secrets from leading US aerospace companies"
"2018-10-11 03:41:00","2018-10-11 11:41:00","Turkish President Erdogan said he has to abide by the court decision on Pastor Brunson"
"2018-10-11 03:35:00","2018-10-11 11:35:00","Japan sells JPY 700bln in 30yr JGBs b/c 3.92 vs. Prev. 4.23, avg. yield 0.8980% vs. Prev. 0.838%"
"2018-10-11 03:35:00","2018-10-11 11:35:00","Japan sells JPY 700bln in 30yr JGBs b/c 3.92 vs. Prev. 4.23, avg. yield 0.8980% vs. Prev. 0.838%"
"2018-10-11 03:30:00","2018-10-11 11:30:00","PRE-MARKET INDIA STOCK NEWS: - RBI is sticking with plans to force payments firms to store data locally, according to sources (ET)"
"2018-10-11 03:28:00","2018-10-11 11:28:00","US Treasury Secretary Mnuchin said US is concerned with yuan depreciation; while he added nothing ""specifically happened today"" for markets to react "
"2018-10-11 03:23:00","2018-10-11 11:23:00","US President Trump does not think Dow declined due to US-China trade war, he said there are more tariffs but he wants to get a deal. He reiterated he thinks Fed rate hikes are ridiculous "
"2018-10-11 03:13:00","2018-10-11 11:13:00","US President Trump said he will not be happy with Saudi if they were behind the journalist's death"
"2018-10-11 02:57:00","2018-10-11 10:57:00","NHC says Hurricane Michael is expected to become a tropical storm by Thursday morning"
"2018-10-11 02:56:00","2018-10-11 10:56:00","NHC says Hurricane Michael is slowly weakening as it moves across South-Central Georgia, storm flooding gradually decreasing along the Gulf Coast"
"2018-10-11 02:55:00","2018-10-11 10:55:00","South Korean Finance Ministry Official says they are closely watching the FX markets"
"2018-10-11 02:33:00","2018-10-11 10:33:00","US Treasury Secretary Mnuchin met with PBoC Governor Yi Gang to discuss important economic issues"
"2018-10-11 02:17:00","2018-10-11 10:17:00","IMF Chief Lagarde says the global economy is probably not strong enough; she supported China's move towards currency flexibility"
"2018-10-11 02:08:00","2018-10-11 10:08:00","ASIA-PAC MID-SESSION UPDATE: Risk off, Risk off, Risk off!"
"2018-10-11 01:45:00","2018-10-11 09:45:00","BoJ MPC Member Sakurai says the central bank's growth forecast for the Japanese economy could be revised down depending on how protectionism and capital outflows from EMs spread; adding he expects price rises to pick up the pace"
"2018-10-11 01:43:00","2018-10-11 09:43:00","BoJ MPC Member Sakurai says the impact from trade protectionism could become larger on a global trade and supply chains"
"2018-10-11 01:33:00","2018-10-11 09:33:00","BoJ MPC Member Sakurai reiterates that it is important to continuously check for side effects; adding continuing easing under sound macroeconomic environment could cause imbalances to pile up"
"2018-10-11 01:31:00","2018-10-11 09:31:00","BoJ's MPC member Sakurai reiterates the central bank need to continue with easing persistently for the time being"
"2018-10-11 01:15:00","2018-10-11 09:15:00","PBoC sets CNY mid-point at 6.9098 (Prev. 6.9072)"
"2018-10-11 01:12:00","2018-10-11 09:12:00","PBoC skips open market operations for a net neutral daily position"
"2018-10-11 00:41:00","2018-10-11 08:41:00","Bank of Thailand official says the economy is capable of absorbing a rate hike"
"2018-10-11 00:37:00","2018-10-11 08:37:00","US Secretary of State Pompeo says the release of Pastor Brunson at the next court hearing on October 12th would be an important step"
"2018-10-11 00:30:00","2018-10-11 08:30:00","PRE-MARKET CHINESE  STOCK NEWS: Brilliance China Auto (1114 HK) – BMW (BMW GY) agrees to a long-term expansion of the JV, increasing its stake to 75% (Prev. 50%) with a deal value around EUR 3.6bln. (Newswires)"
"2018-10-11 00:00:00","2018-10-11 08:00:00","Australian MI Inflation Expectations 4.0% (Prev. 4.0%)"