"gmt_time","hk_time","subject"
"2018-11-16 21:18:00","2018-11-17 05:18:00","RANsquawk Week in Focus - week commencing 19 November 2018"
"2018-11-16 21:17:00","2018-11-17 05:17:00","RANsquawk Central Banks - 16 Nov 2018: Previewing ECB minutes,  RBA minutes, SARB meeting; reviewing Banxico"
"2018-11-16 21:15:00","2018-11-17 05:15:00","S&P affirms Switzerland at AAA; Outlook stable"
"2018-11-16 21:09:00","2018-11-17 05:09:00","S&P affirms Netherlands at AAA/A-1+; Outlook stable"
"2018-11-16 21:05:00","2018-11-17 05:05:00","RANsquawk US Market Wrap - US MARKET WRAP – 16 November 2018: Trump positive on China trade; Fed’s Clarida warns on global growth"
"2018-11-16 20:28:00","2018-11-17 04:28:00","Fed's Harker (non-voter) does not believe that a December rate hike is prudent; says there is rising uncertainty about the outlook"
"2018-11-16 20:25:00","2018-11-17 04:25:00","Tesla (TSLA) lawyers confident DOJ will not proceed with 'funding secured' case, and believe only serious outstanding DOJ/SEC issues involves Model 3 projections, according to FBN's Gasparino"
"2018-11-16 20:15:00","2018-11-17 04:15:00","Former Brexit Secretary Davis says US officials are receptive to a trade deal with the UK"
"2018-11-16 19:58:00","2018-11-17 03:58:00","Pfizer to Raise Prices on 41 Drugs, WSJ reports"
"2018-11-16 19:51:00","2018-11-17 03:51:00","RANSQUAWK Source note vague takeover chatter for Tesaro (TSRO) - Unconfirmed"
"2018-11-16 19:44:00","2018-11-17 03:44:00","Saudis want oil prices around USD 80/bbl, WSJ reports; Saudis want to chart energy policy independent of US goals"
"2018-11-16 19:43:00","2018-11-17 03:43:00","US forecasts a cut to Iranian crude sales by April of at least 40% to 900k BPD vs pre-sanctions levels, according to people familiar with the sanctions waivers."
"2018-11-16 19:33:00","2018-11-17 03:33:00","WTI futures (Z8, expires Monday) settles unchanged at USD 56.46/bbl; Brent (F9) settles USD 0.14 higher at USD 66.76/bbl"
"2018-11-16 18:27:00","2018-11-17 02:27:00","UK Brexit Secretary Barclay says we must continue to build on momentum to finalise Brexit agreement"
"2018-11-16 18:10:00","2018-11-17 02:10:00","White House officials say that US President Trump was simply expressing optimism about current negotiations with China when he mentioned a halt in tariffs, shouldn't believe a deal is imminent; CNBC"
"2018-11-16 18:00:00","2018-11-17 02:00:00","Baker Hughes Rig Count (16/Nov): Oil up 2 rigs at 888, gas down 1 rig at 194, total rigs up 1 at 1082"
"2018-11-16 17:49:00","2018-11-17 01:49:00","Irish Foreign Minister Coveney says no plans to start preparation of infrastructure for a potential hard border"
"2018-11-16 17:34:00","2018-11-17 01:34:00","US President Trump says China wants to make a deal on trade, but not acceptable as it is now; may not have to impose further tariffs "
"2018-11-16 17:08:00","2018-11-17 01:08:00","Canada's Finance Minister Morneau says oil price differential between US crude and Canada crude is a big challenge "
"2018-11-16 16:47:00","2018-11-17 00:47:00","Sources say they are looking at changing text of the withdrawal treaty to amend backstop, EU said text is done and dusted; FT"
"2018-11-16 16:32:00","2018-11-17 00:32:00","Fed's Evans (Non-Voter, Dove) says US economy is doing well and expects 3.25% GDP growth this year and 3.5% next year "
"2018-11-16 16:31:00","2018-11-17 00:31:00","EUROPEAN PRELIMINARY CASH EQUITY CLOSE: EURO STOXX 50 (-0.22%), FTSE 100 (-0.32%), DAX (-0.06%), CAC (-0.09%), IBEX (-0.10%), FTSE MIB (-0.06%), SMI (+0.35%)"
"2018-11-16 16:29:00","2018-11-17 00:29:00","Stephen Barclay to be new Brexit Secretary"
"2018-11-16 16:17:00","2018-11-17 00:17:00","NY Fed GDP nowcast: 2.6% (Prev. 2.7%)"
"2018-11-16 16:04:00","2018-11-17 00:04:00","US National Security Advisor Bolton praises deal to partially resume Kiruk oil exports"
"2018-11-16 16:01:00","2018-11-17 00:01:00","NY Fed: Total US household debt at a record USD 13.5trln in Q3, up USD 219bln from Q2; mortgage debt USD 9.1trln in Q3, up USD 141bln from Q2; serious delinquencies increased in student debt, credit card, flat in mortgage and auto"
"2018-11-16 15:54:00","2018-11-16 23:54:00","Amber Rudd returning to UK Cabinet as Work and Pensions Secretary; according to the Sunday Times"
"2018-11-16 15:45:00","2018-11-16 23:45:00","Of note for Seattle Genetics (SGEN), Adcetris patients review chemotherapy approval cell approved Lymphoma agency oncology"
"2018-11-16 15:36:00","2018-11-16 23:36:00","Weekly FX Wrap: Dollar dented by Fed growth pangs, Pound blighted by Brexit mayhem"
"2018-11-16 15:25:00","2018-11-16 23:25:00","Italian Deputy PM DI Maio says he is in agreement with ECB President Draghi that the nation must lower its debt"
"2018-11-16 15:21:00","2018-11-16 23:21:00","RANsquawk Week in Focus - Week in Focus; week commencing 19 November 2018"
"2018-11-16 15:16:00","2018-11-16 23:16:00","OPEC delegates state that a 1-1.4mln bpd cut is currently being discussed, as according to Platts "
"2018-11-16 15:02:00","2018-11-16 23:02:00","Irish PM Varadkar says does not see much in the way of room to renegotiate the Brexit deal"
"2018-11-16 14:54:00","2018-11-16 22:54:00","Reports suggest Leadsom and Mordaunt certainly want more concessions before the EUCO meet on Nov 25 and not made public declarations like Fox/Gove; according to SkyNews political editor"
"2018-11-16 14:52:00","2018-11-16 22:52:00","Officials from the EU27 have raised specific concerns about the draft Brexit deal agreed this week, according to diplomatic notes seen by BuzzFeed News from meetings that took place in Brussels on Thursday and Friday"
"2018-11-16 14:47:00","2018-11-16 22:47:00","Further reports are suggesting pro-Brexit ministers are meeting over the weekend to discuss concerns over UK PM May's deal, main issue remains backstop according to the BBC"
"2018-11-16 14:40:00","2018-11-16 22:40:00","Delta (DAL) has deferred the delivery of 10 Airbus (AIR FP) A350's, whilst still ordering 10 A330 neo's as according to sources"
"2018-11-16 14:38:00","2018-11-16 22:38:00","US Movers: Pacific Gas & Electric (PCG) +33.2%, Edison International (EIX) +13.5%, EOG Resources (EOG) +2%, NVIDIA (NVDA) -19.4%, Nordstrom (JWN) -13.1%, Applied Materials (AMAT) - 4.8%"
"2018-11-16 14:21:00","2018-11-16 22:21:00","Volkswagen (VOW3 GY) says they don't have sufficient production capacity to to build cars for 3rd party clients"
"2018-11-16 14:19:00","2018-11-16 22:19:00","Italy's government tells the EU the risks to its public finances are limited; adds recent rise in government bond yields is ""manageable"""
"2018-11-16 14:18:00","2018-11-16 22:18:00","Dutch PM Rutte says that EU countries are unlikely to make serious changes to the Brexit deal"
"2018-11-16 14:17:00","2018-11-16 22:17:00","Additional US Equity Stories - AMZN, AMGN, IBM, NOW, LLY, TSLA"
"2018-11-16 14:17:00","2018-11-16 22:17:00","Financial Times Correspondent Laura Hughes tweets, Hear Andrea Leadsom is convening the core Brexit Cabinet members in next couple of days. They “will discuss how to move dial.”"
"2018-11-16 14:05:00","2018-11-16 22:05:00","UK Conservative lawmaker Steve Baker says on BBCNews ""much more likely"" it'll be next week before 48 letters are in"
"2018-11-16 14:04:00","2018-11-16 22:04:00","Dutch PM Rutte says he doesn't support the idea of an EU military force, says NATO is the defense cornerstone"
"2018-11-16 14:01:00","2018-11-16 22:01:00","Azerbaijan aims to keep oil production at 38mln tonnes in 2018; according to Socar official"
"2018-11-16 14:00:00","2018-11-16 22:00:00","Saudi Arabia says Libya agrees to join decision on oil cuts; according to SPA "
"2018-11-16 13:49:00","2018-11-16 21:49:00","BBC Political Editor Laura Kuenssberg tweets, 2 more names - Chris Green and Marcus Fysh - to add to the 48 - but ERG don't expect we'll know for sure until Monday - Brady seems to have left SW1 for the weekend"
"2018-11-16 13:44:00","2018-11-16 21:44:00","Barrick (ABX) ""looking to trade"" some smaller assets in the Rangold (RRS LN) portfolio, according to Bristow"
"2018-11-16 13:43:00","2018-11-16 21:43:00","RANsquawk Daily US Equity Opening News - 16th November 2018"
"2018-11-16 13:43:00","2018-11-16 21:43:00","RANsquawk Daily US Equity Opening News - 16th November 2018"
"2018-11-16 13:37:00","2018-11-16 21:37:00","Fed's Kaplan (Dove, Non-voter) says increasing debt to GDP is a tailwind for now, but will become a headwind in the future; he adds global growth will be a little bit of a headwind and may spill to the US"
"2018-11-16 13:31:00","2018-11-16 21:31:00","Fed Vice Chair Clarida notes there is some volatility around stock markets at the moment, but no clear signal"
"2018-11-16 13:29:00","2018-11-16 21:29:00","EU Commission is said to take first steps in disciplining Italy on November 21st over its budget proposal"
"2018-11-16 13:24:00","2018-11-16 21:24:00","Sky News Correspondent Beth Rigby tweets, Steve Baker tells me he thinks an announcement of a vote could come today or next week (now more likely as MPs consult associations)"
"2018-11-16 13:10:00","2018-11-16 21:10:00","Telegraph reports that 22 Conservative Party MPs have now publicly declared their intent to submit motions of no confidence in PM May, after Chris Green MP just made his declaration"
"2018-11-16 13:08:00","2018-11-16 21:08:00","Scotiabank FX Daily - Cautious Powell Leaves USD With Small Weekly Loss  "
"2018-11-16 13:06:00","2018-11-16 21:06:00","Brexiteer Ministers will meet next week too ""unite around several coherent 'asks' "", focus on backstop exit mechanism, The Telegraph"
"2018-11-16 13:05:00","2018-11-16 21:05:00","UK Parliament chief whip said to have cancelled briefing with lawmakers on the Brexit deal today "
"2018-11-16 13:00:00","2018-11-16 21:00:00","ECB's Weidmann says monetary policy should be effective in reaching inflation mandate and leave enough room for market activity; sees no reason to depart from the pre-crisis monetary policy framework"
"2018-11-16 12:52:00","2018-11-16 20:52:00","UK Conservative lawmaker Steve Baker says ERG doesn't have a candidate to replace May, and he thinks they have the letters but MPs are possibly lying to him; according to MLex senior correspondent "
"2018-11-16 12:50:00","2018-11-16 20:50:00","20 MPs have publicly revealed they have called for the PM to go and almost certainly more have written in; according to The Guardian"
"2018-11-16 12:48:00","2018-11-16 20:48:00","Israel going for early election; according to Channel 10 news"
"2018-11-16 12:47:00","2018-11-16 20:47:00","""The Fed should rethink December rate increase. No other major central bank likely to raise rates soon. Fed needs to weigh whether it should expand the gulf between US and foreign monetary policies at a fragile moment""; according to WSJ editorial "
"2018-11-16 12:42:00","2018-11-16 20:42:00","Eurosceptic Minister Steve Baker says that they are not too far off of the required letters to trigger a leadership challenge"
"2018-11-16 12:32:00","2018-11-16 20:32:00","BBC's Nick Eardley tweets ""David Lidington (PM’s de facto deputy): “I think if those letters were to go in, she would win any vote decisively, and she’d deserve to do so.”!"
"2018-11-16 12:28:00","2018-11-16 20:28:00","Shell says process unit start up begun at Deer Park, Texas facility"
"2018-11-16 12:19:00","2018-11-16 20:19:00","Shipments from southern port of Basra fell 10% to 3.071mln BPD in first half of November vs. 3.41mln BPD in October; Sales from semi-autonomous Kurdish region in northern Iraq little changed at 397k BPD in 1H November vs. Prev. 398k BPD "
"2018-11-16 12:12:00","2018-11-16 20:12:00","Downing Street source says it's not true they are preparing for a no confidence motion; according to FT political correspondent Laura Hughes"
"2018-11-16 11:58:00","2018-11-16 19:58:00","When asked if he wants to become Brexit Secretary Liam Fox says he makes no speculation on that"
"2018-11-16 11:42:00","2018-11-16 19:42:00","BBC Political Editor Norman Smith tweets, Liam Fox issues veiled warning to hard line Brexiteers  -""We are not elected to do what we want but to do what is in the national interest."""
"2018-11-16 11:39:00","2018-11-16 19:39:00","Christopher Hope of The Telegraph speculates that Liam Fox could be a candidate for Brexit secretary"
"2018-11-16 11:38:00","2018-11-16 19:38:00","ITV Political Correspondent Carl Dinnen tweets brexiteers probably won’t mind if they lose a vote of confidence so long as they get enough votes against the Prime Minister to demonstrate that she cannot win the Meaningful Vote"
"2018-11-16 11:36:00","2018-11-16 19:36:00","Daily Telegraph Political Correspondent Christopher Hope tweets, Number 10 confirms there will be a Brexit secretary today or tomorrow. PM's deputy spokesman tells the morning Lobby: ""I would expect there will be another Brexit secretary."""
"2018-11-16 11:31:00","2018-11-16 19:31:00","ITV Political Correspondent Carl Dinnen tweets, Brexiteer source believes the 48 letters will be in soon. They are confident of their numbers and it is currently a matter of logistics."
"2018-11-16 11:30:00","2018-11-16 19:30:00","RANsquawk Daily US Opening News - 16th November 2018"
"2018-11-16 11:29:00","2018-11-16 19:29:00","Political Commentator Tom Harwood tweets, Steve Baker has told the ERG whatsapp group his letter count is over 48 with a dozen probables on top."
"2018-11-16 11:16:00","2018-11-16 19:16:00","RANsquawk EU Mid Session - 16th November 2018"
"2018-11-16 11:08:00","2018-11-16 19:08:00","Fixed Income: minor range deviation, but major Brexit infatuation"
"2018-11-16 11:07:00","2018-11-16 19:07:00","Michael Gove says he has confidence in PM May, adding that it is important to get the right deal and he is looking forward to working with colleagues in the government"
"2018-11-16 10:57:00","2018-11-16 18:57:00","FT Brussels Correspondent tweets, UK-EU negotiators will hold another two meetings over the weekend to thrash out the future relationship text ahead of a November 25 summit, Michael Barnier told the EU27 ambassadors today"
"2018-11-16 10:45:00","2018-11-16 18:45:00","Sky News political editor Beth Rigby tweets, Gove stays. A minister tells me; “PM can’t trust him now, he thinks he has leverage over her” and adds he should have gone to Brexit department rather than refusing"
"2018-11-16 10:44:00","2018-11-16 18:44:00","Daily Telegraph political correspondent Christopher Hope tweets, Brexit sources are expecting NO more resignations today over Theresa May's Brexit deal"
"2018-11-16 10:43:00","2018-11-16 18:43:00","Gordon Rayner political editor of Daily Telegraph tweets, Not expecting Leadsom, Mordaunt or Grayling to resign today. Leadsom and Mordaunt, at least, want to try to influence things from within, but I suspect they will go by November 25 if nothing change"
"2018-11-16 10:36:00","2018-11-16 18:36:00","Fox, Grayling, Mourdant and Leadsom have all agreed to stay, as according to Sunday Times"
"2018-11-16 10:30:00","2018-11-16 18:30:00","FX Morning Colour: Pound precarious again as pressure mounts on PM"
"2018-11-16 10:29:00","2018-11-16 18:29:00","Christopher Hope of the Telegraph ""But friends of Sir Graham Brady, the 1922 committee, suggest that the threshold has NOT yet been breached yet. One says: ""Nobody has told him."""""
"2018-11-16 10:24:00","2018-11-16 18:24:00","Supreme Court is to consider a case of whether the UK can unilaterally reverse Article 50"
"2018-11-16 10:23:00","2018-11-16 18:23:00","Telegraph reporter says he expects the numbers for the no confidence vote to be reached today, with the no confidence vote to take place on Tuesday"
"2018-11-16 10:22:00","2018-11-16 18:22:00","Nick Eardley of the BBC tweets ""Mark Francois hand delivering letter to Graham Brady office in Parliament just now"""
"2018-11-16 10:11:00","2018-11-16 18:11:00","Jennifer Rankin of the Guardian tweets ""EU Brexit schedule now agreed. Sunday: special Brexit meeting EU27 ambassadors. Monday: special Brexit EU27 Europe ministers Wheels in motion for Sunday 25 November summit"""
"2018-11-16 09:51:00","2018-11-16 17:51:00","Business Insider correspondent Adam Payne tweets, The ERG believes Graham Brady now has 48 letters, an ERG source tells me"
"2018-11-16 09:42:00","2018-11-16 17:42:00","James Forsyth Sun Columnist tweets, Hearing Gove is staying. Times suggests that he will remain as Environment Secretary"
"2018-11-16 09:25:00","2018-11-16 17:25:00","Tom Newton Dunn of the Sun tweets ""No10 now clarify: there will be no free vote for any Tory MPs, ministers or otherwise, on the Brexit deal."""
"2018-11-16 09:22:00","2018-11-16 17:22:00","French State Holdings Head states that there are 'several consortia' interested in making an approach for ADP (ADP FP)"
"2018-11-16 09:21:00","2018-11-16 17:21:00","Iraq's North Oil has resumed Kirkuk oil exports heading for the Turkish port off Ceyhan, according to sources "
"2018-11-16 09:11:00","2018-11-16 17:11:00","Beth Rigby Sky Deputy Political Editor tweets, Have this confirmed by a source close to the whips office. They are heading back to SW1. Source tells me it must now be likely that confidence vote happening. “Got to be close if not there already”"
"2018-11-16 09:00:00","2018-11-16 17:00:00","ASIA-PAC SERVICE HAS NOW FINISHED, PLEASE REVERT BACK TO YOUR ORIGINAL CHANNEL FOR COVERAGE ON THE UK & EUROPEAN SESSION"
"2018-11-16 08:57:00","2018-11-16 16:57:00","Editor of Brexit Central tweets ""Unconfirmed and from a single (always previously reliable) source - but hearing that the 48 letters are in and Downing Street are preparing for a no confidence motion in Theresa May as Conservative leader..."""
"2018-11-16 08:56:00","2018-11-16 16:56:00","Faisal Islam Sky Correspondent tweets No 10-friendly senior Conservative MPs have been given lists of a few dozen Tory Brexiters to phone up to coral into not sending/withdrawing 1922 letters. But not yet told to start calls."
"2018-11-16 08:56:00","2018-11-16 16:56:00","Faisal Islam Sky Correspondent tweets No 10-friendly senior Conservative MPs have been given lists of a few dozen Tory Brexiters to phone up to coral into not sending/withdrawing 1922 letters. But not yet told to start calls."
"2018-11-16 08:52:00","2018-11-16 16:52:00","BBC Political Correspondent Ross Hawkins tweets Michael Gove's parliamentary aide Kevin Hollinrake tells me Gove has ""got some decisions to make"". Says: ""I hope he'll support the PM I think we should all support the PM in whatever capacity we can"""
"2018-11-16 08:35:00","2018-11-16 16:35:00","Huffington Post Editor Paul Waugh tweets All Govt whips have just been told to cancel Friday constituency engagements and convene in Parliament today, one source tells me. "
"2018-11-16 08:30:00","2018-11-16 16:30:00","ECB's Draghi says the current slowdown has raised questions about the strength of the growth outlook, and we're seeing a temporary soft patch"
"2018-11-16 08:29:00","2018-11-16 16:29:00","Gilts and Short Sterling futures retreat further from Thursday’s lofty highs"
"2018-11-16 08:12:00","2018-11-16 16:12:00","ECB says banks borrowed 85mln at marginal rate & deposited EUR 571.1bln with it overnight"
"2018-11-16 08:05:00","2018-11-16 16:05:00","European equity movers this morning: Vivendi (VIV FP) +5.8%; Bollore (BOL FP) +3.3%; ABN Amro (ABN NA) +1.8%; Morphosys (MOR GY) +1.8%; AstraZeneca (AZN LN) -2.6%"
"2018-11-16 08:02:00","2018-11-16 16:02:00","UK PM May says she hasn't appointed a Brexit Secretary yet, and will do so in the coming days"
"2018-11-16 08:01:00","2018-11-16 16:01:00","Bunds: unwinding some Brexit and Italian budget premium"
"2018-11-16 07:43:00","2018-11-16 15:43:00","Tamara Cohen of Sky tweets ""May loyalist James Brokenshire claims the deal on offer “cements our precious union...if I thought it would break up the union I wouldn’t be supporting it”"""
"2018-11-16 07:39:00","2018-11-16 15:39:00","John Rentoul of the Independent tweets ""Even if Graham Brady has 48 letters, he doesn't have to announce it immediately, But more likely there aren’t anything like 48 letters"
"2018-11-16 07:38:00","2018-11-16 15:38:00","Beth Rigby of Sky tweets ""told last night by senior Brexiteer to expect a co-ordinated run of letter submissions today as May’s opponents try to get the confidence vote over the line. We’re expecting another to be announced around 9am"""
"2018-11-16 07:03:00","2018-11-16 15:03:00","Additional European equity stories post the release of the Daily European equity opening news"
"2018-11-16 06:59:00","2018-11-16 14:59:00","Option expiries of note for today's 10.00am NY cut (1500GMT)"
"2018-11-16 06:44:00","2018-11-16 14:44:00","DAILY EUROPEAN EQUITY OPENING NEWS"
"2018-11-16 06:29:00","2018-11-16 14:29:00","Goldman Sachs Under their base-case assumptions, estimate tariff policy will boost Y/Y core PCE inflation by nearly 0.2pp next summer"
"2018-11-16 06:24:00","2018-11-16 14:24:00","RANsquawk Daily European Opening News - 16th November 2018 "
"2018-11-16 06:15:00","2018-11-16 14:15:00","North Korea may have conducted a test of new long-range artillery, according to reports in Yonhap citing sources"
"2018-11-16 06:08:00","2018-11-16 14:08:00","EU's Dombrovskis says that the Italian budget ""significantly"" deviates from their commitments, and Rome is ""openly"" challenging the rules"
"2018-11-16 06:01:00","2018-11-16 14:01:00","Italy government coalition is said to have dropped plans for tax amnesty"
"2018-11-16 06:00:00","2018-11-16 14:00:00","EU Trade Commissioner Malmstrom believes that US wants a larger trade deal which includes agriculture, but says there is no chance EU will agree to a larger trade agreement"
"2018-11-16 05:59:00","2018-11-16 13:59:00","ESM's Regling expects accord on several topic before December"
"2018-11-16 05:44:00","2018-11-16 13:44:00","ASIA-PAC MARKET WRAP: Asia traded mixed as Brexit and US-China trade uncertainty kept the region tentative"
"2018-11-16 04:33:00","2018-11-16 12:33:00","FX-indexed real estate contracts of Turkey residents will be permitted in free trade zones, according to local press"
"2018-11-16 04:00:00","2018-11-16 12:00:00","Malaysia Current Account (Q3) 3.80B (Prev. 3.90B)"
"2018-11-16 04:00:00","2018-11-16 12:00:00","Malaysia GDP (Q3) Y/Y 4.4% vs. Exp. 4.6% (Prev. 4.5%)"
"2018-11-16 03:41:00","2018-11-16 11:41:00","Magnitude 6.6 earthquake strikes east of Solomon Islands "
"2018-11-16 03:22:00","2018-11-16 11:22:00","PRE-MARKET INDIA STOCK NEWS: RBI cancelled registration of 65 NBFCs for undisclosed reasons"
"2018-11-16 03:03:00","2018-11-16 11:03:00","PBoC says overall lending has kept to stable growth and financing conditions of private and small firms improved"
"2018-11-16 02:53:00","2018-11-16 10:53:00","Australia's regulator says will review capital of private health insurers to ensure capital is sufficient, adds review may find that capital requirement should be increased"
"2018-11-16 02:48:00","2018-11-16 10:48:00","Indonesia government is to ease foreign investment restrictions in some industries and will widen tax holiday facility"
"2018-11-16 02:40:00","2018-11-16 10:40:00","ASIA-PAC MID-SESSION UPDATE: Asia stocks are subdued amid lack of drivers and as momentum from Wall St waned"
"2018-11-16 02:29:00","2018-11-16 10:29:00","China's Ambassador to the US says US is one of China's most important partners and that China will not stop reform and opening up, also says China is prepared to work with US and that accusations against China are based on alternative facts"
"2018-11-16 02:14:00","2018-11-16 10:14:00","HT&E (HT1 AT) announces to repurchase as much as 10% of shares"
"2018-11-16 01:32:00","2018-11-16 09:32:00","China Agricultural Ministry confirms a new African swine fever outbreak in the Sichuan province"
"2018-11-16 01:27:00","2018-11-16 09:27:00","Toyota (7203 JT) Executive says expects to surpass 2018 China unit sales goal of 1.4mln vehicles"
"2018-11-16 01:15:00","2018-11-16 09:15:00","PBoC sets CNY mid-point at 6.9377 (Prev. 6.9392)"
"2018-11-16 01:11:00","2018-11-16 09:11:00","PBoC skips open market operations and are net neutral for a 2nd consecutive week"
"2018-11-16 01:10:00","2018-11-16 09:10:00","BoJ offers to buy JPY 450bln in 5yr-10yr, JPY 180bln in 10yr-25yr and JPY 50bln in 25yr+ JGBs"
"2018-11-16 01:01:00","2018-11-16 09:01:00","PRE-MARKET CHINESE  STOCK NEWS: US and China are reportedly to step up efforts to strike G20 truce on trade "
"2018-11-16 00:58:00","2018-11-16 08:58:00","Australia is said to take WTO action against India regarding sugar subsidies"
"2018-11-16 00:49:00","2018-11-16 08:49:00","Japanese Finance Minister Aso says exports were probably impacted by trade issues although corporate profits remain very high"
"2018-11-16 00:30:00","2018-11-16 08:30:00","Singapore Non-Oil Exports (Oct) Y/Y 8.3% vs. Exp. 1.0% (Prev. 8.3%)"
"2018-11-16 00:30:00","2018-11-16 08:30:00","Singapore Non-Oil Exports (Oct) M/M 4.2% vs. Exp. 2.8% (Prev. -4.3%)"
"2018-11-16 00:21:00","2018-11-16 08:21:00","PRE-MARKET TAIWAN AND SINGAPORE NEWS: TSMC (2330 TT) booked a narrower than expected loss of USD 84.3mln after a computer virus affected operations in August"
"2018-11-16 00:07:00","2018-11-16 08:07:00","Asia stocks begin with modest gains as regions gets a tailwind from Wall St where trade optimism and rebound in both tech and financials lifted all majors"